name,source,source_url,servings,prep_time_min,cook_time_min,total_time_min,image_url,ingredients_json,cook_steps
Spiced Tomato Soup,vegan_richa_indian_web,https://www.veganricha.com/spiced-tomato-soup-recipe/,2,10,20,30,https://www.veganricha.com/wp-content/uploads/2016/09/Indian-Spiced-Tomato-Soup-7142.jpg,"[{""raw_text"": ""1/2 teaspoon oil"", ""source_position"": 1}, {""raw_text"": ""1/4 teaspoon cumin seeds"", ""source_position"": 2}, {""raw_text"": ""1/2 cup chopped onion"", ""source_position"": 3}, {""raw_text"": ""3 cloves garlic"", ""source_position"": 4}, {""raw_text"": ""1/4 cup chopped carrot (or 1 medium carrot, chopped)"", ""source_position"": 5}, {""raw_text"": ""1/2 teaspoon ground coriander"", ""source_position"": 6}, {""raw_text"": ""1/4 teaspoon turmeric"", ""source_position"": 7}, {""raw_text"": ""1/4 teaspoon cayenne"", ""source_position"": 8}, {""raw_text"": ""1/4 teaspoon black pepper ( or a combination of black and white pepper)"", ""source_position"": 9}, {""raw_text"": ""15 ounces canned tomatoes (or chopped fresh tomatoes or a mix )"", ""source_position"": 10}, {""raw_text"": ""1 cup water"", ""source_position"": 11}, {""raw_text"": ""1/2 teaspoon salt"", ""source_position"": 12}, {""raw_text"": ""1 1/2 to 2 teaspoons sugar"", ""source_position"": 13}, {""raw_text"": ""1 small bay leaf"", ""source_position"": 14}]","[{""step_number"": 1, ""instruction"": ""Heat oil in a saucepan over medium heat. When hot, add cumin seeds and cook for 1 minute or until the cumin seeds get fragrant. Add chopped onions, garlic, carrot and a pinch of salt. Cook for 4 to 5 minutes or until onions are translucent, stirring occasionally. Add the coriander, turmeric, cayenne and pepper, and mix for a few seconds.""}, {""step_number"": 2, ""instruction"": ""Add the onion mixture to a blender along with the tomatoes and water and blend until pureed.""}, {""step_number"": 3, ""instruction"": ""Transfer the pureed tomato mixture back to the saucepan. Add bay leaf, salt and sugar and cook over medium heat for 12 to 14 minutes. Taste and adjust salt, sweet and heat. Adjust consistency by adding more water if needed. Garnish with green onions, vegan butter or non dairy cream and serve with crusty bread, croutons, or vegan grilled cheese sandwiches.""}]"
Dal Fry,vegan_richa_indian_web,https://www.veganricha.com/dal-fry-spiced-indian-lentil-soup/,3,15,30,45,https://www.veganricha.com/wp-content/uploads/2015/07/Dal-Fry-6947.jpg,"[{""raw_text"": ""1/3 cup red lentils (, masoor dal)"", ""source_position"": 1}, {""raw_text"": ""1/4 cup petite yellow lentils (yellow mung dal or use red lentils)"", ""source_position"": 2}, {""raw_text"": ""3 cups water"", ""source_position"": 3}, {""raw_text"": ""2 teaspoons oil"", ""source_position"": 4}, {""raw_text"": ""1/2 teaspoon cumin seeds"", ""source_position"": 5}, {""raw_text"": ""1/2 teaspoon black mustard seeds"", ""source_position"": 6}, {""raw_text"": ""a generous pinch of asafetida (hing), optional (omit if you do not have gluten-free asafetida to make gluten-free)"", ""source_position"": 7}, {""raw_text"": ""1 hot green chili such as Serrano, Indian or Thai, (finely chopped)"", ""source_position"": 8}, {""raw_text"": ""1 cup chopped red or white onion"", ""source_position"": 9}, {""raw_text"": ""5 or more cloves of garlic (finely chopped)"", ""source_position"": 10}, {""raw_text"": ""1\"" ginger (finely chopped)"", ""source_position"": 11}, {""raw_text"": ""1 teaspoon ground coriander (or garam masala or both )"", ""source_position"": 12}, {""raw_text"": ""1/2 teaspoon turmeric"", ""source_position"": 13}, {""raw_text"": ""1/4 teaspoon or more cayenne/red chili powder (optional)"", ""source_position"": 14}, {""raw_text"": ""1 large tomato (chopped small)"", ""source_position"": 15}, {""raw_text"": ""1 teaspoon lemon juice"", ""source_position"": 16}, {""raw_text"": ""3/4 teaspoon or more salt"", ""source_position"": 17}, {""raw_text"": ""1/3 cup packed chopped cilantro (divided)"", ""source_position"": 18}]","[{""step_number"": 1, ""instruction"": ""Wash the red and yellow lentils , drain. Combine in a saucepan with water over medium heat. Cook for 18 to 20 minutes or until yellow lentils are tender. Reduce heat to low and simmer.""}, {""step_number"": 2, ""instruction"": ""Heat oil in a skillet over medium heat. when the oil is hot, add the cumin seeds and mustard seeds . Let them start to sizzle and pop. The cumin seeds should darken in color and get fragrant, mustard seeds will lighten and start to sizzle and pop. Add asafetida, green chili, onion, garlic, ginger and a pinch of salt . Cook until the onions turn translucent, about 5 -7 minutes. Stir occasionally. Add splashes of water in between to cook evenly.""}, {""step_number"": 3, ""instruction"": ""Add coriander/ garam masala , turmeric, and cayenne and mix well. Add tomatoes, lemon juice and a splash of water and mix. Cook until the tomatoes are saucy. Mash the larger pieces. About 6 minutes.""}, {""step_number"": 4, ""instruction"": ""Add the cooked lentils to the skillet. Add salt and half of the chopped cilantro , and continue to simmer the soup for 3 to 4 minutes, or until bubbling. Taste and adjust salt and spice. Add a dash of lemon juice if needed.""}, {""step_number"": 5, ""instruction"": ""Garnish with cilantro and serve hot with rice or flatbread with a side of roasted veggies or Indian spiced vegetable side.""}, {""step_number"": 6, ""instruction"": ""Or, cook the lentils in an Instant Pot with 1.5 to 2 cups water for 3 minutes at high pressure with a 5 minute quick release. Add the tempering from the skillet and simmer on sauté mode for 2 minutes. Garnish and serve.""}, {""step_number"": 7, ""instruction"": ""Heat oil in a skillet over medium heat. when the oil is hot, add the cumin seeds and mustard seeds . Let them start to sizzle and pop. The cumin seeds should change color and get fragrant.""}, {""step_number"": 8, ""instruction"": ""Add asafetida, chili, onion, garlic, ginger and a pinch of salt . Cook until the onions turn translucent, about 5 to 7 minutes. Stir occasionally. Add splashes of water to help cook them evenly""}, {""step_number"": 9, ""instruction"": ""Add coriander, turmeric, and cayenne and mix well.""}, {""step_number"": 10, ""instruction"": ""Add tomatoes, lemon juice and a tablespoon of water and mix. Cook until the tomatoes are saucy. Mash the larger pieces. About 6 minutes.""}]"
Spicy Lentil Bean Stew,vegan_richa_indian_web,https://www.veganricha.com/lentil-bean-stew/,4,15,30,45,https://www.veganricha.com/wp-content/uploads/2025/01/Spiced-Curried-Lentil-Bean-Stew-9817.jpg,"[{""raw_text"": ""1 teaspoon black pepper"", ""source_position"": 1}, {""raw_text"": ""2 teaspoons Kashmiri chili powder (or paprika)"", ""source_position"": 2}, {""raw_text"": ""½ teaspoon ground cardamom"", ""source_position"": 3}, {""raw_text"": ""1/4 teaspoon ground cinnamon ((scant measure as some brands have a stronger flavor) )"", ""source_position"": 4}, {""raw_text"": ""1/8 teaspoon ground clove"", ""source_position"": 5}, {""raw_text"": ""2 teaspoons ground coriander"", ""source_position"": 6}, {""raw_text"": ""1 teaspoon garam masala (or curry powder )"", ""source_position"": 7}, {""raw_text"": ""2 teaspoons oil"", ""source_position"": 8}, {""raw_text"": ""1½ cups chopped onion"", ""source_position"": 9}, {""raw_text"": ""1 bay leaf"", ""source_position"": 10}, {""raw_text"": ""1 black cardamom pod (partially opened (optional))"", ""source_position"": 11}, {""raw_text"": ""¼ teaspoon crushed fennel seeds"", ""source_position"": 12}, {""raw_text"": ""2 tablespoons ginger-garlic paste (or use 5 cloves garlic minced and half an inch ginger minced )"", ""source_position"": 13}, {""raw_text"": ""1 cup chopped tomato (or ½ cup tomato purée or Passata)"", ""source_position"": 14}, {""raw_text"": ""1/2 teaspoon salt (divided)"", ""source_position"": 15}, {""raw_text"": ""15 oz can full-fat coconut milk"", ""source_position"": 16}, {""raw_text"": ""1½ cups water or stock"", ""source_position"": 17}, {""raw_text"": ""¼ to ⅓ cup split red lentils"", ""source_position"": 18}, {""raw_text"": ""15 oz can white beans"", ""source_position"": 19}, {""raw_text"": ""½ cup frozen spinach (thawed or 2 oz fresh chopped spinach )"", ""source_position"": 20}, {""raw_text"": ""cilantro, lemon juice, red pepper flakes (for garnish)"", ""source_position"": 21}, {""raw_text"": ""non-dairy cream or yogurt (for garnish, optional)"", ""source_position"": 22}]","[{""step_number"": 1, ""instruction"": ""In a small bowl, combine all of the spice mix ingredients, and any optional spices and set this aside.""}, {""step_number"": 2, ""instruction"": ""Heat a large skillet over medium-high heat and add the oil. Once the oil is hot, add the onion and a generous pinch of salt. Mix and cook until the onions turn translucent, about 3 minutes or so.""}, {""step_number"": 3, ""instruction"": ""Mix in the bay leaf, black cardamom, and crushed fennel seeds. Cook for another 3 to 4 minutes, and add a splash of water to help the onions cook evenly. Once the onions are starting to turn golden, add in about ¾ of your spice mix along with a splash of water to keep the spices from burning. Cook this for 10 to 15 seconds, reduce the heat to medium, then mix in the ginger-garlic paste, tomato, and another splash of water. Cook, until the tomatoes become jammy, about 3 to 5 minutes, stirring frequently to the tomatoes don’t scorch. Make sure to press the larger pieces of tomato to help them break down.""}, {""step_number"": 4, ""instruction"": ""When the mixture starts to leave the sides of the pan and you see a sheen of oil on the top, mix in the coconut milk, water or stock, and the remaining salt. Add the lentils and white beans, and mix those in, as well. Partially cover and cook for 12 to 15 minutes, or until the lentils are cooked to preference. Check in at the 12-minute mark, and if they’re not done yet, cover again and keep simmering.""}, {""step_number"": 5, ""instruction"": ""Open the lid and fold in the frozen spinach and cook for 1 more minute. Taste and adjust the salt and flavor, adding more salt, if needed. Add a splash of lemon juice for tang, and add ¼ teaspoon or more sugar or maple syrup to balance out the savoriness and heat, if needed.""}, {""step_number"": 6, ""instruction"": ""Switch off the heat and sprinkle the remaining spice blend on top. Garnish with cilantro, lemon juice, red pepper flakes, and optional non-dairy cream or yogurt. Serve this hot, delicious stew with sourdough, garlic bread, naan, flatbread, rice, quinoa, baked potatoes, or cauliflower steaks.""}]"
Vegetable Hakka Noodles,vegan_richa_indian_web,https://www.veganricha.com/vegetable-hakka-noodles-1-pot-indo-chinese-noodles/,3,10,20,30,https://www.veganricha.com/wp-content/uploads/2017/05/vegan-hakka-noodles-burger-2313.jpg,"[{""raw_text"": ""6 to 7 oz Hakka noodles ( or ramen or soba, use gluten-free, if needed)"", ""source_position"": 1}, {""raw_text"": ""2 teaspoons oil"", ""source_position"": 2}, {""raw_text"": ""1 small onion (thinly sliced)"", ""source_position"": 3}, {""raw_text"": ""4 cloves of garlic (finely chopped)"", ""source_position"": 4}, {""raw_text"": ""1 inch ginger (finely chopped)"", ""source_position"": 5}, {""raw_text"": ""1/2 red bell pepper ( thinly sliced)"", ""source_position"": 6}, {""raw_text"": ""1/2 green bell pepper (thinly sliced)"", ""source_position"": 7}, {""raw_text"": ""1 cup packed thinly sliced cabbage"", ""source_position"": 8}, {""raw_text"": ""1/2 cup thinly sliced or julienned carrots"", ""source_position"": 9}, {""raw_text"": ""1 tablespoon soy sauce (or tamari or coconut aminos for soy-free)"", ""source_position"": 10}, {""raw_text"": ""1 teaspoon rice vinegar"", ""source_position"": 11}, {""raw_text"": ""2 teaspoons sambal oelek (or more, to taste. Or use sriracha or other chile garlic sauce of choice.)"", ""source_position"": 12}, {""raw_text"": ""1 tablespoon water"", ""source_position"": 13}, {""raw_text"": ""1/4 teaspoon salt (or to taste)"", ""source_position"": 14}, {""raw_text"": ""1/2 teaspoon black pepper"", ""source_position"": 15}, {""raw_text"": ""green onion ( for garnish)"", ""source_position"": 16}]","[{""step_number"": 1, ""instruction"": ""Cook the noodles according to instructions on package. Drain, rinse with cold water and set aside.""}, {""step_number"": 2, ""instruction"": ""In a large skillet or wok, heat oil over medium high heat. When hot, Add the onions, garlic, and ginger . Mix and cook until translucent, 1-2 minutes. Add the rest of the veggies and a pinch of salt and cook until golden on some edges, 2 minutes.""}, {""step_number"": 3, ""instruction"": ""Meanwhile, mix the soy sauce, vinegar, chili sauce, and water in a bowl. Add this to the skillet and mix well. Add the cooked noodles and toss well to combine. Add salt and pepper generously, and mix to combine. Taste and adjust salt, heat, and black pepper. Cover and cook for a minute. Garnish with green onions and serve.""}, {""step_number"": 4, ""instruction"": ""Cook the noodles according to instructions on package and, drain, rinse with cold water set aside.""}, {""step_number"": 5, ""instruction"": ""In a large skillet or wok, heat oil over medium high heat. When hot, Add the onions, garlic, and ginger . Mix and cook until translucent, 1-2 minutes. Add the rest of the veggies and a pinch of salt and cook until golden on some edges, 2 to 3 minutes.""}]"
Tikki Chole (Spiced Potato Patties with Chickpea curry),vegan_richa_indian_web,https://www.veganricha.com/potato-quinoa-patties-with-chickpea/,4,20,45,65,https://www.veganricha.com/wp-content/uploads/2013/07/Tikki-Chole-8030.jpg,"[{""raw_text"": ""3 medium potatoes boiled and mashed"", ""source_position"": 1}, {""raw_text"": ""1 cup cooked quinoa (or use cooked millet or couscous or rice or omit , (1/3 cup uncooked quinoa ))"", ""source_position"": 2}, {""raw_text"": ""1/2 cup chopped onion (red or white finely chopped)"", ""source_position"": 3}, {""raw_text"": ""1 hot green chili (such as Serrano or Indian, finely chopped)"", ""source_position"": 4}, {""raw_text"": ""1/2 cup chopped cilantro"", ""source_position"": 5}, {""raw_text"": ""1 tablespoon chopped ginger"", ""source_position"": 6}, {""raw_text"": ""1/2 teaspoon carom seeds (- Ajwain, or use cumin seeds)"", ""source_position"": 7}, {""raw_text"": ""1/2 teaspoon Cayenne or paprika"", ""source_position"": 8}, {""raw_text"": ""1 teaspoon ground coriander"", ""source_position"": 9}, {""raw_text"": ""1/4 teaspoon kala namak (black salt, optional or use 1/2 teaspoon chaat masala blend)"", ""source_position"": 10}, {""raw_text"": ""3/4 teaspoon salt (or to taste)"", ""source_position"": 11}, {""raw_text"": ""1 slice stale bread (crumbled (omit to make gluten-free or use coarsely ground oats))"", ""source_position"": 12}, {""raw_text"": ""1 teaspoon oil"", ""source_position"": 13}, {""raw_text"": ""1/2 teaspoon cumin seeds"", ""source_position"": 14}, {""raw_text"": ""1 black cardamom (partially opened)"", ""source_position"": 15}, {""raw_text"": ""2 bay leaves"", ""source_position"": 16}, {""raw_text"": ""2 whole cloves"", ""source_position"": 17}, {""raw_text"": ""1/2 cup chopped onion"", ""source_position"": 18}, {""raw_text"": ""1/2 teaspoon salt (divided)"", ""source_position"": 19}, {""raw_text"": ""2 teaspoons Kashmiri chili powder"", ""source_position"": 20}, {""raw_text"": ""1 tablespoon ground coriander"", ""source_position"": 21}, {""raw_text"": ""1 teaspoon chole masala blend (or use garam masala)"", ""source_position"": 22}, {""raw_text"": ""1/2 teaspoon dried fenugreek leaves"", ""source_position"": 23}, {""raw_text"": ""1/4 teaspoon kala namak (or 1/2 teaspoon dried mango powder)"", ""source_position"": 24}, {""raw_text"": ""1 tablespoon ginger garlic paste (or 1/2 inch ginger and 4 cloves garlic, minced)"", ""source_position"": 25}, {""raw_text"": ""2 tablespoons non dairy yogurt"", ""source_position"": 26}, {""raw_text"": ""1 teaspoon minced ginger"", ""source_position"": 27}, {""raw_text"": ""1 cup water (or more, if needed)"", ""source_position"": 28}, {""raw_text"": ""15 ounce can of chickpeas (drained, or use 1 1/2 cups cooked chickpeas)"", ""source_position"": 29}, {""raw_text"": ""cilantro, lemon juice, and pepper flakes for garnish"", ""source_position"": 30}]","[{""step_number"": 1, ""instruction"": ""Cook the potatoes and quinoa if you haven’t already. Add the uncooked potatoes and quinoa to a saucepan of water over medium heat . Bring to a boil then cover and simmer for 15 to 20 minutes, until the potatoes are tender. Drain and add to a large bowl.""}, {""step_number"": 2, ""instruction"": ""Mash the potatoes and quinoa well. Add the rest of the tikki ingredients , mix well. Add more breadcrumbs if needed. Shape into patties and pan fry or bake them. See baking instructions in notes below. Heat 2 teaspoons oil in a skillet over medium heat. When hot, add the potato patties. Cook for 3 minutes or longer until golden then flip and cook the other side as well until golden and crisp. Short on time or missing spices for the chickpea curry? Make just these delicious potato patties and serve with your favorite dip or chutney.""}, {""step_number"": 3, ""instruction"": ""Heat a skillet over medium-high heat. Add the oil , and once the oil is hot, add the cumin seeds and cook them until they're very fragrant and change color significantly, about 1/2 to 1 minute. Then, add in the black cardamom, bay leaves, and cloves. Mix in for 15 to 20 seconds, then stir in the onion and 1/4 teaspoon of the salt . Continue to cook until the onion is golden, adding splashes of water in between to help the onions cook evenly, 6 to 8 minutes.""}, {""step_number"": 4, ""instruction"": ""Then, stir in all of the ground spices and two tablespoons of water, and then add the ginger garlic paste . Mix in and cook this for about a minute, so that the spices and the ginger garlic paste can cook and get roasted.""}, {""step_number"": 5, ""instruction"": ""Add in the non-dairy yogurt, minced ginger, remaining 1/4 teaspoon salt, 1 cup of water, and chickpeas and bring to a boil. Cover with the lid, reduce the heat to medium, and continue to simmer this for about 10 minutes or longer.""}, {""step_number"": 6, ""instruction"": ""Open the lid and adjust the consistency by adding more water, if needed. Taste it and adjust the salt and flavor, adding more salt, heat, or tang, if needed. Mash some of the chickpeas, and switch off the heat. Garnish with cilantro, pepper flakes and lemon juice.""}, {""step_number"": 7, ""instruction"": ""To serve the tikki chole, add a good helping of the chickpea curry and top it with the potato patties . Top the whole mixture with some chopped onion, tomato, cucumber, a squeeze of lemon juice, salt, and pepper and serve. You can also drizzle some chutneys, like tamarind chutney or mango chutney and some non-dairy yogurt, for an authentic Indian street food experience.""}, {""step_number"": 8, ""instruction"": ""Add the potatoes and quinoa to a pan of water. Bring to a boil then cover and simmer for 15 to 20 minutes, until the potatoes are tender. Drain and transfer to a bowl. In a large bowl, mash the potatoes well. Add the rest of the ingredients, mix well.""}, {""step_number"": 9, ""instruction"": ""Shape into patties and pan fry or bake them. See baking instructions in notes below. Heat 2 teaspoons oil in a skillet over medium heat. When hot, add the potato patties. Cook for 3 minutes or longer until golden then flip and cook the other side as well until golden and crisp.. Make these potato patties after you’ve made the chickpea curry as they the best texture when freshly pan fried or baked.""}, {""step_number"": 10, ""instruction"": ""Make the chickpea curry : Heat a skillet over medium-high heat. Add the oil , and once the oil is hot, add the cumin seeds and cook them until they’re very fragrant and change color significantly, about 1/2 to 1 minute. Then, add in the black cardamom, bay leaves, and cloves.""}, {""step_number"": 11, ""instruction"": ""Mix in for 15 to 20 seconds, then stir in the onion and 1/4 teaspoon of the salt . Continue to cook until the onion is golden, adding splashes of water in between to help the onions cook evenly, 6 to 8 minutes.""}, {""step_number"": 12, ""instruction"": ""Then, stir in all of the ground spices and two tablespoons of water, and then add the ginger garlic paste . Mix in and cook this for about a minute, so that the spices and the ginger garlic paste can cook down a little bit and get nicely roasted.""}, {""step_number"": 13, ""instruction"": ""Add in the non-dairy yogurt, minced ginger, remaining 1/4 teaspoon salt, 1 cup of water, and chickpeas and bring to a boil. Cover with the lid, reduce the heat to medium, and continue to simmer this for about 10 minutes.""}, {""step_number"": 14, ""instruction"": ""Open the lid and adjust the consistency by adding more water, if needed. Taste it and adjust the salt and flavor, adding more salt, heat, or tang, if needed. Mash some of the chickpeas, and switch off the heat.""}, {""step_number"": 15, ""instruction"": ""To serve the tikki chole, add a good helping of the chickpea curry and top it with the potato patties. Top the whole mixture with some chopped onion, tomato, cucumber, a squeeze of lemon juice, salt, and pepper and serve. You can also drizzle some chutneys, like tamarind chutney or mango chutney and some non-dairy yogurt, for an authentic Indian street food experience.""}]"
Nepali Aloo (Crispy Spiced Garlic Vinegar Potatoes),vegan_richa_indian_web,https://www.veganricha.com/nepali-aloo/,4,10,20,30,https://www.veganricha.com/wp-content/uploads/2009/04/Nepali-Aloo-6816.jpg,"[{""raw_text"": ""1 teaspoon oil"", ""source_position"": 1}, {""raw_text"": ""3 cups peeled and sliced yellow potatoes"", ""source_position"": 2}, {""raw_text"": ""2 teaspoon oil"", ""source_position"": 3}, {""raw_text"": ""1/2 teaspoon brown or black mustard seeds"", ""source_position"": 4}, {""raw_text"": ""1/2 teaspoon cumin seeds"", ""source_position"": 5}, {""raw_text"": ""1 ” ginger (peeled and julienned)"", ""source_position"": 6}, {""raw_text"": ""5 cloves garlic (peeled and julienned)"", ""source_position"": 7}, {""raw_text"": ""1 to 3 green chilies (julienned (use 1 Serrano or Indian chili, 1/2 Thai chili, or 3+ chilies if they’re very mild))"", ""source_position"": 8}, {""raw_text"": ""1/4 teaspoon turmeric (or more, to taste)"", ""source_position"": 9}, {""raw_text"": ""1/3 teaspoon salt"", ""source_position"": 10}, {""raw_text"": ""2 teaspoons white vinegar (or rice vinegar)"", ""source_position"": 11}]","[{""step_number"": 1, ""instruction"": ""Peel and cube the potatoes, if you haven’t already. Heat a skillet over medium-high heat and add a teaspoon of oil. Once the oil is hot, add the potatoes and spread them evenly in the pan, so they don/t overlap. Let them sit undisturbed for a minute or two, then mix and flip.""}, {""step_number"": 2, ""instruction"": ""Cover the skillet with a lid, reduce the heat to medium-low, and continue to cook for about 5 minutes. Open the lid, flip the potatoes, and then cover again, and cook for another 6 to 8 minutes until they are cooked to your preference. Stir once in between and even them out, so they’re not overlapping too much. The potatoes will crisp on the edges but stay soft in the middle. Depending on your stove, you may need to turn the heat up to medium to cook them faster. If you’re using baby potatoes, add 1/4 cup of water before covering with the lid and cooking for 10 to 15 minutes until they are cooked through. Remove the potatoes from the skillet and set them aside.""}, {""step_number"": 3, ""instruction"": ""In the same skillet, add the remaining teaspoon of oil and heat it over medium-high heat. Once the oil is hot, add the mustard seeds and cumin seeds. Cook until the mustard seeds start to pop or at least change color/lighten a bit and sizzle rapidly. The cumin seeds should become fragrant and darken significantly. Depending on your stove and skillet, the mustard seeds may not pop, but they should still lighten in color and become aromatic.""}, {""step_number"": 4, ""instruction"": ""Reduce the heat to low and allow the skillet to cool slightly for a few seconds. Then, add the julienned ginger, garlic, green chilies and a pinch of salt. Mix everything well and cook over low heat until the garlic turns golden and is fully cooked.""}, {""step_number"": 5, ""instruction"": ""Add in the crispy potatoes along with the turmeric, salt, and vinegar. Mix really well, tossing well to coat. Let the mixture cook for about a minute to cook the vinegar a little bit. Taste and adjust the salt and flavor, then switch off the heat.Serve these potatoes hot with a side of dal and some plain rice or Indian fried rice. You can also garnish with cilantro, but I also like them as-is.""}]"
