name,source,source_url,servings,prep_time_min,cook_time_min,total_time_min,image_url,ingredients_json,cook_steps
"Sakkarai Pongal Recipe (Chakkara Pongal, Sweet Pongal)",whiskaffair_indian_state_web,https://www.whiskaffair.com/sakkarai-pongal-sweet-pongal/,8,5,30,35,https://www.whiskaffair.com/wp-content/uploads/2021/02/Sakkarai-Pongal-2-3.jpg,"[{""raw_text"": ""½ cup short grain white rice (I used Sona Masuri )"", ""source_position"": 1}, {""raw_text"": ""3 tablespoons yellow moong dal (skinned petite yellow lentils)"", ""source_position"": 2}, {""raw_text"": ""1 teaspoon chana dal"", ""source_position"": 3}, {""raw_text"": ""1 cup water"", ""source_position"": 4}, {""raw_text"": ""1 and ½ cups crushed jaggery"", ""source_position"": 5}, {""raw_text"": ""2-4 green cardamom pods (crushed)"", ""source_position"": 6}, {""raw_text"": ""2 cloves (crushed)"", ""source_position"": 7}, {""raw_text"": ""⅛ teaspoon nutmeg powder"", ""source_position"": 8}, {""raw_text"": ""4 tablespoons ghee"", ""source_position"": 9}, {""raw_text"": ""12-15 whole cashew nuts"", ""source_position"": 10}, {""raw_text"": ""12-15 raisins"", ""source_position"": 11}]","[{""step_number"": 1, ""instruction"": ""Wash ½ cup short-grain rice 2-3 times with water. Drain and set aside. Wash 3 tablespoons of yellow moong dal and 1 teaspoon of chana dal a few times with water. Drain as much water as possible . To remove excess water, spread the lentils on a kitchen towel and let them drain for 10-15 minutes .""}, {""step_number"": 2, ""instruction"": ""Press the SAUTE button on the Instant Pot. Transfer the lentils to the Instant Pot and dry-roast until lightly browned (5-6 minutes) , stirring frequently. This step is quick but non-negotiable. It eliminates any raw smell and adds a toasty undertone to the finished pongal.""}, {""step_number"": 3, ""instruction"": ""Now, add the rinsed rice to the cooker. Add 3 cups of water and stir until well combined.""}, {""step_number"": 4, ""instruction"": ""Close the cooker’s lid and set the valve to the sealing position.""}, {""step_number"": 5, ""instruction"": ""Press PRESSURE COOK and set the timer to 15 minutes. Once the timer goes off, let the pressure release for 10 minutes. Release the remaining pressure manually. Open the lid and mash the cooked rice and lentils using a ladle or a wire whisk until creamy.""}, {""step_number"": 6, ""instruction"": ""The mixture should look very soft and overcooked, almost porridge-like. If not, add more water and cook for 2-3 more minutes.""}, {""step_number"": 7, ""instruction"": ""Wash rice 2-3 times with water. Drain and set aside.""}, {""step_number"": 8, ""instruction"": ""Wash yellow moong dal and chana dal a few times with water. Drain the water as much as you can.""}, {""step_number"": 9, ""instruction"": ""Press the SAUTE button on the Instant Pot.""}, {""step_number"": 10, ""instruction"": ""Transfer the lentils to the Instant Pot and dry-roast until lightly browned (5-6 minutes), stirring frequently.""}, {""step_number"": 11, ""instruction"": ""Now, add the rinsed rice to the cooker.""}, {""step_number"": 12, ""instruction"": ""Add 3 cups of water and stir to combine.""}, {""step_number"": 13, ""instruction"": ""Close the lid of the cooker and set the valve to the sealing position.""}, {""step_number"": 14, ""instruction"": ""Press PRESSURE COOK and set the timer to 15 minutes.""}, {""step_number"": 15, ""instruction"": ""Open the lid and mash the cooked rice and lentils using a ladle or a wire whisk until creamy.""}, {""step_number"": 16, ""instruction"": ""Transfer the rinsed lentils to a stovetop pressure cooker and roast on medium heat until they are lightly browned (5-6 minutes), stirring frequently.""}, {""step_number"": 17, ""instruction"": ""Add 3 and ½ cups of water, compared to the 3 cups used in the Instant Pot, and stir to combine.""}, {""step_number"": 18, ""instruction"": ""Cook for 1 whistle on high heat. Reduce the heat to low and cook for 15 minutes.""}, {""step_number"": 19, ""instruction"": ""Remove the cooker from the heat and let the pressure release naturally. Open the lid and mash the cooked rice and lentils using a ladle or a wire whisk until creamy.""}, {""step_number"": 20, ""instruction"": ""While the rice and lentils are cooking, make jaggery syrup. Add jaggery and water to a saucepan.""}, {""step_number"": 21, ""instruction"": ""Cook over medium heat just until the jaggery dissolves and the mixture comes to a rolling boil. Stir frequently while cooking.""}, {""step_number"": 22, ""instruction"": ""Strain the mixture through a fine-mesh strainer.""}, {""step_number"": 23, ""instruction"": ""Add the warm jaggery mixture, cardamoms, cloves, and nutmeg powder to the cooker and mix well.""}, {""step_number"": 24, ""instruction"": ""Heat ghee in a small skillet over medium-high heat.""}, {""step_number"": 25, ""instruction"": ""Once the ghee is hot, add 8-10 whole cashew nuts and fry until slightly browned and crisp (1-2 minutes).""}, {""step_number"": 26, ""instruction"": ""Add raisins and fry until they plump up (5-6 seconds). Do not add raisins along with cashew nuts; otherwise, they will burn before the cashew nuts turn brown.""}, {""step_number"": 27, ""instruction"": ""Pour the tempering over the pongal. Mix well and serve hot or at room temperature.""}]"
Beetroot Poriyal Recipe (South Indian Beetroot Stir Fry With Coconut),whiskaffair_indian_state_web,https://www.whiskaffair.com/beetroot-poriyal/,4,10,20,30,https://www.whiskaffair.com/wp-content/uploads/2018/12/Beetroot-Poriyal-2-3.jpg,"[{""raw_text"": ""500 grams fresh beetroot"", ""source_position"": 1}, {""raw_text"": ""1 teaspoon salt (or to taste)"", ""source_position"": 2}, {""raw_text"": ""1 tablespoon oil"", ""source_position"": 3}, {""raw_text"": ""½ teaspoon white urad dal (split and skinned black gram lentils)"", ""source_position"": 4}, {""raw_text"": ""1 teaspoon brown mustard seeds"", ""source_position"": 5}, {""raw_text"": ""¼ teaspoon asafetida (hing) (skip for gluten-free)"", ""source_position"": 6}, {""raw_text"": ""2-3 green chilies (slit into half)"", ""source_position"": 7}, {""raw_text"": ""1 teaspoon grated ginger"", ""source_position"": 8}, {""raw_text"": ""10-12 curry leaves"", ""source_position"": 9}, {""raw_text"": ""¼ cup grated fresh coconut"", ""source_position"": 10}]","[{""step_number"": 1, ""instruction"": ""Peel 500 g beetroot using a vegetable peeler. Discard the top and bottom ½ inch of the beetroot and rinse it. Chop them into small pieces (¼ inch). Add the chopped beetroots to a pressure cooker with 1 teaspoon of salt and 2 tablespoons of water. Stir well.""}, {""step_number"": 2, ""instruction"": ""Wear gloves or rub a little oil on your palms before peeling and chopping teh beetroots. Beetroot juice stains skin, cutting boards, and white shirts you forgot you were wearing.""}, {""step_number"": 3, ""instruction"": ""Pressure cook for 1 whistle over high heat. Reduce the heat to low and cook for 5 minutes. Remove the cooker from the heat and immediately run it under cold water. Open the lid.""}, {""step_number"": 4, ""instruction"": ""You can also cook the beetroot in an Instant Pot. Add chopped beetroot, salt, and water to an Instant Pot. Secure the lid. Press PRESSURE COOK and set the timer to 2 minutes at high pressure. Once the timer goes off, do a 5-minute NPR, then QPR. Open the lid.""}, {""step_number"": 5, ""instruction"": ""Peel the beetroot using a vegetable peeler. Discard ½ inch from the top and bottom and rinse the beetroot.""}, {""step_number"": 6, ""instruction"": ""Chop them into small pieces (¼ inch).""}, {""step_number"": 7, ""instruction"": ""Add the chopped beetroots to a pressure cooker along with salt and 2 tbsp water. Stir well.""}, {""step_number"": 8, ""instruction"": ""Pressure cook for 1 whistle over high heat. Reduce the heat to low and cook for 5 minutes.""}, {""step_number"": 9, ""instruction"": ""Remove the cooker from heat and immediately run it under cold water. Open the lid.""}, {""step_number"": 10, ""instruction"": ""Heat oil in a pan over medium-high heat.""}, {""step_number"": 11, ""instruction"": ""Once the oil is hot, add urad dal, mustard seeds, and asafetida, and let them crackle for 4-5 seconds.""}, {""step_number"": 12, ""instruction"": ""Add green chilies, ginger, and curry leaves, and cook for 10-12 seconds.""}, {""step_number"": 13, ""instruction"": ""Add the cooked beetroots along with the leftover water and cook for a minute.""}, {""step_number"": 14, ""instruction"": ""Now add fresh coconut and mix well.""}, {""step_number"": 15, ""instruction"": ""Check for salt and add more if required.""}, {""step_number"": 16, ""instruction"": ""Serve hot with steamed rice and dal or rasam.""}]"
"Raw Mango Rice Recipe (Mavinakayi Chitranna, Mamidikaya Pulihora)",whiskaffair_indian_state_web,https://www.whiskaffair.com/raw-mango-rice-recipe/,4,10,10,20,https://www.whiskaffair.com/wp-content/uploads/2021/04/Mango-Rice-2-3.jpg,"[{""raw_text"": ""2 tablespoons oil"", ""source_position"": 1}, {""raw_text"": ""1 teaspoon brown mustard seeds"", ""source_position"": 2}, {""raw_text"": ""1 teaspoon split and husked black gram (white urad dal)"", ""source_position"": 3}, {""raw_text"": ""1 teaspoon Bengal gram (chana dal)"", ""source_position"": 4}, {""raw_text"": ""10-12 curry leaves"", ""source_position"": 5}, {""raw_text"": ""2-3 whole dry red chilies"", ""source_position"": 6}, {""raw_text"": ""¼ teaspoon asafetida (hing)"", ""source_position"": 7}, {""raw_text"": ""1 cup peeled and grated green raw mangoes"", ""source_position"": 8}, {""raw_text"": ""2 teaspoons chopped green chilies"", ""source_position"": 9}, {""raw_text"": ""1 teaspoon finely chopped ginger"", ""source_position"": 10}, {""raw_text"": ""2 cups cooked and cooled white rice"", ""source_position"": 11}, {""raw_text"": ""½ teaspoon turmeric powder"", ""source_position"": 12}, {""raw_text"": ""¼ cup roasted peanuts"", ""source_position"": 13}, {""raw_text"": ""½ teaspoon salt (or to taste)"", ""source_position"": 14}, {""raw_text"": ""2 tablespoons chopped cilantro (fresh coriander leaves)"", ""source_position"": 15}]","[{""step_number"": 1, ""instruction"": ""Next, prepare the green mangoes. Choose firm and tart mangoes and wash them well with water. Wipe the mangoes using a kitchen towel and peel them using a sharp paring knife. Now grate the mangoes using the small hole of a box grater. Discard the pit. Note – Don’t throw away the pit. You can use them while cooking the lentils. It will add a nice tang to them.""}, {""step_number"": 2, ""instruction"": ""Heat oil in a pan over medium-high heat.""}, {""step_number"": 3, ""instruction"": ""Once the oil is hot, add mustard seeds, white urad dal, chana dal, curry leaves, dry red chilies, and asafetida (hing), and fry until the dal turns a little brown (1-2 minutes). Stir frequently while frying.""}, {""step_number"": 4, ""instruction"": ""Add raw mangoes, green chilies, and ginger, and cook for 2-3 minutes, stirring frequently.""}, {""step_number"": 5, ""instruction"": ""Add cooked rice, turmeric powder, peanuts, and salt, and mix well.""}, {""step_number"": 6, ""instruction"": ""Reduce the heat to low and cook for 2-3 minutes.""}, {""step_number"": 7, ""instruction"": ""Check for salt and add more if needed.""}, {""step_number"": 8, ""instruction"": ""Finally, add cilantro and mix well. Serve hot!""}]"
"Ghee Rice Recipe (Nei Choru, Neychoru)",whiskaffair_indian_state_web,https://www.whiskaffair.com/ghee-rice-recipe/,3,10,20,60,https://www.whiskaffair.com/wp-content/uploads/2020/09/Ghee-Rice-2-3.jpg,"[{""raw_text"": ""1 cup white rice"", ""source_position"": 1}, {""raw_text"": ""3 tablespoons ghee (clarified butter)"", ""source_position"": 2}, {""raw_text"": ""1 inch piece of cinnamon stick (dalchini)"", ""source_position"": 3}, {""raw_text"": ""2 whole green cardamoms (hari elaichi)"", ""source_position"": 4}, {""raw_text"": ""2-3 cloves (laung)"", ""source_position"": 5}, {""raw_text"": ""2-3 whole black peppercorns (kali mirch)"", ""source_position"": 6}, {""raw_text"": ""5-6 whole cashew nuts"", ""source_position"": 7}, {""raw_text"": ""10-12 raisins"", ""source_position"": 8}, {""raw_text"": ""½ cup thinly sliced onions"", ""source_position"": 9}, {""raw_text"": ""2-3 green chilies (slit into half)"", ""source_position"": 10}, {""raw_text"": ""½ teaspoon salt"", ""source_position"": 11}, {""raw_text"": ""2 cups water"", ""source_position"": 12}]","[{""step_number"": 1, ""instruction"": ""Rinse 1 cup of white rice with water 2-3 times until the water runs clear. Soak it in 4-5 cups of water for 30 minutes.""}, {""step_number"": 2, ""instruction"": ""Heat 3 tablespoon ghee in a pan over medium heat.""}, {""step_number"": 3, ""instruction"": ""Rinse rice with water 2-3 times until the water runs clear. Soak it in 4-5 cups of water for 30 minutes.""}, {""step_number"": 4, ""instruction"": ""Heat ghee in a pan over medium heat.""}, {""step_number"": 5, ""instruction"": ""Once the ghee is hot, add cashew nuts and fry until they are light brown in color. Stir frequently while frying.""}, {""step_number"": 6, ""instruction"": ""Now add raisins to the pan and fry until they plump up.""}, {""step_number"": 7, ""instruction"": ""Remove the cashew nuts and raisins to a bowl and keep them aside.""}, {""step_number"": 8, ""instruction"": ""Add cinnamon stick, green cardamoms, cloves, and black peppercorns, and let them crackle for 3-4 seconds.""}, {""step_number"": 9, ""instruction"": ""Add onions to the and fry until they turn dark brown in color (4-5 minutes), stirring frequently.""}, {""step_number"": 10, ""instruction"": ""Drain the rice and add it to the pan along with green chilies, water, salt, and fried cashew nuts and raisins. Stir gently.""}, {""step_number"": 11, ""instruction"": ""Reduce the heat to low.""}, {""step_number"": 12, ""instruction"": ""Cover the pan with a tight-fitting lid and cook undisturbed for 20-25 minutes until all the liquid is absorbed and the rice is cooked well.""}, {""step_number"": 13, ""instruction"": ""Remove the pan from heat and let it rest for 5 minutes.""}, {""step_number"": 14, ""instruction"": ""Garnish with chopped cilantro and crispy fried onions and serve hot.""}]"
Beetroot Curd Rice Recipe,whiskaffair_indian_state_web,https://www.whiskaffair.com/beetroot-curd-rice-recipe/,2,5,20,45,https://www.whiskaffair.com/wp-content/uploads/2022/07/Beetroot-Curd-Rice-2-3.jpg,"[{""raw_text"": ""½ cup raw short grain white rice"", ""source_position"": 1}, {""raw_text"": ""½ cup plain yogurt (dahi, curd)"", ""source_position"": 2}, {""raw_text"": ""¼ cup milk"", ""source_position"": 3}, {""raw_text"": ""1 medium beetroot (peeled)"", ""source_position"": 4}, {""raw_text"": ""½ teaspoon salt (or to taste)"", ""source_position"": 5}, {""raw_text"": ""2 tablespoons canola oil (or sesame oil, coconut oil)"", ""source_position"": 6}, {""raw_text"": ""1 and ½ teaspoons brown mustard seeds"", ""source_position"": 7}, {""raw_text"": ""10-12 curry leaves"", ""source_position"": 8}, {""raw_text"": ""1 teaspoon white urad dal"", ""source_position"": 9}, {""raw_text"": ""½ teaspoon grated ginger"", ""source_position"": 10}, {""raw_text"": ""1 dry red chili (broken into small pieces)"", ""source_position"": 11}, {""raw_text"": ""1 tablespoon chopped cilantro (chopped coriander leaves) (chopped)"", ""source_position"": 12}, {""raw_text"": ""2 tablespoons pomegranate seeds"", ""source_position"": 13}]","[{""step_number"": 1, ""instruction"": ""Rinse ½ cup of short-grain white rice with water 2-3 times until the water runs clear.""}, {""step_number"": 2, ""instruction"": ""Drain the water and add the rice to a pressure cooker. Place a medium-sized whole, peeled beetroot in the cooker and pour 1 ½ cups of water into it.""}, {""step_number"": 3, ""instruction"": ""Close the cooker’s lid and cook the rice for 3 whistles on high heat.""}, {""step_number"": 4, ""instruction"": ""Remove the cooker from the heat and let the pressure release naturally. Open the lid.""}, {""step_number"": 5, ""instruction"": ""You can also cook the rice and beetroot in an Instant Pot. Add ½ cup of rice, 1 cup of water, and beetroot to an Instant Pot. Close the lid and set the valve to the sealing position. Press PRESSURE COOK and set the timer to 6 minutes at high pressure. Once the timer goes off, let the pressure release naturally for 10 minutes. Release the remaining pressure manually and open the lid.""}, {""step_number"": 6, ""instruction"": ""Rinse white rice with water 2-3 times until the water runs clear.""}, {""step_number"": 7, ""instruction"": ""Drain the water and add the rice to a pressure cooker. Keep a medium-sized whole peeled beetroot in the cooker and pour 1 and ½ cups of water in the cooker.""}, {""step_number"": 8, ""instruction"": ""Close the lid of the cooker and cook the rice for 3 whistles on high heat.""}, {""step_number"": 9, ""instruction"": ""Bring the cooked rice and beetroot to room temperature.""}, {""step_number"": 10, ""instruction"": ""Remove the beetroot from the cooker using a spoon or a tong and transfer it to a blender.""}, {""step_number"": 11, ""instruction"": ""Blend to make a smooth puree.""}, {""step_number"": 12, ""instruction"": ""Transfer the cooled rice to a medium mixing bowl along with yogurt, milk, beetroot puree, and salt, and mix well.""}, {""step_number"": 13, ""instruction"": ""Slightly mash the mixture using your hands.""}, {""step_number"": 14, ""instruction"": ""Check for salt and add more if required.""}, {""step_number"": 15, ""instruction"": ""Heat oil in a small pan over medium-high heat.""}, {""step_number"": 16, ""instruction"": ""Once the oil is hot, add mustard seeds and curry leaves and let them crackle for 4-5 seconds.""}, {""step_number"": 17, ""instruction"": ""Add urad dal, ginger, and red chili and fry until dal turns slightly brown, stirring continuously.""}, {""step_number"": 18, ""instruction"": ""Pour the tempering over the curd rice and mix well. Chill the rice for 2-3 hours.""}, {""step_number"": 19, ""instruction"": ""Garnish with fresh coriander and pomegranate seeds. Serve chilled with rice papads.""}]"
Paneer Masala Recipe,whiskaffair_indian_state_web,https://www.whiskaffair.com/paneer-masala-recipe/,4,10,30,40,https://www.whiskaffair.com/wp-content/uploads/2020/08/Dhaba-Style-Paneer-Masala-2-3.jpg,"[{""raw_text"": ""14 ounces paneer (400 g, cut into 1-inch pieces)"", ""source_position"": 1}, {""raw_text"": ""½ teaspoon salt"", ""source_position"": 2}, {""raw_text"": ""½ teaspoon Kashmiri red chili powder"", ""source_position"": 3}, {""raw_text"": ""½ teaspoon turmeric powder"", ""source_position"": 4}, {""raw_text"": ""2 tablespoons oil"", ""source_position"": 5}, {""raw_text"": ""2 tablespoons ghee"", ""source_position"": 6}, {""raw_text"": ""2 green cardamoms (hari elaichi) (crushed)"", ""source_position"": 7}, {""raw_text"": ""2-3 cloves (laung) (crushed)"", ""source_position"": 8}, {""raw_text"": ""5-6 black peppercorns (kali mirch) (crushed)"", ""source_position"": 9}, {""raw_text"": ""1 inch piece of cinnamon stick (dalchini) (crushed)"", ""source_position"": 10}, {""raw_text"": ""3-4 whole dry red chilies"", ""source_position"": 11}, {""raw_text"": ""1 teaspoon cumin seeds"", ""source_position"": 12}, {""raw_text"": ""¼ teaspoon asafetida (hing)"", ""source_position"": 13}, {""raw_text"": ""1 cup finely chopped onions"", ""source_position"": 14}, {""raw_text"": ""2 teaspoons ginger garlic paste"", ""source_position"": 15}, {""raw_text"": ""2 teaspoons coriander powder"", ""source_position"": 16}, {""raw_text"": ""2 teaspoons Kashmiri red chili powder"", ""source_position"": 17}, {""raw_text"": ""½ teaspoon cumin powder"", ""source_position"": 18}, {""raw_text"": ""½ teaspoon garam masala powder"", ""source_position"": 19}, {""raw_text"": ""2 tablespoons roasted besan (chickpea flour, gram flour)"", ""source_position"": 20}, {""raw_text"": ""1 teaspoon salt (or to taste)"", ""source_position"": 21}, {""raw_text"": ""1 cup grated tomatoes"", ""source_position"": 22}, {""raw_text"": ""2-3 green chilies (slit into half)"", ""source_position"": 23}, {""raw_text"": ""2 tablespoons crushed Kasuri methi"", ""source_position"": 24}, {""raw_text"": ""1 tablespoons freshly squeezed lime juice"", ""source_position"": 25}, {""raw_text"": ""2 tablespoons chopped cilantro (fresh coriander leaves)"", ""source_position"": 26}]","[{""step_number"": 1, ""instruction"": ""Rinse 14 oz (400 g) of paneer slabs and cut them into 1-inch pieces. Tip – If using store-bought paneer, then soak it in hot water for 10 minutes to make it soft.""}, {""step_number"": 2, ""instruction"": ""Mix the paneer pieces with the following ingredients in a large mixing bowl and keep aside for 15 minutes.""}, {""step_number"": 3, ""instruction"": ""Rinse paneer slabs and cut them into 1-inch pieces.""}, {""step_number"": 4, ""instruction"": ""Mix the paneer pieces with salt, chili powder, and turmeric powder in a large mixing bowl and keep aside for 15 minutes.""}, {""step_number"": 5, ""instruction"": ""Heat oil in a pan over medium-high heat.""}, {""step_number"": 6, ""instruction"": ""Arrange the paneer on the pan in a single layer and fry from all sides until browned.""}, {""step_number"": 7, ""instruction"": ""Note – Fry in batches if the paneer pieces are not fitting in a single layer.""}, {""step_number"": 8, ""instruction"": ""Remove the paneer from the pan and keep it aside.""}, {""step_number"": 9, ""instruction"": ""Add oil and ghee to the same pan and heat over medium-high heat.""}, {""step_number"": 10, ""instruction"": ""Once the oil is hot, add cardamoms, cloves, black peppercorns, cinnamon, dry red chilies, cumin seeds, and asafetida, and fry for 5-6 seconds.""}, {""step_number"": 11, ""instruction"": ""Add onions and fry until it turns slightly brown (6-8 minutes), stirring frequently.""}, {""step_number"": 12, ""instruction"": ""Add ginger garlic paste and fry until the onions are nicely browned (6-8 minutes), stirring frequently.""}, {""step_number"": 13, ""instruction"": ""Now add coriander powder, turmeric powder, red chili powder, cumin powder, garam masala powder, besan, and, salt, and fry for 10-12 seconds.""}, {""step_number"": 14, ""instruction"": ""Add tomatoes and green chilies and cook until the oil starts to separate from the sides of the pan (3-4 minutes), stirring frequently.""}, {""step_number"": 15, ""instruction"": ""Now add 1 cup of water, fried paneer pieces, and Kasuri methi, and mix well. Cook for 2-3 minutes, stirring a few times in between.""}, {""step_number"": 16, ""instruction"": ""Finally, add lime juice and cilantro and mix well.""}, {""step_number"": 17, ""instruction"": ""Check for salt and add more if needed.""}, {""step_number"": 18, ""instruction"": ""Serve hot with roti.""}]"
