name,source,source_url,servings,prep_time_min,cook_time_min,total_time_min,image_url,ingredients_json,cook_steps
Ellu Sadam Recipe (South Indian Sesame Rice),whiskaffair_indian_state_web,https://www.whiskaffair.com/ellu-sadam-recipe-sesame-rice-recipe/,4,10,20,30,https://www.whiskaffair.com/wp-content/uploads/2019/01/Ellu-Sadam-2-3.jpg,"[{""raw_text"": ""2 and ½ cups cooked and cooled rice"", ""source_position"": 1}, {""raw_text"": ""2 teaspoons salt"", ""source_position"": 2}, {""raw_text"": ""3 tablespoons chana dal (Bengal gram lentil)"", ""source_position"": 3}, {""raw_text"": ""3 tablespoons white urad dal (split and skinned black gram)"", ""source_position"": 4}, {""raw_text"": ""¼ cup white sesame seeds (or black sesame seeds)"", ""source_position"": 5}, {""raw_text"": ""3 tablespoons raw peanuts"", ""source_position"": 6}, {""raw_text"": ""5-6 whole dry red chilies (stalks removed)"", ""source_position"": 7}, {""raw_text"": ""2 tablespoons grated fresh coconut"", ""source_position"": 8}, {""raw_text"": ""¼ teaspoon hing (asafetida) (skip for gluten-free)"", ""source_position"": 9}, {""raw_text"": ""3 tablespoons sesame oil (gingelly oil)"", ""source_position"": 10}, {""raw_text"": ""½ teaspoon brown mustard seeds"", ""source_position"": 11}, {""raw_text"": ""½ teaspoon cumin seeds"", ""source_position"": 12}, {""raw_text"": ""10-12 whole curry leaves"", ""source_position"": 13}]","[{""step_number"": 1, ""instruction"": ""Add the following ingredients to a pan and dry-roast over medium-low heat until browned and fragrant, stirring frequently.""}, {""step_number"": 2, ""instruction"": ""5-6 dry red chilies (stalks removed)""}, {""step_number"": 3, ""instruction"": ""Remove the pan from the heat and let the roasted ingredients cool completely. Note – Cooling the ingredients completely is essential; otherwise, they will release oil while grinding.""}, {""step_number"": 4, ""instruction"": ""Add the roasted ingredients to a grinder or a food processor along with ¼ teaspoon asafetida and pulse to make a fine powder. Note: Do not grind in one go; the ingredients may heat up and release oil.""}, {""step_number"": 5, ""instruction"": ""Add chana dal, urad dal, sesame seeds, peanuts, red chilies, and coconut to a pan and dry roast over medium-low heat until brown and fragrant, stirring frequently.""}, {""step_number"": 6, ""instruction"": ""Remove the pan from the heat and let the roasted ingredients cool completely.""}, {""step_number"": 7, ""instruction"": ""Note – Cooling the ingredients completely is important otherwise they will release oil while grinding.""}, {""step_number"": 8, ""instruction"": ""Add the roasted ingredients to a grinder or a food processor along with asafetida and pulse to make a fine powder.""}, {""step_number"": 9, ""instruction"": ""Note – Do not grind in one go as the ingredients may get heated and release oil.""}, {""step_number"": 10, ""instruction"": ""Transfer rice to a large mixing bowl.""}, {""step_number"": 11, ""instruction"": ""Add the sesame seeds powder and salt to the bowl and mix well to coat the rice with the powder.""}, {""step_number"": 12, ""instruction"": ""Heat oil in a small pan over medium heat.""}, {""step_number"": 13, ""instruction"": ""When the oil is hot, add mustard seeds, cumin seeds, and curry leaves, and let them crackle for 4-5 seconds.""}, {""step_number"": 14, ""instruction"": ""Pour the tempering over the rice and mix well.""}, {""step_number"": 15, ""instruction"": ""Serve the rice cold or heat it until warm!""}]"
Kahwa Recipe (Kashmiri Kahwa Tea),whiskaffair_indian_state_web,https://www.whiskaffair.com/authentic-kashmiri-tea-kahwa-recipe/,2,5,10,15,https://www.whiskaffair.com/wp-content/uploads/2019/01/Kashmiri-Kahwa-Tea-2-3.jpg,"[{""raw_text"": ""3 cups water"", ""source_position"": 1}, {""raw_text"": ""10-12 strands saffron (plus 3-4 more for serving)"", ""source_position"": 2}, {""raw_text"": ""½ inch piece of cinnamon stick (dalchini)"", ""source_position"": 3}, {""raw_text"": ""1 clove (laung)"", ""source_position"": 4}, {""raw_text"": ""1 whole green cardamom (hari elaichi) (lightly crushed)"", ""source_position"": 5}, {""raw_text"": ""½ teaspoon dried rose petals"", ""source_position"": 6}, {""raw_text"": ""1 teaspoon Kashmiri green tea (or any other green tea)"", ""source_position"": 7}, {""raw_text"": ""2 teaspoons almonds (thinly silvered)"", ""source_position"": 8}, {""raw_text"": ""2 teaspoons honey (optional)"", ""source_position"": 9}]","[{""step_number"": 1, ""instruction"": ""Heat 3 cups of water in a pan over medium-high heat. Once the water comes to a boil, reduce the heat to low. Add the following ingredients to the hot water, then let it simmer for 3-4 minutes.""}, {""step_number"": 2, ""instruction"": ""12 strands of saffron ½ inch piece of cinnamon stick 1 clove 1 green cardamom ½ teaspoon dried rose petals""}, {""step_number"": 3, ""instruction"": ""Switch off the heat. A dd 1 teaspoon Kashmiri green tea to the pan and stir gently.""}, {""step_number"": 4, ""instruction"": ""Let the tea steep for 30-40 seconds.""}, {""step_number"": 5, ""instruction"": ""Add 1 teaspoon of slivered almonds and 1-2 strands of saffron to each cup. Add honey if you like your kahwa slightly sweet.""}, {""step_number"": 6, ""instruction"": ""Serve hot.""}, {""step_number"": 7, ""instruction"": ""Heat water in a pan over medium-high heat.""}, {""step_number"": 8, ""instruction"": ""Once the water comes to a boil, reduce the heat to low.""}, {""step_number"": 9, ""instruction"": ""Add saffron, cinnamon, clove, cardamom, and dried rose petals to the pan and let the water simmer for 3-4 minutes.""}, {""step_number"": 10, ""instruction"": ""Switch off the heat.""}, {""step_number"": 11, ""instruction"": ""Add green tea to the pan and stir gently.""}, {""step_number"": 12, ""instruction"": ""Add 1 teaspoon of slivered almond slivers and 1-2 strands of saffron to each cup.""}, {""step_number"": 13, ""instruction"": ""Add honey if you like your kahwa slightly sweet. Serve hot.""}]"
Beetroot Raita Recipe (Beet Raita),whiskaffair_indian_state_web,https://www.whiskaffair.com/roasted-beetroot-raita-recipe/,4,5,15,20,https://www.whiskaffair.com/wp-content/uploads/2018/12/Beetroot-Raita-2-3.jpg,"[{""raw_text"": ""100 grams beetroots (or 1 medium-sized beetroot, peeled and cut into ½ inch cubes)"", ""source_position"": 1}, {""raw_text"": ""¼ cup water (plus 2 cups for boiling the beets)"", ""source_position"": 2}, {""raw_text"": ""2 cups chilled plain yogurt (dahi, curd)"", ""source_position"": 3}, {""raw_text"": ""½ teaspoon salt (or to taste)"", ""source_position"": 4}, {""raw_text"": ""1 teaspoon roasted cumin powder"", ""source_position"": 5}, {""raw_text"": ""2 teaspoons finely chopped green chilies (or to taste)"", ""source_position"": 6}, {""raw_text"": ""2 tablespoons oil"", ""source_position"": 7}, {""raw_text"": ""½ teaspoon brown mustard seeds"", ""source_position"": 8}, {""raw_text"": ""10-12 whole curry leaves"", ""source_position"": 9}, {""raw_text"": ""2 whole dry red chilies"", ""source_position"": 10}, {""raw_text"": ""2 tablespoons crushed raw peanuts"", ""source_position"": 11}]","[{""step_number"": 1, ""instruction"": ""Wash 100 g (1 medium-sized) beetroot and peel it using a vegetable peeler. Chop off ½-inch pieces from the top and bottom and cut the beetroots into ½-inch cubes.""}, {""step_number"": 2, ""instruction"": ""Tip – Be cautious when handling beets. They leave permanent marks on the clothes and color the surfaces that come into contact with them. Use an old chopping board and knife, and wear an apron. Chop the green chilies.""}, {""step_number"": 3, ""instruction"": ""Heat 2 cups of water in a pan over medium-high heat. Once the water comes to a boil, add the beetroots. Cover the pan with a lid and cook until they are softened (8-10 minutes).""}, {""step_number"": 4, ""instruction"": ""Note – You can also cook the beetroot in a traditional pressure cooker or instant pot. I am sharing the methods in notes, just in case you want to check.""}, {""step_number"": 5, ""instruction"": ""Drain the water and add the beetroot to a blender along with ¼ cup of cold water. Blend to make a smooth puree.""}, {""step_number"": 6, ""instruction"": ""Tip – You can use the leftover water from boiling the beets to make curries or knead the dough.""}, {""step_number"": 7, ""instruction"": ""Add yogurt to a bowl and whisk it until it is smooth and creamy.""}, {""step_number"": 8, ""instruction"": ""Add the beetroot puree, salt, cumin powder, and green chilies to the bowl and mix well.""}, {""step_number"": 9, ""instruction"": ""Note – You can add some water to thin the raita if it is thick for your liking. The ideal consistency should be like that of custard.""}, {""step_number"": 10, ""instruction"": ""Heat oil in a small skillet over medium-high heat.""}, {""step_number"": 11, ""instruction"": ""Once the oil is hot, add mustard seeds and curry leaves and let them crackle for 4-5 seconds.""}, {""step_number"": 12, ""instruction"": ""Add dry red chilies and lightly crushed peanuts to the skillet and fry until they are crispy and golden brown in color.""}, {""step_number"": 13, ""instruction"": ""Pour the tempering over the beet raita and stir well. Serve chilled.""}, {""step_number"": 14, ""instruction"": ""Tip – Save some tempering for garnishing.""}]"
Cold Coffee Recipe,whiskaffair_indian_state_web,https://www.whiskaffair.com/cold-coffee-recipe/,2,2,2,4,https://www.whiskaffair.com/wp-content/uploads/2021/03/Cold-Coffee-2-3.jpg,"[{""raw_text"": ""4 teaspoons instant coffee powder"", ""source_position"": 1}, {""raw_text"": ""1 tablespoon granulated white sugar"", ""source_position"": 2}, {""raw_text"": ""2 tablespoons warm milk"", ""source_position"": 3}, {""raw_text"": ""2 cups chilled milk (whole, skim, low fat or plant-based)"", ""source_position"": 4}, {""raw_text"": ""1 tablespoons milk powder (dairy whitener)"", ""source_position"": 5}, {""raw_text"": ""2 scoops vanilla ice cream"", ""source_position"": 6}, {""raw_text"": ""3-4 ice cubes"", ""source_position"": 7}]","[{""step_number"": 1, ""instruction"": ""Garnish two tall glasses by drizzling some chocolate syrup on the sides. Freeze the glasses for 10 minutes.""}, {""step_number"": 2, ""instruction"": ""Stir together the following ingredients in a small mixing bowl.""}, {""step_number"": 3, ""instruction"": ""teaspoon instant coffee powder 2 tablespoon granulated white sugar 2 tablespoon warm milk""}, {""step_number"": 4, ""instruction"": ""Mix until the sugar is dissolved.""}, {""step_number"": 5, ""instruction"": ""Add the following ingredients to the medium jar of a blender and blend for a minute.""}, {""step_number"": 6, ""instruction"": ""coffee mixture Check for sugar and add more if needed.""}, {""step_number"": 7, ""instruction"": ""Pour the coffee into the prepared glasses.""}, {""step_number"": 8, ""instruction"": ""Scoop the froth using a spoon and top it over the coffee. Sprinkle some coffee powder on top and serve immediately.""}, {""step_number"": 9, ""instruction"": ""Stir together instant coffee powder, sugar, and warm milk in a small mixing bowl.""}, {""step_number"": 10, ""instruction"": ""Add chilled milk, milk powder, vanilla ice cream, ice cubes, and the coffee mixture to the medium jar of a blender and blend for a minute.""}, {""step_number"": 11, ""instruction"": ""Check for sugar and add more if needed.""}, {""step_number"": 12, ""instruction"": ""Sprinkle some coffee powder on top and serve immediately.""}]"
Mint Chutney Recipe (Pudina Chutney),whiskaffair_indian_state_web,https://www.whiskaffair.com/mint-chutney-recipe/,6,4,1,5,https://www.whiskaffair.com/wp-content/uploads/2021/04/Mint-Chutney-2-3.jpg,"[{""raw_text"": ""1 cup mint leaves (packed and rinsed)"", ""source_position"": 1}, {""raw_text"": ""½ cup cilantro (fresh coriander leaves) (packed and rinsed)"", ""source_position"": 2}, {""raw_text"": ""1-2 garlic cloves (peeled)"", ""source_position"": 3}, {""raw_text"": ""2 teaspoons chopped ginger"", ""source_position"": 4}, {""raw_text"": ""2 teaspoons chopped green chilies"", ""source_position"": 5}, {""raw_text"": ""½ teaspoon roasted cumin powder"", ""source_position"": 6}, {""raw_text"": ""½ teaspoon salt (or to taste)"", ""source_position"": 7}, {""raw_text"": ""2 tablespoons freshly squeezed lime juice"", ""source_position"": 8}, {""raw_text"": ""2 tablespoons water"", ""source_position"": 9}]","[{""step_number"": 1, ""instruction"": ""Start by cleaning the mint and cilantro. You need 1 cup of mint (packed) and ½ cup of cilantro (packed). Discard the thick stems of mint, keeping only the leaves and tender stems. You can keep the cilantro stems. Wash them well 2-3 times with water to remove dirt. Drain well.""}, {""step_number"": 2, ""instruction"": ""Add all the ingredients to the jar of a blender.""}, {""step_number"": 3, ""instruction"": ""Blend to make a smooth chutney. Scrape the sides of the jar a few times while making the chutney.""}]"
Mor Kuzhambu Recipe (Authentic Tamil Brahmin Style Buttermilk Curry),whiskaffair_indian_state_web,https://www.whiskaffair.com/mor-kuzhambu-recipe-more-kulambu/,4,5,30,35,https://www.whiskaffair.com/wp-content/uploads/2021/03/Mor-Kuzhambu-2-3.jpg,"[{""raw_text"": ""2 teaspoons yellow pigeon peas lentil (toor dal)"", ""source_position"": 1}, {""raw_text"": ""1 teaspoon raw white rice"", ""source_position"": 2}, {""raw_text"": ""½ teaspoon cumin seeds"", ""source_position"": 3}, {""raw_text"": ""1 teaspoon chopped ginger"", ""source_position"": 4}, {""raw_text"": ""2 whole green chilies"", ""source_position"": 5}, {""raw_text"": ""8-10 curry leaves"", ""source_position"": 6}, {""raw_text"": ""½ cup chopped fresh coconut"", ""source_position"": 7}, {""raw_text"": ""¼ cup water"", ""source_position"": 8}, {""raw_text"": ""1 cup water"", ""source_position"": 9}, {""raw_text"": ""1 cup cubed yellow pumpkin (½ inch cubes)"", ""source_position"": 10}, {""raw_text"": ""1 cup sour yogurt (tangy curd, dahi)"", ""source_position"": 11}, {""raw_text"": ""½ teaspoon turmeric powder"", ""source_position"": 12}, {""raw_text"": ""1 teaspoon salt (or to taste)"", ""source_position"": 13}, {""raw_text"": ""2 teaspoons coconut oil"", ""source_position"": 14}, {""raw_text"": ""½ teaspoon brown mustard seeds"", ""source_position"": 15}, {""raw_text"": ""¼ teaspoon asafetida (hing) (skip for gluten-free)"", ""source_position"": 16}, {""raw_text"": ""2-3 whole dry red chilies"", ""source_position"": 17}, {""raw_text"": ""10-12 whole curry leaves"", ""source_position"": 18}]","[{""step_number"": 1, ""instruction"": ""Soak 2 teaspoon toor dal and 1 teaspoon white rice in water for 30 minutes.""}, {""step_number"": 2, ""instruction"": ""Wash, peel, and cut the yellow pumpkin into ½-inch pieces. You need 1 cup of cubed pumpkin.""}, {""step_number"": 3, ""instruction"": ""Soak toor dal and raw rice in ½ cup water for 30 minutes.""}, {""step_number"": 4, ""instruction"": ""Add 1 cup water to a saucepan and bring it to a boil over medium-high heat.""}, {""step_number"": 5, ""instruction"": ""Add the pumpkin to the boiling water and cook until softened (6-8 minutes).""}, {""step_number"": 6, ""instruction"": ""Drain any remaining water and keep the cooked pumpkin cubes aside.""}, {""step_number"": 7, ""instruction"": ""Drain the dal and rice and add them into the small jar of a blender along with cumin seeds, ginger, green chilies, curry leaves, coconut, and water.""}, {""step_number"": 8, ""instruction"": ""Blend to make a smooth paste.""}, {""step_number"": 9, ""instruction"": ""Add yogurt to a medium-sized bowl. Whisk the yogurt using a wire whisk until smooth.""}, {""step_number"": 10, ""instruction"": ""Add water, salt, and turmeric powder to the bowl and mix well.""}, {""step_number"": 11, ""instruction"": ""Note – You can use the water left from cooking the pumpkin.""}, {""step_number"": 12, ""instruction"": ""Note – If using ready-made buttermilk in place of yogurt, then just add turmeric powder to it and whisk until combined.""}, {""step_number"": 13, ""instruction"": ""Add the coconut paste to the bowl and mix well.""}, {""step_number"": 14, ""instruction"": ""Transfer the yogurt mixture to a cooking pan. Add the cooked pumpkin to the pan and stir to combine.""}, {""step_number"": 15, ""instruction"": ""Switch on the heat to low and cook the curry for 15-18 minutes, until it comes to a gentle simmer. Stir frequently while cooking.""}, {""step_number"": 16, ""instruction"": ""Note – Do not get tempted and increase the heat. The yogurt will split if the heat is higher.""}, {""step_number"": 17, ""instruction"": ""Check for salt and add more if needed.""}, {""step_number"": 18, ""instruction"": ""Heat coconut oil in a small pan over medium-high heat.""}, {""step_number"": 19, ""instruction"": ""Once the oil is hot, add mustard seeds, asafetida, dry red chilies, and curry leaves, and let them crackle for 4-5 seconds.""}, {""step_number"": 20, ""instruction"": ""Pour the tempering over the kuzhambu. Mix well and serve hot with rice.""}]"
Salna Recipe (Empty Parotta Chalna),whiskaffair_indian_state_web,https://www.whiskaffair.com/salna-recipe/,4,10,30,40,https://www.whiskaffair.com/wp-content/uploads/2021/01/Salna-2-3.jpg,"[{""raw_text"": ""½ cup chopped fresh coconut"", ""source_position"": 1}, {""raw_text"": ""1 teaspoon fennel seeds (saunf)"", ""source_position"": 2}, {""raw_text"": ""1 inch piece of cinnamon stick (dalchini)"", ""source_position"": 3}, {""raw_text"": ""2-3 cloves (laung)"", ""source_position"": 4}, {""raw_text"": ""2-3 whole green cardamoms (hari elaichi)"", ""source_position"": 5}, {""raw_text"": ""1 teaspoon white poppy seeds (skip if not available)"", ""source_position"": 6}, {""raw_text"": ""8-10 cashew nuts"", ""source_position"": 7}, {""raw_text"": ""1 green chili (chopped)"", ""source_position"": 8}, {""raw_text"": ""3 tablespoons oil"", ""source_position"": 9}, {""raw_text"": ""2 whole bay leaves (tejpatta)"", ""source_position"": 10}, {""raw_text"": ""2-3 whole black peppercorns (kali mirch)"", ""source_position"": 11}, {""raw_text"": ""1 whole star anise (chakr phool)"", ""source_position"": 12}, {""raw_text"": ""10-12 curry leaves"", ""source_position"": 13}, {""raw_text"": ""1 cup thinly sliced onions"", ""source_position"": 14}, {""raw_text"": ""1 green chili (slit into half)"", ""source_position"": 15}, {""raw_text"": ""1 and ¼ teaspoon salt (divided)"", ""source_position"": 16}, {""raw_text"": ""2 teaspoons ginger garlic paste"", ""source_position"": 17}, {""raw_text"": ""½ cup sliced tomatoes"", ""source_position"": 18}, {""raw_text"": ""1 teaspoon coriander powder"", ""source_position"": 19}, {""raw_text"": ""1 teaspoon Kashmiri red chili powder"", ""source_position"": 20}, {""raw_text"": ""½ teaspoon turmeric powder"", ""source_position"": 21}, {""raw_text"": ""2 teaspoons garam masala powder"", ""source_position"": 22}, {""raw_text"": ""2 tablespoons chopped cilantro (fresh coriander leaves)"", ""source_position"": 23}]","[{""step_number"": 1, ""instruction"": ""Add coconut, fennel seeds, cinnamon, cloves, green cardamoms, poppy seeds, cashew nuts, and green chili to a blender.""}, {""step_number"": 2, ""instruction"": ""Add ¼ cup of water and blend to make a fine paste.""}, {""step_number"": 3, ""instruction"": ""Heat oil in a pressure cooker over medium-high heat.""}, {""step_number"": 4, ""instruction"": ""Once the oil is hot, add bay leaves, cinnamon, cloves, black peppercorns, and star anise, and let them crackle for 4-5 seconds.""}, {""step_number"": 5, ""instruction"": ""Add curry leaves, onions, and green chili.""}, {""step_number"": 6, ""instruction"": ""Add ¼ teaspoon salt and cook until the onions are slightly browned (4-6 minutes), stirring frequently.""}, {""step_number"": 7, ""instruction"": ""Add ginger garlic paste and cook for 2 minutes.""}, {""step_number"": 8, ""instruction"": ""Now add tomatoes and cook for 2-3 minutes. Stir frequently while cooking.""}, {""step_number"": 9, ""instruction"": ""Add coriander powder, chili powder, turmeric powder, and garam masala powder, and cook for another minute.""}, {""step_number"": 10, ""instruction"": ""Now add the ground paste you made earlier, along with 2 cups of water. Add 1 teaspoon salt and stir well.""}, {""step_number"": 11, ""instruction"": ""Close the lid of the cooker and pressure cook for 2 whistles on medium-high heat.""}, {""step_number"": 12, ""instruction"": ""Remove the cooker from heat, let the pressure release naturally, and then open the lid.""}, {""step_number"": 13, ""instruction"": ""Check for salt and add more if needed.""}, {""step_number"": 14, ""instruction"": ""Garnish with cilantro and serve hot.""}, {""step_number"": 15, ""instruction"": ""To make salna in an instant pot, press SAUTE mode and follow the steps until the lid of the cooker is closed.""}, {""step_number"": 16, ""instruction"": ""Now press CANCEL and then press PRESSURE COOK.""}, {""step_number"": 17, ""instruction"": ""Set the timer to 4 minutes at high pressure.""}, {""step_number"": 18, ""instruction"": ""Once the timer goes off, let the pressure release naturally for 10 minutes. Release the remaining pressure manually and open the lid.""}]"
