name,source,source_url,servings,prep_time_min,cook_time_min,total_time_min,image_url,ingredients_json,cook_steps
"Raw Mango Rice Recipe (Mavinakayi Chitranna, Mamidikaya Pulihora)",whiskaffair_web,https://www.whiskaffair.com/raw-mango-rice-recipe/,4,10,10,20,https://www.whiskaffair.com/wp-content/uploads/2021/04/Mango-Rice-2-3.jpg,"[{""raw_text"": ""2 tablespoons oil"", ""source_position"": 1}, {""raw_text"": ""1 teaspoon brown mustard seeds"", ""source_position"": 2}, {""raw_text"": ""1 teaspoon split and husked black gram (white urad dal)"", ""source_position"": 3}, {""raw_text"": ""1 teaspoon Bengal gram (chana dal)"", ""source_position"": 4}, {""raw_text"": ""10-12 curry leaves"", ""source_position"": 5}, {""raw_text"": ""2-3 whole dry red chilies"", ""source_position"": 6}, {""raw_text"": ""¼ teaspoon asafetida (hing)"", ""source_position"": 7}, {""raw_text"": ""1 cup peeled and grated green raw mangoes"", ""source_position"": 8}, {""raw_text"": ""2 teaspoons chopped green chilies"", ""source_position"": 9}, {""raw_text"": ""1 teaspoon finely chopped ginger"", ""source_position"": 10}, {""raw_text"": ""2 cups cooked and cooled white rice"", ""source_position"": 11}, {""raw_text"": ""½ teaspoon turmeric powder"", ""source_position"": 12}, {""raw_text"": ""¼ cup roasted peanuts"", ""source_position"": 13}, {""raw_text"": ""½ teaspoon salt (or to taste)"", ""source_position"": 14}, {""raw_text"": ""2 tablespoons chopped cilantro (fresh coriander leaves)"", ""source_position"": 15}]","[{""step_number"": 1, ""instruction"": ""Next, prepare the green mangoes. Choose firm and tart mangoes and wash them well with water. Wipe the mangoes using a kitchen towel and peel them using a sharp paring knife. Now grate the mangoes using the small hole of a box grater. Discard the pit. Note – Don’t throw away the pit. You can use them while cooking the lentils. It will add a nice tang to them.""}, {""step_number"": 2, ""instruction"": ""Heat oil in a pan over medium-high heat.""}, {""step_number"": 3, ""instruction"": ""Once the oil is hot, add mustard seeds, white urad dal, chana dal, curry leaves, dry red chilies, and asafetida (hing), and fry until the dal turns a little brown (1-2 minutes). Stir frequently while frying.""}, {""step_number"": 4, ""instruction"": ""Add raw mangoes, green chilies, and ginger, and cook for 2-3 minutes, stirring frequently.""}, {""step_number"": 5, ""instruction"": ""Add cooked rice, turmeric powder, peanuts, and salt, and mix well.""}, {""step_number"": 6, ""instruction"": ""Reduce the heat to low and cook for 2-3 minutes.""}, {""step_number"": 7, ""instruction"": ""Check for salt and add more if needed.""}, {""step_number"": 8, ""instruction"": ""Finally, add cilantro and mix well. Serve hot!""}]"
Easy Aloo Palak Sabzi Recipe (Indian Potato Spinach Stir Fry),whiskaffair_web,https://www.whiskaffair.com/aloo-palak-recipe/,4,5,25,30,https://www.whiskaffair.com/wp-content/uploads/2021/04/Aloo-Palak-2-3.jpg,"[{""raw_text"": ""2 tablespoons oil"", ""source_position"": 1}, {""raw_text"": ""1 teaspoon cumin seeds"", ""source_position"": 2}, {""raw_text"": ""2 teaspoons chopped garlic"", ""source_position"": 3}, {""raw_text"": ""1 teaspoon chopped green chilies"", ""source_position"": 4}, {""raw_text"": ""½ cup chopped onions"", ""source_position"": 5}, {""raw_text"": ""8 ounces potatoes (225 g, peeled and cubed)"", ""source_position"": 6}, {""raw_text"": ""4 ounces chopped tomatoes (115 g)"", ""source_position"": 7}, {""raw_text"": ""½ teaspoon salt (or to taste)"", ""source_position"": 8}, {""raw_text"": ""1 teaspoon coriander powder"", ""source_position"": 9}, {""raw_text"": ""½ teaspoon turmeric powder"", ""source_position"": 10}, {""raw_text"": ""1 teaspoon red pepper flakes"", ""source_position"": 11}, {""raw_text"": ""8 ounces spinach (225 g, chopped)"", ""source_position"": 12}]","[{""step_number"": 1, ""instruction"": ""Start by preparing the spinach and potatoes. Wash 8 oz (225 g) spinach well with water and chop it.""}, {""step_number"": 2, ""instruction"": ""Wash 8 oz (225 g) potatoes and peel them using a vegetable peeler. Cut them into 1-inch cubes. Keep the potato cubes soaked in water until ready to use to prevent their oxidation.""}, {""step_number"": 3, ""instruction"": ""Heat 2 tablespoon oil in a pan over medium-high heat. Once the oil is hot, add 1 teaspoon cumin seeds and let them crackle for 3-4 seconds.""}, {""step_number"": 4, ""instruction"": ""Add 2 teaspoon chopped garlic and 1 teaspoon chopped green chilies and saute for 30 seconds.""}, {""step_number"": 5, ""instruction"": ""Add ½ cup chopped onions and cook until they become translucent (2-3 minutes), stirring frequently. Now add the cubed potatoes and mix well. Reduce the heat to low. Cover the pan with a lid. Cook on low heat until the potatoes are tender (10-12 minutes). Stir a few times in between.""}, {""step_number"": 6, ""instruction"": ""Add 4 oz (115 g) chopped tomatoes and ½ teaspoon salt and cook for 2-3 minutes until the tomatoes are mushy.""}, {""step_number"": 7, ""instruction"": ""Add""}, {""step_number"": 8, ""instruction"": ""teaspoon coriander powder ½ teaspoon turmeric powder 1 teaspoon red pepper flakes and cook for another minute. Now add the chopped spinach and mix everything well. Cover the pan and cook for 3-4 minutes. Remove the lid and mix everything well. Serve hot.""}, {""step_number"": 9, ""instruction"": ""Heat oil in a pan over medium-high heat. Once the oil is hot, add cumin seeds and let them crackle for 3-4 seconds.""}, {""step_number"": 10, ""instruction"": ""Add garlic and green chilies and saute for 30 seconds.""}, {""step_number"": 11, ""instruction"": ""Add onions and cook until they become translucent (2-3 minutes), stirring frequently.""}, {""step_number"": 12, ""instruction"": ""Now add the cubed potatoes and mix well.""}, {""step_number"": 13, ""instruction"": ""Reduce the heat to low.""}, {""step_number"": 14, ""instruction"": ""Cover the pan with a lid. Cook on low heat until the potatoes are tender (10-12 minutes). Stir a few times while cooking.""}, {""step_number"": 15, ""instruction"": ""Add tomatoes and salt and cook for 2-3 minutes until the tomatoes are mushy.""}, {""step_number"": 16, ""instruction"": ""Add coriander powder, turmeric powder, and red pepper flakes, and cook for another minute.""}, {""step_number"": 17, ""instruction"": ""Now add the chopped spinach and mix everything well. Cover the pan and cook for 3-4 minutes.""}, {""step_number"": 18, ""instruction"": ""Remove the lid and mix everything well.""}, {""step_number"": 19, ""instruction"": ""Check for salt and add more if needed.""}, {""step_number"": 20, ""instruction"": ""Serve hot.""}]"
South Indian Bread Upma Recipe (Bread Poha),whiskaffair_web,https://www.whiskaffair.com/bread-upma-recipe/,4,5,15,20,https://www.whiskaffair.com/wp-content/uploads/2020/06/Bread-Upma-2-3.jpg,"[{""raw_text"": ""8 white bread slices"", ""source_position"": 1}, {""raw_text"": ""2 tablespoons cooking oil"", ""source_position"": 2}, {""raw_text"": ""1 teaspoon brown mustard seeds"", ""source_position"": 3}, {""raw_text"": ""10-12 curry leaves"", ""source_position"": 4}, {""raw_text"": ""¼ cup raw peanuts"", ""source_position"": 5}, {""raw_text"": ""½ cup chopped onions"", ""source_position"": 6}, {""raw_text"": ""2 teaspoons chopped green chilies"", ""source_position"": 7}, {""raw_text"": ""¼ cup frozen green peas (washed)"", ""source_position"": 8}, {""raw_text"": ""¼ cup chopped tomatoes"", ""source_position"": 9}, {""raw_text"": ""1 teaspoon grated ginger"", ""source_position"": 10}, {""raw_text"": ""½ teaspoon turmeric powder"", ""source_position"": 11}, {""raw_text"": ""1 teaspoon salt (or to taste)"", ""source_position"": 12}, {""raw_text"": ""1 tablespoon freshly squeezed lime juice"", ""source_position"": 13}, {""raw_text"": ""2 tablespoons chopped cilantro (fresh coriander leaves)"", ""source_position"": 14}]","[{""step_number"": 1, ""instruction"": ""Cut 8 white bread slices into small squares (¼-inch) using a serrated knife. You don’t need to be precise; rough pieces are fine.""}, {""step_number"": 2, ""instruction"": ""Splash 2-3 tablespoon of water or buttermilk over them and toss once. Keep aside. This process will make the bread pieces soft.""}, {""step_number"": 3, ""instruction"": ""Heat 2 tablespoon cooking oil in a pan over medium-high heat.""}, {""step_number"": 4, ""instruction"": ""Once the oil is hot, add 1 teaspoon brown mustard seeds and 10-12 curry leaves and let them crackle for 4-5 seconds.""}, {""step_number"": 5, ""instruction"": ""Add ¼ cup of raw peanuts and fry for 20-25 seconds until crispy.""}, {""step_number"": 6, ""instruction"": ""Add the following ingredients and cook for 2-3 minutes.""}, {""step_number"": 7, ""instruction"": ""½ cup chopped onions""}, {""step_number"": 8, ""instruction"": ""2 teaspoon chopped green chilies""}, {""step_number"": 9, ""instruction"": ""¼ cup chopped tomatoes If using fresh peas, cook them until tender before adding them to the pan.""}, {""step_number"": 10, ""instruction"": ""Now add ½ teaspoon turmeric powder and 1 teaspoon salt, and cook for a minute.""}, {""step_number"": 11, ""instruction"": ""Add the following ingredients and toss everything well so the bread absorbs the spiced oil and onion-tomato mixture. Toss for 2–3 minutes until the bread is evenly coated and the edges start to crisp slightly.""}, {""step_number"": 12, ""instruction"": ""2 tablespoon chopped cilantro""}, {""step_number"": 13, ""instruction"": ""Check for salt and add more if needed. Cook for 3-4 minutes on low heat. Serve hot.""}, {""step_number"": 14, ""instruction"": ""Heat oil in a pan over medium-high heat. Once the oil is hot, add mustard seeds and curry leaves and let them crackle for 4-5 seconds.""}, {""step_number"": 15, ""instruction"": ""Add peanuts and fry for 20-25 seconds until they are crispy.""}, {""step_number"": 16, ""instruction"": ""Add onions, green chilies, peas, tomatoes, and ginger and fry for 2-3 minutes.""}, {""step_number"": 17, ""instruction"": ""Note – If using fresh peas, cook them until they are tender before adding them to the pan.""}, {""step_number"": 18, ""instruction"": ""Now add turmeric powder and salt and cook for a minute.""}, {""step_number"": 19, ""instruction"": ""Add the bread cubes, lime juice, and cilantro, and toss everything well.""}, {""step_number"": 20, ""instruction"": ""Check for salt and add more if needed.""}, {""step_number"": 21, ""instruction"": ""Cook for 3-4 minutes on low heat. Serve hot.""}]"
Dry Aloo Capsicum Recipe (Aloo Shimla Mirch),whiskaffair_web,https://www.whiskaffair.com/aloo-capsicum-recipe/,3,10,20,30,https://www.whiskaffair.com/wp-content/uploads/2021/05/Dry-Aloo-Capsicum-2-3.jpg,"[{""raw_text"": ""3 tablespoons oil"", ""source_position"": 1}, {""raw_text"": ""¼ teaspoon asafetida (hing) (skip for gluten-free)"", ""source_position"": 2}, {""raw_text"": ""1 teaspoon cumin seeds"", ""source_position"": 3}, {""raw_text"": ""1 cup chopped onions"", ""source_position"": 4}, {""raw_text"": ""1 teaspoon ginger garlic paste"", ""source_position"": 5}, {""raw_text"": ""1 cup peeled and cubed potatoes (1/2-inch cubes)"", ""source_position"": 6}, {""raw_text"": ""1 teaspoon coriander powder"", ""source_position"": 7}, {""raw_text"": ""½ teaspoon turmeric powder"", ""source_position"": 8}, {""raw_text"": ""1 teaspoon Kashmiri red chili powder"", ""source_position"": 9}, {""raw_text"": ""½ teaspon salt (or to taste)"", ""source_position"": 10}, {""raw_text"": ""1 cup finely chopped tomatoes"", ""source_position"": 11}, {""raw_text"": ""1 cup diced green bell peppers (1/2-inch pieces)"", ""source_position"": 12}, {""raw_text"": ""1 teaspoon dry mango powder (amchoor)"", ""source_position"": 13}]","[{""step_number"": 1, ""instruction"": ""teaspoon coriander powder ½ teaspoon turmeric powder 1 teaspoon Kashmiri red chili powder ½ teaspoon salt to the pan and mix well.""}, {""step_number"": 2, ""instruction"": ""Add 1 cup finely chopped tomatoes and cook for 3-4 minutes until the tomatoes are mushy.""}, {""step_number"": 3, ""instruction"": ""Add 1 cup diced green bell peppers (½-inch pieces) and mix well. Cover the pan again and cook on low heat for another 8-10 minutes. Remove the lid. Add ½ teaspoon dry mango powder and mix well. Check for salt and add more if needed. Garnish with chopped coriander and serve hot.""}, {""step_number"": 4, ""instruction"": ""Heat oil in a medium-size pan over medium-high heat.""}, {""step_number"": 5, ""instruction"": ""Once the oil is hot, add asafetida and cumin seeds and let them crackle for 3-4 seconds.""}, {""step_number"": 6, ""instruction"": ""Add onions and ginger-garlic paste to the pan and cook for 2 minutes, stirring frequently.""}, {""step_number"": 7, ""instruction"": ""Add potatoes and mix well.""}, {""step_number"": 8, ""instruction"": ""Reduce the heat to low.""}, {""step_number"": 9, ""instruction"": ""Cover the pan with a tight-fitting lid and cook until the potatoes are slightly tender (6-8 minutes). Stir a few times while cooking.""}, {""step_number"": 10, ""instruction"": ""Remove the lid and add coriander powder, turmeric powder, Kashmiri red chili powder, and salt to the pan and mix well.""}, {""step_number"": 11, ""instruction"": ""Add tomatoes and cook for 3-4 minutes until the tomatoes are mushy.""}, {""step_number"": 12, ""instruction"": ""Add bell peppers and mix well.""}, {""step_number"": 13, ""instruction"": ""Cover the pan again and cook on low heat for another 8-10 minutes.""}, {""step_number"": 14, ""instruction"": ""Remove the lid. Add dry mango powder and mix well.""}, {""step_number"": 15, ""instruction"": ""Check for salt and add more if needed.""}, {""step_number"": 16, ""instruction"": ""Garnish with fresh coriander and serve hot.""}]"
Homemade Chaat Masala Powder Recipe,whiskaffair_web,https://www.whiskaffair.com/homemade-chaat-masala-recipe/,10,,5,10,https://www.whiskaffair.com/wp-content/uploads/2020/09/Chaat-Masala-2-3.jpg,"[{""raw_text"": ""¼ cup cumin seeds"", ""source_position"": 1}, {""raw_text"": ""2 tablespoons whole coriander seeds (dhaniya beej)"", ""source_position"": 2}, {""raw_text"": ""1 tablespoon whole black peppercorns (kali mirch)"", ""source_position"": 3}, {""raw_text"": ""½ teaspoon asafetida (hing) (skip for gluten-free)"", ""source_position"": 4}, {""raw_text"": ""¼ cup dry mango powder (amchoor)"", ""source_position"": 5}, {""raw_text"": ""2 tablespoons black salt (kala namak)"", ""source_position"": 6}, {""raw_text"": ""1 teaspoon regular white salt"", ""source_position"": 7}]","[{""step_number"": 1, ""instruction"": ""Add cumin seeds, coriander seeds, and black peppercorns to a skillet and dry roast on medium heat until they begin to turn a little darker and give off their aromas (2-3 minutes).""}, {""step_number"": 2, ""instruction"": ""Stir often while roasting to prevent the spices from burning.""}, {""step_number"": 3, ""instruction"": ""Note – Do not roast the spices on high heat otherwise they might burn. Do not over roast the spices otherwise, they will turn bitter in taste. Keep in consideration that they will continue to roast from the residual heat.""}, {""step_number"": 4, ""instruction"": ""Once the spices are roasted, remove the skillet from the heat and let them cool down completely.""}, {""step_number"": 5, ""instruction"": ""Add them to a dry spice grinder (coffee grinder or a food processor) along with asafetida, mango powder, black salt, and white salt and grind to make a fine powder.""}, {""step_number"": 6, ""instruction"": ""Transfer the chaat masala powder to a glass container with a tight seal and store it in a cool, dark place for up to 3 months. Use in your favorite recipes and enjoy.""}]"
Bhel Puri Recipe (Indian Street Snack),whiskaffair_web,https://www.whiskaffair.com/bhelpuri/,2,5,2,7,https://www.whiskaffair.com/wp-content/uploads/2021/05/Bhelpuri-2-3.jpg,"[{""raw_text"": ""3 teaspoons green chutney"", ""source_position"": 1}, {""raw_text"": ""3 teaspoons tamarind chutney"", ""source_position"": 2}, {""raw_text"": ""½ cup chopped red onions"", ""source_position"": 3}, {""raw_text"": ""½ cup chopped tomatoes"", ""source_position"": 4}, {""raw_text"": ""1 teaspoon chopped green chilies"", ""source_position"": 5}, {""raw_text"": ""3 tablespoons chopped cilantro (fresh coriander leaves)"", ""source_position"": 6}, {""raw_text"": ""½ cup boiled and cubed potatoes (¼-inch cubes)"", ""source_position"": 7}, {""raw_text"": ""½ teaspoon salt (or to taste)"", ""source_position"": 8}, {""raw_text"": ""½ teaspoon Kashmiri red chili powder"", ""source_position"": 9}, {""raw_text"": ""1 teaspoon chaat masala spice mix"", ""source_position"": 10}, {""raw_text"": ""2 cups puffed rice (murmura)"", ""source_position"": 11}, {""raw_text"": ""1 tablespoon freshly squeezed lime juice"", ""source_position"": 12}, {""raw_text"": ""¼ cup fine sev"", ""source_position"": 13}]","[{""step_number"": 1, ""instruction"": ""½ cup chopped red onions""}, {""step_number"": 2, ""instruction"": ""½ cup chopped tomatoes""}, {""step_number"": 3, ""instruction"": ""1 teaspoon chopped green chilies""}, {""step_number"": 4, ""instruction"": ""3 tablespoon chopped coriander leaves""}, {""step_number"": 5, ""instruction"": ""½ cup boiled and cubed potatoes""}, {""step_number"": 6, ""instruction"": ""Add 2 cups of puffed rice and 1 tablespoon lime juice to the bowl and mix the contents of the bowl. Transfer immediately in shallow serving bowls and garnish with fine sev. Serve immediately. Once you mix the puffed rice with other ingredients, serve it immediately.""}, {""step_number"": 7, ""instruction"": ""In a large bowl, mix coriander mint chutney, tamarind chutney, onions, tomatoes, green chilies, coriander leaves, potatoes, salt, Kashmiri red chili powder, and chaat masala powder.""}, {""step_number"": 8, ""instruction"": ""Add puffed rice and lime juice to the bowl and mix the contents of the bowl together.""}, {""step_number"": 9, ""instruction"": ""Transfer immediately in shallow bowls and garnish with fine sev. Serve immediately.""}]"
"Ragda Recipe (For Pattice, Pani Puri and Other Chaat)",whiskaffair_web,https://www.whiskaffair.com/ragda-recipe/,4,10,30,40,https://www.whiskaffair.com/wp-content/uploads/2021/07/Ragda-2-3.jpg,"[{""raw_text"": ""1 cup dried white peas (safed matar)"", ""source_position"": 1}, {""raw_text"": ""1 teaspoon salt (or to taste)"", ""source_position"": 2}, {""raw_text"": ""1 teaspoon grated ginger"", ""source_position"": 3}, {""raw_text"": ""1 teaspoon oil"", ""source_position"": 4}, {""raw_text"": ""⅛ teaspoon turmeric powder"", ""source_position"": 5}, {""raw_text"": ""1 teaspoon green chutney"", ""source_position"": 6}, {""raw_text"": ""2 tablespoons tamarind chutney"", ""source_position"": 7}, {""raw_text"": ""1 tablespoon chopped cilantro (fresh coriander leaves)"", ""source_position"": 8}, {""raw_text"": ""chopped cilantro (fresh coriander leaves)"", ""source_position"": 9}, {""raw_text"": ""chopped red onions"", ""source_position"": 10}, {""raw_text"": ""chopped green chilies"", ""source_position"": 11}]","[{""step_number"": 1, ""instruction"": ""Rinse dried white peas and soak in 4-5 cups of water for 5-6 hours or overnight. Drain the water and rinse the peas once again.""}, {""step_number"": 2, ""instruction"": ""Add the soaked peas to a pressure cooker along with 2 cups of water, salt, grated ginger, vegetable oil, and turmeric powder.""}, {""step_number"": 3, ""instruction"": ""Pressure cook for 3-4 whistles on high heat. Remove the pressure cooker from heat and let the pressure release naturally.""}, {""step_number"": 4, ""instruction"": ""Open the lid of the cooker and mash the peas lightly using the back of the ladle. Stir in coriander mint chutney and tamarind chutney.""}, {""step_number"": 5, ""instruction"": ""Garnish with fresh cilantro, chilies, and chopped onions and serve.""}, {""step_number"": 6, ""instruction"": ""Add the soaked peas to an instant pot along with 1 cup of water, salt, grated ginger, vegetable oil, and turmeric powder.""}, {""step_number"": 7, ""instruction"": ""Close the lid and set the valve to the sealing position.""}, {""step_number"": 8, ""instruction"": ""Press PRESSURE COOK and set the timer to 25 minutes on high pressure.""}, {""step_number"": 9, ""instruction"": ""Once the timer goes off, let the pressure release naturally for 10 minutes. Release the remaining pressure manually and open the lid of the pot.""}, {""step_number"": 10, ""instruction"": ""Mash the peas lightly using the back of the ladle.""}, {""step_number"": 11, ""instruction"": ""Stir in coriander mint chutney and tamarind chutney.""}]"
Best Homemade Sambar Powder Recipe (Sambar Podi),whiskaffair_web,https://www.whiskaffair.com/sambar-powder-recipe/,3,10,20,60,https://www.whiskaffair.com/wp-content/uploads/2020/09/Sambar-Powder-2-3.jpg,"[{""raw_text"": ""1 cup Bengal gram lentils (chana dal)"", ""source_position"": 1}, {""raw_text"": ""1 cup split and skinned black lentils (white urad dal)"", ""source_position"": 2}, {""raw_text"": ""1 cup whole coriander seeds (dhaniya)"", ""source_position"": 3}, {""raw_text"": ""½ cup cumin seeds (jeera)"", ""source_position"": 4}, {""raw_text"": ""¼ cup brown mustard seeds (sarson)"", ""source_position"": 5}, {""raw_text"": ""2 tablespoons fenugreek seeds (methi dana)"", ""source_position"": 6}, {""raw_text"": ""2 teaspoons whole black peppercorns (kali mirch)"", ""source_position"": 7}, {""raw_text"": ""50 grams Kashmiri dry red chilies (stalks removed)"", ""source_position"": 8}, {""raw_text"": ""¼ cup chopped curry leaves"", ""source_position"": 9}, {""raw_text"": ""1 teaspoon asafetida (hing) (skip for gluten-free)"", ""source_position"": 10}]","[{""step_number"": 1, ""instruction"": ""cup coriander seeds ½ cup cumin seeds ¼ cup brown mustard seeds 2 tablespoon fenugreek seeds 2 teaspoon black peppercorns to the same pan. Roast on medium-low heat until lightly browned and fragrant (3-4 minutes). Stir continuously.""}, {""step_number"": 2, ""instruction"": ""Add 50 g (1.8 oz) of Kashmiri dry red chilies (stalks removed) to the same pan and roast on medium-low heat until they are crisp and the color becomes darker (2-3 minutes). Stir continuously. Remove them into the bowl and keep them aside. Tip – You can break the chilies into small pieces for easy roasting and grinding.""}, {""step_number"": 3, ""instruction"": ""Add ¼ cup chopped curry leaves to the same pan and roast on medium-low heat for 2-3 minutes until crisp. Stir continuously while roasting. Remove them into the bowl and set them aside.""}, {""step_number"": 4, ""instruction"": ""Add chana dal and white urad dal to a flat, large and wide pan.""}, {""step_number"": 5, ""instruction"": ""Dry roast on medium-low heat until they’re golden brown and a nutty aroma starts to emit (4-5 minutes). Stir frequently while roasting.""}, {""step_number"": 6, ""instruction"": ""Add coriander seeds, cumin seeds, mustard seeds, fenugreek seeds, and black peppercorns to the same pan and roast on medium-low heat until they are lightly browned and fragrant (3-4 minutes), stirring continuously.""}, {""step_number"": 7, ""instruction"": ""Add Kashmiri dry red chillies (stalks removed) to the same pan and roast on medium-low heat until they are crisp and the color becomes darker (2-3 minutes). Keep stirring continuously. Remove them in the bowl and keep them aside.""}, {""step_number"": 8, ""instruction"": ""Tip – You can break the chilies into small pieces for easy roasting and grinding.""}, {""step_number"": 9, ""instruction"": ""Add curry leaves to the same pan and roast on medium-low heat for 2-3 minutes until they are crisp. Stir continuously while roasting. Remove them in the bowl and set them aside.""}, {""step_number"": 10, ""instruction"": ""Add the roasted ingredients to a spice grinder along with asafetida and grind to make a fine powder.""}, {""step_number"": 11, ""instruction"": ""Note – If your grinder is small or is not high-powdered, then grind the ingredients in batches and then mix them together once ground.""}]"
