name,source,source_url,servings,prep_time_min,cook_time_min,total_time_min,image_url,ingredients_json,cook_steps
Easy Sweet Shakarpara Recipe (Shakkar Pare),whiskaffair_web,https://www.whiskaffair.com/shakkarpara-recipe/,6,5,30,50,https://www.whiskaffair.com/wp-content/uploads/2021/10/Shakkarpara-2-3.jpg,"[{""raw_text"": ""2 cups all purpose flour (maida) (250 g, 8.5 oz)"", ""source_position"": 1}, {""raw_text"": ""2 tablespoons ghee (room temperature)"", ""source_position"": 2}, {""raw_text"": ""lukewarm water"", ""source_position"": 3}, {""raw_text"": ""3 cups ghee or oil (for frying)"", ""source_position"": 4}, {""raw_text"": ""1 cup granulated white sugar"", ""source_position"": 5}, {""raw_text"": ""½ cup water"", ""source_position"": 6}]","[{""step_number"": 1, ""instruction"": ""Add all-purpose flour and ghee in a large mixing bowl or parat (large shallow plate) and mix well using your hands. The ghee should be at room temperature and in a semi-solid state. If it’s very warm where you live and the ghee is melted at room temperature, then refrigerate it for a few minutes.""}, {""step_number"": 2, ""instruction"": ""Add lukewarm water (approx ½ cup) little by little and knead to make a tight dough.""}, {""step_number"": 3, ""instruction"": ""Cover the dough with a dishcloth and keep aside for 15 minutes.""}, {""step_number"": 4, ""instruction"": ""Knead the dough once again for 20-30 seconds and divide it into 2 parts.""}, {""step_number"": 5, ""instruction"": ""Roll one part of the dough to make a circle. The thickness of the circle should be approximately ¼ inch. Do not roll it thin otherwise, the shakarpara will turn out hard.""}, {""step_number"": 6, ""instruction"": ""Do not use dry flour to roll. Since the dough is hard and has fat in it, it will not stick to the surface.""}, {""step_number"": 7, ""instruction"": ""Note - If your dough is still sticking to the surface while rolling, then use very little dry flour.""}, {""step_number"": 8, ""instruction"": ""Keep the remaining dough covered with a cloth to avoid drying.""}, {""step_number"": 9, ""instruction"": ""Cut the circle into small square or diamond shapes using a sharp knife.""}, {""step_number"": 10, ""instruction"": ""Just before you start to roll the dough, heat 3 cups of ghee or oil for frying in a pan over medium flame.""}, {""step_number"": 11, ""instruction"": ""Once the ghee is hot, reduce the heat to medium-low.""}, {""step_number"": 12, ""instruction"": ""To check if the ghee is hot, drop a small ball of dough into the hot ghee. It should rise on top in 5-8 seconds. If not, then heat the ghee a little more. If the ghee is too hot, the dough ball will come to the top immediately. In this case, switch off the heat and let the ghee cool down for 5 minutes before switching on the heat again.""}, {""step_number"": 13, ""instruction"": ""Add the shakarpare to the hot ghee and fry on medium-low heat until lightly browned. Stir frequently while frying.""}, {""step_number"": 14, ""instruction"": ""Do not get tempted and increase the heat. Each batch will take 20-25 minutes to fry properly. Fry only until the shakarpara are light brown in color. They will not look and taste good if the color changes to dark brown.""}, {""step_number"": 15, ""instruction"": ""Drain on a plate lined with paper towels and let them cool completely.""}, {""step_number"": 16, ""instruction"": ""Roll, cut, and fry the other part of the dough in the same manner.""}, {""step_number"": 17, ""instruction"": ""While the shakarpara are cooling down, make the sugar syrup.""}, {""step_number"": 18, ""instruction"": ""Add granulated sugar and water to a pan and heat on medium heat for 10-12 minutes to make 2-3 thread syrup.""}, {""step_number"": 19, ""instruction"": ""The consistency of the sugar syrup is very important for it to crystallize properly over the shakarpara.""}, {""step_number"": 20, ""instruction"": ""To check if the sugar syrup has reached the 2-3 thread consistency, take some syrup on a spoon. Let it cool for 4-5 seconds. Be careful because the syrup is very hot at this stage. Now take a little syrup on one of your fingers and press it with the thumb. Pull the finger away from the thumb. You should see 2-3 threads forming between the finger and the thumb.""}, {""step_number"": 21, ""instruction"": ""If you have a candy thermometer, then the temperature of the syrup should be 242°F–248°F (116°C–120°C).""}, {""step_number"": 22, ""instruction"": ""Once the right consistency of the sugar syrup is reached, remove the pan from heat.""}, {""step_number"": 23, ""instruction"": ""Add the cooled shakarpare to the pan with sugar syrup immediately and mix gently to coat them with the syrup. The syrup will start to crystallize almost immediately after removing the pan from the heat so be a little quick with this step.""}, {""step_number"": 24, ""instruction"": ""Separate the shakarpara using your fingers and let them rest for 10 minutes.""}, {""step_number"": 25, ""instruction"": ""Store them in an airtight container for up to a month at room temperature.""}]"
Hyderabadi Double Ka Meetha Recipe (Indian Bread Pudding),whiskaffair_web,https://www.whiskaffair.com/hyderabadi-double-ka-meetha/,10,10,60,70,https://www.whiskaffair.com/wp-content/uploads/2018/08/Double-ka-Meetha-2-3.jpg,"[{""raw_text"": ""34 ounces whole milk (full-fat milk) (1 liter)"", ""source_position"": 1}, {""raw_text"": ""7 ounces khoya (reduced milk solids) (200 g, crumbled)"", ""source_position"": 2}, {""raw_text"": ""10 white bread slices"", ""source_position"": 3}, {""raw_text"": ""2 cups ghee"", ""source_position"": 4}, {""raw_text"": ""1 cup granulated white sugar"", ""source_position"": 5}, {""raw_text"": ""1 cup water"", ""source_position"": 6}, {""raw_text"": ""10-12 crushed almonds"", ""source_position"": 7}, {""raw_text"": ""10-12 crushed cashew nuts"", ""source_position"": 8}, {""raw_text"": ""2 teaspoons ghee"", ""source_position"": 9}]","[{""step_number"": 1, ""instruction"": ""Start by making the rabdi. It will take approximately an hour for it to thicken. While it is cooking, you can make the other parts of the recipe.""}, {""step_number"": 2, ""instruction"": ""Heat milk in a nonstick pan over medium-high heat. Stir frequently to avoid scorching.""}, {""step_number"": 3, ""instruction"": ""Once the milk comes to a boil, reduce the heat to medium-low and add crumbled khoya.""}, {""step_number"": 4, ""instruction"": ""Cook for approximately an hour until the milk has reduced to half and becomes thick. Stir frequently to avoid scorching.""}, {""step_number"": 5, ""instruction"": ""Remove the pan from heat and keep it aside.""}, {""step_number"": 6, ""instruction"": ""Cut bread slices into half diagonally. There is no need to remove their ends.""}, {""step_number"": 7, ""instruction"": ""Heat ghee in a wide pan over medium heat.""}, {""step_number"": 8, ""instruction"": ""Once the ghee is hot, add a few slices to the hot ghee and fry from both sides until lightly browned. Do not over-fry the bread slices. Keep in mind that the bread will keep browning from the residual heat.""}, {""step_number"": 9, ""instruction"": ""Drain on a plate lined with paper towels. Fry all the bread slices in the same manner and set them aside.""}, {""step_number"": 10, ""instruction"": ""Add sugar and water to a saucepan and heat on medium-high heat until the mixture comes to a boil. Stir at regular intervals.""}, {""step_number"": 11, ""instruction"": ""Cook for 6-8 minutes until the syrup has thickened slightly.""}, {""step_number"": 12, ""instruction"": ""Remove the pan from heat and set it aside.""}, {""step_number"": 13, ""instruction"": ""Mix almonds and cashew nuts with ghee and keep aside. Mixing the nuts with a little ghee will make them very flavorful once roasted in the oven.""}, {""step_number"": 14, ""instruction"": ""Preheat the oven to 360℉ (180℃).""}, {""step_number"": 15, ""instruction"": ""Arrange the crispy bread slices on a deep oven-safe baking dish. Choose the dish in which you want to serve the dessert.""}, {""step_number"": 16, ""instruction"": ""Pour the sugar syrup on top of the bread slices.""}, {""step_number"": 17, ""instruction"": ""Pour the rabdi on top.""}, {""step_number"": 18, ""instruction"": ""Sprinkle the nuts over the rabdi.""}, {""step_number"": 19, ""instruction"": ""Keep the dish in the middle rack of the oven and bake for 20-25 minutes until slightly browned from the top.""}, {""step_number"": 20, ""instruction"": ""Remove the dish from the oven and cool slightly.""}, {""step_number"": 21, ""instruction"": ""Garnish with dried rose petals and slivered pistachios and serve warm or chill it for a few hours before serving.""}]"
Bread Halwa Recipe (Bread Sheera),whiskaffair_web,https://www.whiskaffair.com/bread-halwa-recipe/,6,10,20,30,https://www.whiskaffair.com/wp-content/uploads/2020/08/Bread-Halwa-2-3.jpg,"[{""raw_text"": ""6 white bread slices"", ""source_position"": 1}, {""raw_text"": ""1 tablespoon ghee (plus 2 cups for frying)"", ""source_position"": 2}, {""raw_text"": ""10-12 almonds (coarsely crushed)"", ""source_position"": 3}, {""raw_text"": ""10-12 cashew nuts (coarsely crushed)"", ""source_position"": 4}, {""raw_text"": ""½ cup granulated white sugar"", ""source_position"": 5}, {""raw_text"": ""1 cup water"", ""source_position"": 6}, {""raw_text"": ""½ teaspoon cardamom powder"", ""source_position"": 7}]","[{""step_number"": 1, ""instruction"": ""Cut the brown ends of bread slices using a sharp serrated knife and cut the slices into 4 pieces.""}, {""step_number"": 2, ""instruction"": ""Heat 2 cups of ghee for frying in a shallow pan over medium heat.""}, {""step_number"": 3, ""instruction"": ""Once the ghee is hot, deep fry the bread pieces in batches until golden brown.""}, {""step_number"": 4, ""instruction"": ""Keep flipping the pieces using tongs while frying so that they fry evenly on all sides.""}, {""step_number"": 5, ""instruction"": ""Drain on a plate and set aside.""}, {""step_number"": 6, ""instruction"": ""Note - Do not over-fry the bread otherwise the halwa will not taste good. Keep in consideration that bread will keep browning a little from the residual heat.""}, {""step_number"": 7, ""instruction"": ""Tip – Strain the leftover ghee using a fine-mesh strainer and use it to make other sweets.""}, {""step_number"": 8, ""instruction"": ""Heat 1 tbsp ghee in a pan over medium heat.""}, {""step_number"": 9, ""instruction"": ""Add almonds and cashew nuts (coarsely crushed) and fry until golden brown. Keep stirring frequently while frying.""}, {""step_number"": 10, ""instruction"": ""Add sugar and water to the pan.""}, {""step_number"": 11, ""instruction"": ""Cook until sugar is dissolved.""}, {""step_number"": 12, ""instruction"": ""Reduce the heat to low and cook for 5 minutes.""}, {""step_number"": 13, ""instruction"": ""Now add the fried bread pieces to the pan and cook for 8-10 minutes until the halwa starts to leave the sides of the pan.""}, {""step_number"": 14, ""instruction"": ""Keep mashing the halwa with the back of a ladle.""}, {""step_number"": 15, ""instruction"": ""Once the halwa is cooked, add cardamom powder and mix well.""}, {""step_number"": 16, ""instruction"": ""Garnish with more slivered nuts and serve hot.""}]"
Jalebi White Chocolate Bark Recipe,whiskaffair_web,https://www.whiskaffair.com/jalebi-white-chocolate-bark-recipe/,12,2,10,12,https://www.whiskaffair.com/wp-content/uploads/2022/08/Jalebi-White-Chocolate-Bark-2-3.jpg,"[{""raw_text"": ""7 ounces cooking white chocolate (200 g)"", ""source_position"": 1}, {""raw_text"": ""1.8 ounces jalebi (50 g)"", ""source_position"": 2}, {""raw_text"": ""1 teaspoon dried rose petals"", ""source_position"": 3}, {""raw_text"": ""1 tablespoons slivered pistachios"", ""source_position"": 4}]","[{""step_number"": 1, ""instruction"": ""Chop the white chocolate into small pieces.""}, {""step_number"": 2, ""instruction"": ""Add 2 cups of water to a pan and bring it to a boil over high heat.""}, {""step_number"": 3, ""instruction"": ""Reduce the heat to low.""}, {""step_number"": 4, ""instruction"": ""Keep a glass bowl over the pan and add white chocolate to it.""}, {""step_number"": 5, ""instruction"": ""Keep mixing using a silicon spatula until the chocolate melts and is smooth and shiny.""}, {""step_number"": 6, ""instruction"": ""Transfer the melted chocolate to parchment paper and spread it evenly using a baking knife to make a ¼ -inch thick rectangle.""}, {""step_number"": 7, ""instruction"": ""Arrange jalebi on top.""}, {""step_number"": 8, ""instruction"": ""Sprinkle dried rose petals and slivered pistachios all over.""}, {""step_number"": 9, ""instruction"": ""Refrigerate the chocolate for 20 minutes.""}, {""step_number"": 10, ""instruction"": ""Cut into small pieces using a sharp knife. Serve!""}]"
Gond Ke Laddu Recipe (Edible Gum Ladoo),whiskaffair_web,https://www.whiskaffair.com/gond-ke-ladoo/,20,15,40,55,https://www.whiskaffair.com/wp-content/uploads/2020/08/Gond-ke-Laddu-2-3.jpg,"[{""raw_text"": ""1 cup ghee (divided, plus some more if required)"", ""source_position"": 1}, {""raw_text"": ""½ cup thinly sliced dry coconut"", ""source_position"": 2}, {""raw_text"": ""1 cup makhana (foxnuts) (cut into small pieces)"", ""source_position"": 3}, {""raw_text"": ""100 grams gond (edible gum)"", ""source_position"": 4}, {""raw_text"": ""½ cup slivered almonds"", ""source_position"": 5}, {""raw_text"": ""¼ cup slivered cashew nuts (Sliced)"", ""source_position"": 6}, {""raw_text"": ""2 tablespoons chironji"", ""source_position"": 7}, {""raw_text"": ""2 tablespoons melon seeds"", ""source_position"": 8}, {""raw_text"": ""2 tablespoons white poppy seeds"", ""source_position"": 9}, {""raw_text"": ""2 cups whole wheat flour (gehu ka atta)"", ""source_position"": 10}, {""raw_text"": ""2 teaspoons ginger powder (saunth)"", ""source_position"": 11}, {""raw_text"": ""1 cup powdered sugar (or boora)"", ""source_position"": 12}]","[{""step_number"": 1, ""instruction"": ""Heat 1 tablespoon ghee in a pan over medium heat.""}, {""step_number"": 2, ""instruction"": ""Once the ghee is hot, add dry coconut and fry until they are browned, stirring frequently.""}, {""step_number"": 3, ""instruction"": ""Transfer the fried coconut to a bowl.""}, {""step_number"": 4, ""instruction"": ""Add mahkana into the pan and roast until they are lightly browned and crispy, stirring frequently.""}, {""step_number"": 5, ""instruction"": ""Transfer the roasted makhana to the bowl.""}, {""step_number"": 6, ""instruction"": ""Add 1 tablespoon ghee to the same pan.""}, {""step_number"": 7, ""instruction"": ""Add gond and fry until it is puffed up.""}, {""step_number"": 8, ""instruction"": ""Transfer the gond to a mortar and pestle.""}, {""step_number"": 9, ""instruction"": ""Add another 1 tablespoon ghee to the pan.""}, {""step_number"": 10, ""instruction"": ""Add almonds, cashew nuts, melon seeds, and chironji and roast until nuts are lightly browned.""}, {""step_number"": 11, ""instruction"": ""Add poppy seeds to the pan and roast for another minute.""}, {""step_number"": 12, ""instruction"": ""Transfer the dried nuts and poppy seeds to the bowl.""}, {""step_number"": 13, ""instruction"": ""Crush the puffed gond to make a coarse powder.""}, {""step_number"": 14, ""instruction"": ""Wipe the pan well with paper tissues to remove any nuts or seeds sticking to it.""}, {""step_number"": 15, ""instruction"": ""Heat 2 tablespoon ghee in the same pan over medium heat.""}, {""step_number"": 16, ""instruction"": ""Add whole wheat flour to the pan and roast until nicely browned, stirring very frequently.""}, {""step_number"": 17, ""instruction"": ""Once the flour is nicely browned, add ginger powder, roasted nuts, seeds, and crushed gond and mix well.""}, {""step_number"": 18, ""instruction"": ""Add the remaining ghee and mix well.""}, {""step_number"": 19, ""instruction"": ""Remove the pan from the heat and let the mixture cool down for 5 minutes.""}, {""step_number"": 20, ""instruction"": ""Add powdered sugar and mix well.""}, {""step_number"": 21, ""instruction"": ""Check for sugar and add more if needed.""}, {""step_number"": 22, ""instruction"": ""Make ladoos from the mixture while the mixture is still warm. Add some more melted ghee to this mixture if it’s not binding.""}, {""step_number"": 23, ""instruction"": ""Transfer the laddos to an airtight container and serve them at room temperature.""}]"
Nankhatai Recipe,whiskaffair_web,https://www.whiskaffair.com/nan-khatai/,24,10,20,60,https://www.whiskaffair.com/wp-content/uploads/2020/09/Nankhatai-2-3.jpg,"[{""raw_text"": ""60 grams chickpea flour (besan, gram flour) (½ cup)"", ""source_position"": 1}, {""raw_text"": ""240 grams all-purpose flour (maida) (2 cups)"", ""source_position"": 2}, {""raw_text"": ""1 pinch of salt"", ""source_position"": 3}, {""raw_text"": ""1 teaspoon cardamom powder"", ""source_position"": 4}, {""raw_text"": ""⅛ teaspoon baking soda"", ""source_position"": 5}, {""raw_text"": ""220 grams ghee (1 cup)"", ""source_position"": 6}, {""raw_text"": ""125 grams powdered sugar (1 cup)"", ""source_position"": 7}, {""raw_text"": ""5-6 almonds (slivered, for garnishing)"", ""source_position"": 8}]","[{""step_number"": 1, ""instruction"": ""Add chickpea flour, all-purpose flour, salt, cardamom powder, and baking soda in a medium bowl and mix well""}, {""step_number"": 2, ""instruction"": ""Whisk ghee and powdered sugar in another large bowl until combined.""}, {""step_number"": 3, ""instruction"": ""Add the dry mixture to the ghee mixture and mix using your clean fingers to make a soft dough.""}, {""step_number"": 4, ""instruction"": ""Divide the dough into 22-24 equal parts and roll each part to make a ball. Gently press the balls and arrange them on a baking tray in a single layer.""}, {""step_number"": 5, ""instruction"": ""Note - If the baking tray is small, then make the nankhatai in batches.""}, {""step_number"": 6, ""instruction"": ""Press some slivered almonds on top of the cookies.""}, {""step_number"": 7, ""instruction"": ""Cover the tray with a cling wrap and refrigerate the cookies for 30 minutes.""}, {""step_number"": 8, ""instruction"": ""Preheat the oven to 180℃ (360℉).""}, {""step_number"": 9, ""instruction"": ""Once the oven is preheated, keep the tray in the middle rack of the oven and bake the cookies for 10-12 minutes, till slightly browned.""}, {""step_number"": 10, ""instruction"": ""Remove from the oven and let them rest for 5 minutes. Transfer to a cooling rack and cool completely.""}, {""step_number"": 11, ""instruction"": ""Store in an airtight container for up to 2-3 weeks at room temperature.""}]"
Carrot Kheer Recipe (Gajar Ki Kheer),whiskaffair_web,https://www.whiskaffair.com/carrot-kheer-recipe/,4,10,40,50,https://www.whiskaffair.com/wp-content/uploads/2020/07/Carrot-Kheer-2-3.jpg,"[{""raw_text"": ""2 tablespoons ghee"", ""source_position"": 1}, {""raw_text"": ""10-12 cashew nuts (chopped)"", ""source_position"": 2}, {""raw_text"": ""10-12 almonds (chopped)"", ""source_position"": 3}, {""raw_text"": ""10-12 raisins"", ""source_position"": 4}, {""raw_text"": ""2 medium red carrots"", ""source_position"": 5}, {""raw_text"": ""4 tablespoons granulated white sugar (divided)"", ""source_position"": 6}, {""raw_text"": ""2 cups whole milk (full-fat milk)"", ""source_position"": 7}, {""raw_text"": ""1 pinch saffron strands"", ""source_position"": 8}, {""raw_text"": ""½ teaspoon cardamom powder"", ""source_position"": 9}]","[{""step_number"": 1, ""instruction"": ""Wash 2 medium red carrots and peel them using a vegetable peeler. Discard ½-inch of the top and bottom using a knife. Grate the carrots using the small or medium side of a box grater. You need 1 cup of grated carrots.""}, {""step_number"": 2, ""instruction"": ""Note – Instead of grating, you can also puree the carrots for a smooth texture of the Kheer. I personally like to grate the carrots as it gives a nice texture to the kheer.""}, {""step_number"": 3, ""instruction"": ""Heat ghee in a pan over medium heat.""}, {""step_number"": 4, ""instruction"": ""Once the ghee is hot, add cashew nuts, almonds, and raisins and fry for 3-4 seconds.""}, {""step_number"": 5, ""instruction"": ""Add grated carrots to the pan and fry for 4-5 minutes until the raw smell goes off, stirring frequently.""}, {""step_number"": 6, ""instruction"": ""Add 2 tablespoons of granulated white sugar and cook for a minute. Remove the pan from the heat and keep aside.""}, {""step_number"": 7, ""instruction"": ""Add milk and saffron to another pan and boil over medium-high heat, stirring frequently.""}, {""step_number"": 8, ""instruction"": ""Once the milk comes to a boil, reduce the heat to low. Cook for 10-12 minutes, stirring frequently.""}, {""step_number"": 9, ""instruction"": ""Add carrot mixture to the milk and cook for 10-12 minutes.""}, {""step_number"": 10, ""instruction"": ""Add 2 tablespoons of granulated white sugar and cardamom powder and cook for 3-4 minutes.""}, {""step_number"": 11, ""instruction"": ""Taste the kheer for sweetness. Add more sugar if needed and cook for another minute.""}, {""step_number"": 12, ""instruction"": ""Serve hot or chilled.""}]"
