name,source,source_url,servings,prep_time_min,cook_time_min,total_time_min,image_url,ingredients_json,cook_steps
"Lauki Halwa Recipe (Dudhi Halwa, Bottle Gourd Halwa)",whiskaffair_web,https://www.whiskaffair.com/lauki-ka-halwa/,6,10,60,70,https://www.whiskaffair.com/wp-content/uploads/2021/01/Lauki-Ka-Halwa-2-3.jpg,"[{""raw_text"": ""7 ounces grated khoya (200 g)"", ""source_position"": 1}, {""raw_text"": ""4 tablespoons ghee"", ""source_position"": 2}, {""raw_text"": ""10-12 almonds (crushed into small pieces)"", ""source_position"": 3}, {""raw_text"": ""10-12 cashew nuts (crushed into small pieces)"", ""source_position"": 4}, {""raw_text"": ""10 ounces peeled, seeded, and grated lauki (bottle gourd) (300 g)"", ""source_position"": 5}, {""raw_text"": ""3 cups whole milk (full-fat milk)"", ""source_position"": 6}, {""raw_text"": ""½ teaspoon cardamom powder"", ""source_position"": 7}, {""raw_text"": ""¼ teaspoon rose water"", ""source_position"": 8}, {""raw_text"": ""¾ cup granulated white sugar"", ""source_position"": 9}, {""raw_text"": ""slivered nuts for garnishing"", ""source_position"": 10}]","[{""step_number"": 1, ""instruction"": ""Start by preparing the lauki. Peel a small lauki using a vegetable peeler. You should reach the soft part and discard all the hard skin. Now cut it into half vertically and remove all the seeds and the pith if there are any.""}, {""step_number"": 2, ""instruction"": ""Add khoya to a non-stick pan and cook it on medium heat until it turns slightly brown (4-5 minutes), stirring continuously. This is to remove the raw smell of the khoya.""}, {""step_number"": 3, ""instruction"": ""Heat ghee in a heavy bottom large size pan over medium heat.""}, {""step_number"": 4, ""instruction"": ""Once the ghee is hot, add almonds and cashew nuts to the pan. Fry them until they are golden brown (1-2 minutes), stirring frequently.""}, {""step_number"": 5, ""instruction"": ""Add lauki to the pan and cook for 5-6 minutes, stirring frequently.""}, {""step_number"": 6, ""instruction"": ""Now add whole milk to the pan and mix well.""}, {""step_number"": 7, ""instruction"": ""Reduce the heat to low.""}, {""step_number"": 8, ""instruction"": ""Cook the halwa until all the milk has reduced (20-25 minutes). Stir frequently to prevent milk from burning at the bottom of the pan.""}, {""step_number"": 9, ""instruction"": ""Add cardamom powder and rose water and cook for a minute.""}, {""step_number"": 10, ""instruction"": ""Add the browned khoya and sugar to the pan and mix everything well. The halwa will become slightly runny at this stage because of the melted sugar.""}, {""step_number"": 11, ""instruction"": ""Increase the heat to medium.""}, {""step_number"": 12, ""instruction"": ""Cook until the halwa has thickened and the ghee starts to leave the sides of the pan (15-20 minutes), stirring frequently.""}, {""step_number"": 13, ""instruction"": ""Do not overcook otherwise, the halwa will become too thick, and do not undercook, otherwise, it will be watery.""}, {""step_number"": 14, ""instruction"": ""Garnish the ready halwa with almonds and pistachio slivers. I also like adding some dry rose petals as they contrast nicely. If making it for a special occasion, you can press some edible silver leaf on top. Serve warm.""}]"
Phirni Recipe (Firni),whiskaffair_web,https://www.whiskaffair.com/kesar-phirni-recipe/,6,10,60,130,https://www.whiskaffair.com/wp-content/uploads/2020/07/Phirni-2-3.jpg,"[{""raw_text"": ""3 tablespoons raw white rice"", ""source_position"": 1}, {""raw_text"": ""4 cups whole milk (full-fat milk)"", ""source_position"": 2}, {""raw_text"": ""1 teaspoon ghee"", ""source_position"": 3}, {""raw_text"": ""15-20 strands saffron (optional)"", ""source_position"": 4}, {""raw_text"": ""½ cup granulated white sugar"", ""source_position"": 5}, {""raw_text"": ""½ teaspoon rose water"", ""source_position"": 6}, {""raw_text"": ""almond and pistachio slivers for garnishing"", ""source_position"": 7}]","[{""step_number"": 1, ""instruction"": ""Rinse 3 tablespoon white rice with water and soak it in 1 cup of water for an hour.""}, {""step_number"": 2, ""instruction"": ""Drain the water. Add the soaked rice to the small jar of a blender or a small food processor with 1 tablespoon water, and blend to make a coarse paste. Scrape the sides of the jar a few times while blending.""}, {""step_number"": 3, ""instruction"": ""Heat 1 teaspoon ghee in a non-stick heavy bottom medium-sized pan over medium heat. When the ghee is hot, add 32 fl oz (1 liter) of whole milk to the pan and bring it to a boil.""}, {""step_number"": 4, ""instruction"": ""Stir frequently while heating to avoid scorching the milk at the bottom of the pan.""}, {""step_number"": 5, ""instruction"": ""Rinse rice with water and soak it in 1 cup of water for an hour.""}, {""step_number"": 6, ""instruction"": ""Drain the water and add the rice to a small blender jar along with 1 tablespoon water. Blend to make a coarse paste. Scrape the sides of the jar a few times while blending.""}, {""step_number"": 7, ""instruction"": ""Heat ghee in a non-stick heavy bottom medium-sized pan over medium heat.""}, {""step_number"": 8, ""instruction"": ""When the ghee is hot, add milk to the pan and bring it to a boil. Stir frequently while heating to avoid scorching the milk at the bottom of the pan.""}, {""step_number"": 9, ""instruction"": ""Add the ground rice and saffron strands to the milk and stir well.""}, {""step_number"": 10, ""instruction"": ""Reduce the heat to low and cook for 40-50 minutes until the phirni has thickened, stirring at regular intervals to avoid the formation of lumps.""}, {""step_number"": 11, ""instruction"": ""Scrape the sides of the pan regularly and add the thickened milk back to the pan.""}, {""step_number"": 12, ""instruction"": ""Add sugar and rose water to the pan and mix well. You can adjust the sugar according to your taste. Cook for another minute until the sugar is dissolved.""}, {""step_number"": 13, ""instruction"": ""Transfer the phirni into individual serving earthen bowls. You can use glass or ceramic bowls too. You can also serve the phini in one large serving bowl instead of serving it individually.""}]"
Maharashtrian Puran Poli Sweet Recipe,whiskaffair_web,https://www.whiskaffair.com/puran-poli/,8,10,60,190,https://www.whiskaffair.com/wp-content/uploads/2018/12/Puran-Poli-2-3.jpg,"[{""raw_text"": ""1 cup Bengal gram lentil (chana dal)"", ""source_position"": 1}, {""raw_text"": ""1 cup grated jaggery"", ""source_position"": 2}, {""raw_text"": ""1 tablespoon ghee"", ""source_position"": 3}, {""raw_text"": ""¼ teaspoon nutmeg powder"", ""source_position"": 4}, {""raw_text"": ""½ teaspoon cardamom powder"", ""source_position"": 5}, {""raw_text"": ""2 cups whole wheat flour (gehu ka atta)"", ""source_position"": 6}, {""raw_text"": ""½ cup all-purpose flour (maida)"", ""source_position"": 7}, {""raw_text"": ""¼ teaspoon turmeric powder (optional)"", ""source_position"": 8}, {""raw_text"": ""¼ teaspoon salt"", ""source_position"": 9}, {""raw_text"": ""2 tablespoons hot ghee (plus more for frying)"", ""source_position"": 10}]","[{""step_number"": 1, ""instruction"": ""Wash the dal with water 2-3 times and soak it in 4-5 cups of water for 30 minutes.""}, {""step_number"": 2, ""instruction"": ""Once the dal is soaked, drain the water and add the soaked chana dal to a pressure cooker.""}, {""step_number"": 3, ""instruction"": ""Add 3 cups of water to the cooker and close the lid. Pressure cook the dal on high heat for one whistle, then reduce the heat to low and cook for another 15 minutes.""}, {""step_number"": 4, ""instruction"": ""Remove the cooker from heat and let the pressure release naturally. Once the pressure is released, open the lid of the cooker.""}, {""step_number"": 5, ""instruction"": ""The dal must be well-cooked. If it’s not cooked well, cook it for another few minutes.""}, {""step_number"": 6, ""instruction"": ""Once the dal is soaked, drain the water and add the soaked chana dal to an instant pot.""}, {""step_number"": 7, ""instruction"": ""Add 3 cups of water and close the lid of the instant pot.""}, {""step_number"": 8, ""instruction"": ""Press PRESSURE COOK and set the timer to 15 minutes on high pressure.""}, {""step_number"": 9, ""instruction"": ""Once the timer goes off, let the pressure release naturally for 10 minutes.""}, {""step_number"": 10, ""instruction"": ""Release the remaining pressure manually and open the lid of the instant pot.""}, {""step_number"": 11, ""instruction"": ""Strain the cooked dal using a fine-mesh strainer and reserve the water for other uses like making katachi amti or curries. Try to get rid of as much liquid as possible while straining.""}, {""step_number"": 12, ""instruction"": ""Add the cooked dal, jaggery, and ghee to a nonstick pan and cook on medium heat until the jaggery is dissolved and mixed with the dal.""}, {""step_number"": 13, ""instruction"": ""Add nutmeg powder and cardamom powder and mix well.""}, {""step_number"": 14, ""instruction"": ""Cook the mixture until it starts leaving the pan’s sides and is thickened nicely (12-15 minutes). Stir frequently and keep mashing the dal with the back of the spoon.""}, {""step_number"": 15, ""instruction"": ""Note – Insert a spoon in the middle to check if the filling is cooked well. If it can stand straight, then the puran is cooked to the right consistency.""}, {""step_number"": 16, ""instruction"": ""Remove the filling from the heat and let it cool down for an hour.""}, {""step_number"": 17, ""instruction"": ""Add the cooled puran to a blender or a food processor and blend until it is very smooth.""}, {""step_number"": 18, ""instruction"": ""You can also mash the puran with the heels of your hands until very smooth.""}, {""step_number"": 19, ""instruction"": ""Note – The idea is to make a very smooth pooran. If the puran is not smooth, the poli will tear while rolling.""}, {""step_number"": 20, ""instruction"": ""Note – A particular device called puran yantra is used in many Maharashtrian houses to make the puran super smooth. Some people also pass it through a mesh strainer.""}, {""step_number"": 21, ""instruction"": ""Add whole wheat flour, all-purpose flour, salt, turmeric powder, and hot ghee to a large mixing bowl (or a parat) and mix well using your fingertips.""}, {""step_number"": 22, ""instruction"": ""Gradually add water (approx 1 cup) and knead to make a very soft dough. The quantity of water will depend on the quality of the flour used. Do not add much water at once; otherwise, the dough will become sticky.""}, {""step_number"": 23, ""instruction"": ""Tip – You can use your stand mixer fitted with a dough attachment or a food processer to knead the dough.""}, {""step_number"": 24, ""instruction"": ""Cover the dough with a damp kitchen towel and keep it aside for 30 minutes.""}, {""step_number"": 25, ""instruction"": ""Divide the dough into 6-8 equal portions and roll each piece to make smooth balls.""}, {""step_number"": 26, ""instruction"": ""Similarly, divide the puran into 6-8 equal portions and roll to make balls.""}, {""step_number"": 27, ""instruction"": ""Take one of the portions of the dough and slightly flatten the ball between your palms.""}, {""step_number"": 28, ""instruction"": ""Dust it with dry flour gently and roll to make a 4-5 inch circle.""}, {""step_number"": 29, ""instruction"": ""Keep a filling ball in the circle’s center and bring the ends together.""}, {""step_number"": 30, ""instruction"": ""Roll the filled dough ball in between your palms and keep rotating while rolling. This step will ensure that the puran reaches the corners of the poli.""}, {""step_number"": 31, ""instruction"": ""Now keep the disc on the rolling surface. Dust with dry flour and roll using a rolling pin to make an 8-10 inch circle. While rolling, apply the pressure gently and go from one side to the other. Try to roll the edges a little thinner than the center. Keep rotating the surface if it is getting tough to roll from one side.""}, {""step_number"": 32, ""instruction"": ""Heat a griddle (tawa) over medium-high heat.""}, {""step_number"": 33, ""instruction"": ""Once the tawa is hot, transfer the puran poli to it.""}, {""step_number"": 34, ""instruction"": ""Cook until brown spots appear on the bottom side. Flip the poli and cook until brown spots appear on the other side.""}, {""step_number"": 35, ""instruction"": ""Flip the poli again and apply 1 teaspoon of ghee on each side. Press the poli using the back of a spoon and cook until golden brown from both sides.""}, {""step_number"": 36, ""instruction"": ""Make all the poli in the same manner. Apply some more ghee and serve it with milk or katachi amti.""}, {""step_number"": 37, ""instruction"": ""Note – Wipe the skillet every time before adding the next poli.""}]"
Easy Mango Kulfi Recipe (India Mango Ice Cream) - 2 ways,whiskaffair_web,https://www.whiskaffair.com/kesar-mango-kulfi/,8,10,45,535,https://www.whiskaffair.com/wp-content/uploads/2020/06/Mango-Kulfi-2-3.jpg,"[{""raw_text"": ""¼ cup whole almonds"", ""source_position"": 1}, {""raw_text"": ""¼ cup whole cashew nuts"", ""source_position"": 2}, {""raw_text"": ""2 tablespoons unsalted pistachios"", ""source_position"": 3}, {""raw_text"": ""1 liter whole milk (full-fat milk)"", ""source_position"": 4}, {""raw_text"": ""1 pinch saffron strands (optional)"", ""source_position"": 5}, {""raw_text"": ""8 ounces sweetened condensed milk (250 g)"", ""source_position"": 6}, {""raw_text"": ""1 tablespoon cornstarch (cornflour)"", ""source_position"": 7}, {""raw_text"": ""¼ cup unsweetened heavy cream"", ""source_position"": 8}, {""raw_text"": ""1 cup mango puree (fresh or canned)"", ""source_position"": 9}, {""raw_text"": ""almond and pistachio slivers for garnishing"", ""source_position"": 10}]","[{""step_number"": 1, ""instruction"": ""Add almonds, cashew nuts, and pistachio to the small jar of a grinder and grind to make a coarse powder. Do not grind for a long time otherwise, the nuts will get heated, release their oil, and become moist.""}, {""step_number"": 2, ""instruction"": ""Keep the powder aside.""}, {""step_number"": 3, ""instruction"": ""Add whole milk into a heavy-bottomed non-stick pan and bring it to a boil over medium-high heat. Once the milk comes to a boil, reduce the heat to low.""}, {""step_number"": 4, ""instruction"": ""Add saffron threads (optional) to the pan and mix well.""}, {""step_number"": 5, ""instruction"": ""Let the milk cook on low heat until it is reduced to almost ½ of the initial volume (20-25 minutes). Stir frequently at regular intervals to avoid scorching at the bottom of the pan.""}, {""step_number"": 6, ""instruction"": ""Keep scraping the sides of the pan at regular intervals and add the solidified milk back to the pan.""}, {""step_number"": 7, ""instruction"": ""Once the milk is reduced to ½, add the almond cashew pistachio powder that we made earlier to the pan and mix well.""}, {""step_number"": 8, ""instruction"": ""Add condensed milk to the pan and mix well.""}, {""step_number"": 9, ""instruction"": ""Dissolve cornstarch in water to make a slurry, and add the slurry to the milk.""}, {""step_number"": 10, ""instruction"": ""Add heavy cream and cook for another 2-3 minutes until the milk becomes thick and creamy.""}, {""step_number"": 11, ""instruction"": ""Remove the pan from heat and cool the mixture completely.""}, {""step_number"": 12, ""instruction"": ""When the mixture is cooled, add mango puree to it and mix well.""}, {""step_number"": 13, ""instruction"": ""Note – Check for sweetness at this stage. If needed, add sugar and mix until dissolved.""}, {""step_number"": 14, ""instruction"": ""Pour the mixture into kulfi molds and seal them tightly with the lid. Freeze for 6-8 hours or until set.""}, {""step_number"": 15, ""instruction"": ""Note – Sealing the mold tightly is important to avoid the formation of ice crystals in the kulfi.""}, {""step_number"": 16, ""instruction"": ""To serve, remove the mango kulfi from the molds by dipping the molds in water for a few seconds. Garnish with almond and pistachio slivers. Serve immediately.""}]"
Mango Shrikhand Recipe (Amrakhand),whiskaffair_web,https://www.whiskaffair.com/kesar-aam-srikhand/,6,10,5,1095,https://www.whiskaffair.com/wp-content/uploads/2021/05/Mango-Shrikhand-2-3.jpg,"[{""raw_text"": ""1 pound plain yogurt (dahi, curd) (500 g, or Greek yogurt)"", ""source_position"": 1}, {""raw_text"": ""½ cup mango puree (homemade or canned)"", ""source_position"": 2}, {""raw_text"": ""½ teaspoon ground cardamom"", ""source_position"": 3}, {""raw_text"": ""1 pinch saffron strands"", ""source_position"": 4}, {""raw_text"": ""¼ cup powdered sugar"", ""source_position"": 5}]","[{""step_number"": 1, ""instruction"": ""How to make mango puree? To make mango puree, wash a large, ripe, and juicy mango and wipe it with a kitchen cloth. Peel the skin using a sharp knife. Cut the flesh away from the seed and discard the seed. Chop the mango flesh into pieces. Add the pieces to a blender and blend until smooth. Mango puree is ready. You can refrigerate it for 3-4 days or freeze it for 6 months. Check out my detailed post on how to make mango puree here. Can I replace mango with anything else? Replace mango puree with strawberry puree or blueberry puree and make strawberry shrikhand or blueberry shrikhand.""}, {""step_number"": 2, ""instruction"": ""Make Hung Yogurt Keep a fine-mesh strainer over a large bowl and line the strainer with a muslin cloth. Transfer yogurt to the strainer, gather the cloth's corners, and tie it into a bundle. Tip – Keep a heavy object (like a stone mortar on top of a wooden round plate) over the yogurt. It will make the dripping process quicker. Keep the bowl in the refrigerator for 12-18 hours. If using Greek yogurt, you can reduce the time to 6-7 hours. The liquid will drip from the yogurt making it thick and creamy. The thick yogurt that is collected now is called CHAKKA. Discard the liquid or drink it.""}, {""step_number"": 3, ""instruction"": ""Transfer the thickened yogurt to a medium mixing bowl and whisk well until smooth and creamy.""}, {""step_number"": 4, ""instruction"": ""Add mango puree, cardamom, saffron strands, and sugar to the bowl and mix well until combined.""}, {""step_number"": 5, ""instruction"": ""Check for sugar and add more if needed.""}, {""step_number"": 6, ""instruction"": ""Refrigerate the mango shrikhand for a few hours. Garnish with slivered dry fruits and nuts. Serve chilled.""}]"
Kesar Elaichi Shrikhand Recipe (Sweetened Yogurt Dessert),whiskaffair_web,https://www.whiskaffair.com/kesar-elaichi-srikhand/,3,2,10,612,https://www.whiskaffair.com/wp-content/uploads/2020/08/Shrikhand-2-3.jpg,"[{""raw_text"": ""15-20 strands saffron (kesar)"", ""source_position"": 1}, {""raw_text"": ""2 tablespoons warm milk"", ""source_position"": 2}, {""raw_text"": ""1 pound plain yogurt (dahi, curd) (500 g)"", ""source_position"": 3}, {""raw_text"": ""½ cup powdered sugar (not confectioner's sugar. Grind the regular sugar in a grinder to make powdered sugar.)"", ""source_position"": 4}, {""raw_text"": ""1 teaspoon ground cardamom"", ""source_position"": 5}, {""raw_text"": ""2 tablespoons almond and pistachio slivers (for garnishing)"", ""source_position"": 6}]","[{""step_number"": 1, ""instruction"": ""Soak saffron in warm milk for 3-4 hours.""}, {""step_number"": 2, ""instruction"": ""Using saffron to flavor the shrikhand is optional. Skip this step if you are not using it.""}, {""step_number"": 3, ""instruction"": ""Keep a fine mesh strainer over a large bowl and line it with a muslin cloth, paper towels, or a cheesecloth. There should be some gap between the bottom of the bowl and the bottom of the strainer for the liquid to collect.""}, {""step_number"": 4, ""instruction"": ""Add yogurt to the strainer and cover the yogurt with the cloth hanging on the side.""}, {""step_number"": 5, ""instruction"": ""Keep the bowl in the refrigerator for 5-6 hours or overnight to drain.""}, {""step_number"": 6, ""instruction"": ""The excess liquid will drip down in the bowl and you will be left with thick creamy yogurt called chakka.""}, {""step_number"": 7, ""instruction"": ""If using Greek yogurt, you can skip the process of hanging and use it directly.""}, {""step_number"": 8, ""instruction"": ""Transfer the thickened yogurt to a mixing bowl.""}, {""step_number"": 9, ""instruction"": ""Add powdered sugar, ground cardamom, and saffron soaked in milk and whisk using a wire whisk until combined and creamy.""}, {""step_number"": 10, ""instruction"": ""Chill the shrikhand for 2-3 hours for the flavors to mingle well. Transfer it to the serving bowls and garnish with slivered dry fruits. Serve!""}, {""step_number"": 11, ""instruction"": ""Tip – Use a silicon spatula to gather all the shrikhand on the bowl.""}]"
Easy Sabudana Kheer Recipe (Indian Tapioca Pudding),whiskaffair_web,https://www.whiskaffair.com/sabudane-ki-kheer/,4,10,60,70,https://www.whiskaffair.com/wp-content/uploads/2020/10/Sabudana-Kheer-2-3.jpg,"[{""raw_text"": ""½ cup medium size sabudana (sago, tapioca pearls)"", ""source_position"": 1}, {""raw_text"": ""½ cup water (for soaking)"", ""source_position"": 2}, {""raw_text"": ""34 ounces whole milk (full-fat milk) (1 liter)"", ""source_position"": 3}, {""raw_text"": ""15-20 strands saffron (optional)"", ""source_position"": 4}, {""raw_text"": ""½ teaspoon ground cardamom (elaichi powder)"", ""source_position"": 5}, {""raw_text"": ""¼ cup granulated white sugar (or to taste)"", ""source_position"": 6}]","[{""step_number"": 1, ""instruction"": ""Note – Unlike the sabudana khichdi recipe where you have to rinse sabudana many times to get rid of the excess starch, sabudana kheer recipe requires you to wash it just once. We want the starch to make the kheer creamy and luscious.""}, {""step_number"": 2, ""instruction"": ""Soak sabudana in ½ cup water for 4-5 hours. Tip – If you have forgotten to soak the sabudana beforehand, then soak it in boiling water for 30 minutes.""}, {""step_number"": 3, ""instruction"": ""Heat 34 oz (1 liter) whole milk over medium-high heat in a heavy-bottom pan. Stir frequently to prevent scorching at the bottom of the pan. When the milk boils, stir in the soaked sabudana along with 15-20 saffron strands. Note – Never add the sabudana to the pan before the milk comes to a rolling boil. Doing so might curdle the milk. Reduce the heat to low and cook the kheer until it gets thick and the sabudana is cooked well (Approx 40-60 minutes). The consistency of the ready kheer should be flowy like custard. Stir very frequently while cooking. Post-cooking, sabudana pearls must be soft, slightly sticky, and translucent. There shouldn’t be any bite in them.""}, {""step_number"": 4, ""instruction"": ""Stir in ¼ cup of granulated sugar and ½ teaspoon cardamom powder and cook for another 2-3 minutes. Check for sugar and add more if you like the kheer sweeter. Garnish with slivered almonds and pistachios and dried rose petals. Serve sago kheer hot or chilled.""}, {""step_number"": 5, ""instruction"": ""Rinse ½ cup sabudana with water and soak it in ½ cup water for 4-5 hours.""}, {""step_number"": 6, ""instruction"": ""Add the soaked sabudana, ½ cup water, and 15-20 strands of saffron to the instant pot and stir gently. Tip – Never pressure cook the sabudana with milk. The milk might curdle while cooking and it will spoil the kheer. Press PRESSURE COOK and set the timer to 6 minutes at HIGH PRESSURE. Once the pressure is released, open the pot lid and stir once. Press SAUTE.""}, {""step_number"": 7, ""instruction"": ""Add 18 oz (½ liter) whole milk to the pot and cook until the kheer thickens (12-15 minutes). Stir frequently to avoid the kheer from scorching.""}, {""step_number"": 8, ""instruction"": ""Stir in ¼ cup sugar and ½ teaspoon cardamom powder and cook for another minute. Check for sugar and add more if you like it sweeter. Garnish with slivered almonds & pistachios and dried rose petals and serve the kheer hot or chilled.""}, {""step_number"": 9, ""instruction"": ""Rinse sabudana with water.""}, {""step_number"": 10, ""instruction"": ""Soak it in ½ cup water for 4-5 hours.""}, {""step_number"": 11, ""instruction"": ""Tip – If you have forgotten to soak the sabudana beforehand, then soak it in boiling hot water for 30 minutes. It will be ready to use.""}, {""step_number"": 12, ""instruction"": ""Heat milk in a heavy bottom pan over medium-high heat. Stir frequently to prevent scorching.""}, {""step_number"": 13, ""instruction"": ""When the milk comes to a boil, stir in the soaked sabudana along with saffron strands.""}, {""step_number"": 14, ""instruction"": ""Note – Never add the sabudana to the pan before the milk comes to a rolling boil. Doing so might curdle the milk.""}, {""step_number"": 15, ""instruction"": ""Reduce the heat to low and cook the kheer until it gets thick and the sabudana is cooked well (Approx 40-60 minutes).""}, {""step_number"": 16, ""instruction"": ""The consistency of the kheer should be flowy like custard. Keep stirring very frequently while cooking.""}, {""step_number"": 17, ""instruction"": ""Post cooking, sabudana pearls must be soft, slightly sticky, and translucent. There shouldn’t be any bite in them.""}, {""step_number"": 18, ""instruction"": ""Stir in sugar and cardamom powder and cook for another 2-3 minutes.""}, {""step_number"": 19, ""instruction"": ""Check for sugar and add more if you like it sweeter.""}, {""step_number"": 20, ""instruction"": ""Garnish with slivered almonds & pistachios and dried rose petals and serve hot or chilled.""}]"
