title,description,source_url,ingredients,instructions,raw_text,youtube_video_id,youtube_channel,youtube_channel_url,duration_seconds,upload_date,view_count
Aapka Jeera Rice Bhi Chipakta Hai? Yeh Secret Dekho | How to Make Perfect Jeera Rice | Kunal Kapur,"Jeera rice doesn’t always need a gas stove to come together -you can make it just as easily in the microwave, which is a great option when you’re low on LPG, travelling, or simply want a quicker, fuss-free method. It’s efficient, uses minimal setup, and still gives you that same comforting, aromatic bowl without standing in the kitchen. Perfect for days when you want something simple, reliable, and stress-free. Ingredients: Tempering Time - 4 mins | Power - 100",https://www.youtube.com/watch?v=oYa937mfXRk,Time - 4 mins | Power - 100 | Oil (तेल) - 1 tbsp | Black cardamom (काली इलाइची) - 2 nos | Bay leaves (तेज पत्ता) - 2 nos | Cumin (जीरा) - ½ tsp | Salt (नमक) - a large pinch | Water (पानी) - 1 cup | Time - 10 mins | Microwave Power - Max | Basmati Rice (चावल) - ½ cup | Salt (नमक) - a pinch (optional) | Water (पानी) - 1 cup,"Wash and soak ½ cup basmati rice for 15 to 20 minutes, then drain | In a microwave safe bowl add 1 tbsp oil, 2 black cardamom, 2 bay leaves and ½ tsp cumin seeds. | Microwave on Power 100 for 3 minutes | Add rice, 1 cup water and a large pinch of salt to this tempering | Microwave on Max power for 10 minutes till rice is cooked | Gently mix the cooked rice into the tempering | Let it rest for 5 minutes, fluff gently and serve hot | jeera rice recipe, microwave jeera rice, cumin rice recipe, jeera rice in microwave, easy rice recipe, quick rice recipe, indian rice recipes, basmati rice recipe, simple rice recipe, beginner cooking recipes indian, bachelor cooking, quick dinner ideas, indian comfort food, dal chawal combo, restaurant style jeera rice, chef kunal kapoor recipes, easy indian recipes, microwave cooking, no gas cooking, quick meals, everyday cooking | Hi, I am Chef Kunal Kapur and this is my space, my channel. | Subscribe & Together let's cook. | 👉🏻 Click here to Subscribe: https://www.youtube.com/c/KunalKapur | 👉🏻 Website: http://www.chefkunalkapur.com/​​​​​​​ | -------------------------------------------------------------------------------------","Jeera rice doesn’t always need a gas stove to come together -you can make it just as easily in the microwave, which is a great option when you’re low on LPG, travelling, or simply want a quicker, fuss-free method. It’s efficient, uses minimal setup, and still gives you that same comforting, aromatic bowl without standing in the kitchen. Perfect for days when you want something simple, reliable, and stress-free. Ingredients: Tempering Time - 4 mins | Power - 100 Oil (तेल) - 1 tbsp Black cardamom (काली इलाइची) - 2 nos Bay leaves (तेज पत्ता) - 2 nos Cumin (जीरा) - ½ tsp Salt (नमक) - a large pinch Water (पानी) - 1 cup Boiled Rice In Microwave Time - 10 mins | Microwave Power - Max Basmati Rice (चावल) - ½ cup Salt (नमक) - a pinch (optional) Water (पानी) - 1 cup Method: 1. Wash and soak ½ cup basmati rice for 15 to 20 minutes, then drain 2. In a microwave safe bowl add 1 tbsp oil, 2 black cardamom, 2 bay leaves and ½ tsp cumin seeds. Microwave on Power 100 for 3 minutes 3. Add rice, 1 cup water and a large pinch of salt to this tempering 4. Microwave on Max power for 10 minutes till rice is cooked 5. Gently mix the cooked rice into the tempering 6. Let it rest for 5 minutes, fluff gently and serve hot jeera rice recipe, microwave jeera rice, cumin rice recipe, jeera rice in microwave, easy rice recipe, quick rice recipe, indian rice recipes, basmati rice recipe, simple rice recipe, beginner cooking recipes indian, bachelor cooking, quick dinner ideas, indian comfort food, dal chawal combo, restaurant style jeera rice, chef kunal kapoor recipes, easy indian recipes, microwave cooking, no gas cooking, quick meals, everyday cooking Hi, I am Chef Kunal Kapur and this is my space, my channel. Subscribe & Together let's cook. 👉🏻 Click here to Subscribe: https://www.youtube.com/c/KunalKapur 👉🏻 Website: http://www.chefkunalkapur.com/​​​​​​​ ------------------------------------------------------------------------------------- Follow Chef Kunal Kapur on your favorite Social Media Channels: 👥 Facebook: https://www.facebook.com/thekunalkapur​ 📸 Instagram: https://www.instagram.com/chefkunal​​​ 🐦 Twitter: https://twitter.com/ChefKunalKapur​​​​ 📌 Pinterest: https://in.pinterest.com/chefkunal",oYa937mfXRk,Kunal Kapur,https://www.youtube.com/@KunalKapur/videos,351,20260429,19988
Instant Green Chilli Pickle | 5 Min में मिर्च का अचार | Kunal Kapur Recipes,"Craving something spicy, tangy, and full of flavour? This instant hari mirch ka chaat (green chilli pickle) is your new go-to! Made in just 5 minutes, this recipe needs no cooking, no vinegar, and no sunlight - perfect for when you want a quick desi condiment without the wait. It’s bold, zesty, and pairs beautifully with parathas, dal-chawal, khichdi, or even simple roti-sabzi. If you love traditional Indian pickles but don’t have the time for long processes, this one’s a total game-changer. Instant Green Chilli Pickle Ingredients",https://www.youtube.com/watch?v=bLyHnQ_JWrw,Green chilli (हरी मिर्च) - 250 gms | Salt (नमक) - 1½ tsp | Fenugreek seeds (मेथी दाना) - 1 tsp | Kalonji (कलौंजी)- 1 tsp | Fennel (सौंफ) - 1 tbsp | Mustard seeds (राई) - 2 tbsp | Asafoetida (हींग) - ½ tsp | Turmeric powder (हल्दी) - 1 tsp | Kashmiri red chilli (कश्मीरी लाल मिर्च) - 1½ tsp | Salt (नमक) - 1½ tsp | Mustard oil (सरसों का तेल) - ¼ cup | Vinegar (सिरका) - 3 tbsp,"Wash the green chillies thoroughly and dry them completely (no moisture). | Cut them into halves or small pieces, depending on your preference. | In a mortar-pestle or mixer (pulse mode), coarsely crush: | fenugreek seeds, fennel seeds, mustard seeds, and kalonji. | (Don’t make a fine powder—keep it slightly coarse for texture.) | Heat the mustard oil until it reaches smoking point. | Turn off the flame and let it cool down slightly. | Mix everything together | In a large bowl, add the chopped chillies. | Add salt, turmeric, Kashmiri red chilli powder, hing, and the crushed spices. | Mix well so the chillies are evenly coated. | Add oil & vinegar | Pour the slightly cooled mustard oil over the mixture. | Add vinegar and mix everything really well. | Rest (optional but recommended) | Let it sit for 10–15 minutes so the flavours come together. | 01:10 - how to slice your green chillies for achaar | 03:02 - make the achaar mix | 07:34 - how to store your achaar | (kunal kapur, instant green chilli pickle, hari mirch ka achar instant, hari mirch ka chaat recipe, green chilli pickle no cook, no cook achar recipe, instant achar without sunlight, no vinegar pickle recipe, 5 minute pickle recipe, quick indian pickle, hari mirch ka instant achar, green chilli chutney style achar, easy achar recipe at home, indian pickle without oil cooking, instant mirchi ka achar, spicy green chilli pickle, homemade achar recipe quick, lunchbox pickle recipe, small batch pickle recipe, quick side dish indian, desi pickle instant, no sun pickle recipe, no fermentation pickle, fresh achar recipe, hari mirch ki launji instant, mirchi ka chatpata achar, indian condiments quick recipe, 5 min recipes indian, easy spicy side dish, quick accompaniments indian meals, pickle for paratha, dal chawal side dish recipe) | Hi, I am Chef Kunal Kapur and this is my space, my channel. | Subscribe & Together let's cook. | 👉🏻 Click here to Subscribe: https://www.youtube.com/c/KunalKapur | 👉🏻 Website: http://www.chefkunalkapur.com/​​​​​​​ | -------------------------------------------------------------------------------------","Craving something spicy, tangy, and full of flavour? This instant hari mirch ka chaat (green chilli pickle) is your new go-to! Made in just 5 minutes, this recipe needs no cooking, no vinegar, and no sunlight - perfect for when you want a quick desi condiment without the wait. It’s bold, zesty, and pairs beautifully with parathas, dal-chawal, khichdi, or even simple roti-sabzi. If you love traditional Indian pickles but don’t have the time for long processes, this one’s a total game-changer. Instant Green Chilli Pickle Ingredients Green chilli (हरी मिर्च) - 250 gms Salt (नमक) - 1½ tsp Fenugreek seeds (मेथी दाना) - 1 tsp Kalonji (कलौंजी)- 1 tsp Fennel (सौंफ) - 1 tbsp Mustard seeds (राई) - 2 tbsp Asafoetida (हींग) - ½ tsp Turmeric powder (हल्दी) - 1 tsp Kashmiri red chilli (कश्मीरी लाल मिर्च) - 1½ tsp Salt (नमक) - 1½ tsp Mustard oil (सरसों का तेल) - ¼ cup Vinegar (सिरका) - 3 tbsp Method: Wash the green chillies thoroughly and dry them completely (no moisture). Cut them into halves or small pieces, depending on your preference. In a mortar-pestle or mixer (pulse mode), coarsely crush: fenugreek seeds, fennel seeds, mustard seeds, and kalonji. (Don’t make a fine powder—keep it slightly coarse for texture.) Heat the mustard oil until it reaches smoking point. Turn off the flame and let it cool down slightly. Mix everything together In a large bowl, add the chopped chillies. Add salt, turmeric, Kashmiri red chilli powder, hing, and the crushed spices. Mix well so the chillies are evenly coated. Add oil & vinegar Pour the slightly cooled mustard oil over the mixture. Add vinegar and mix everything really well. Rest (optional but recommended) Let it sit for 10–15 minutes so the flavours come together. 01:10 - how to slice your green chillies for achaar 03:02 - make the achaar mix 07:34 - how to store your achaar (kunal kapur, instant green chilli pickle, hari mirch ka achar instant, hari mirch ka chaat recipe, green chilli pickle no cook, no cook achar recipe, instant achar without sunlight, no vinegar pickle recipe, 5 minute pickle recipe, quick indian pickle, hari mirch ka instant achar, green chilli chutney style achar, easy achar recipe at home, indian pickle without oil cooking, instant mirchi ka achar, spicy green chilli pickle, homemade achar recipe quick, lunchbox pickle recipe, small batch pickle recipe, quick side dish indian, desi pickle instant, no sun pickle recipe, no fermentation pickle, fresh achar recipe, hari mirch ki launji instant, mirchi ka chatpata achar, indian condiments quick recipe, 5 min recipes indian, easy spicy side dish, quick accompaniments indian meals, pickle for paratha, dal chawal side dish recipe) Hi, I am Chef Kunal Kapur and this is my space, my channel. Subscribe & Together let's cook. 👉🏻 Click here to Subscribe: https://www.youtube.com/c/KunalKapur 👉🏻 Website: http://www.chefkunalkapur.com/​​​​​​​ ------------------------------------------------------------------------------------- Follow Chef Kunal Kapur on your favorite Social Media Channels: 👥 Facebook: https://www.facebook.com/thekunalkapur​ 📸 Instagram: https://www.instagram.com/chefkunal​​​ 🐦 Twitter: https://twitter.com/ChefKunalKapur​​​​ 📌 Pinterest: https://in.pinterest.com/chefkunal",bLyHnQ_JWrw,Kunal Kapur,https://www.youtube.com/@KunalKapur/videos,544,20260421,442028
Dhaniya Paratha Recipe | हरे धनिया का पराठा | Coriander leaves paratha | Kunal Kapur Recipes,"Dhaniya Paratha is a vibrant, flavor-packed Indian flatbread that brings together the freshness of coriander with the warmth of everyday मसाले. Soft on the inside and lightly crisp on the outside, this paratha is perfect for breakfast, lunch, or even a quick dinner. The combination of atta and besan gives it a hearty texture, while ginger, green chilli, and herbs add a refreshing kick. Served hot with dahi, pickle, or a dollop of butter, it’s simple comfort food that feels both wholesome and indulgent. Ingredients Whole Wheat Flour (आटा) – 1 cup Gram Flour (बेसन) – ¼ cup",https://www.youtube.com/watch?v=JmJwQ1Q-sps,"Whole Wheat Flour (आटा) – 1 cup | Gram Flour (बेसन) – ¼ cup | Cumin (जीरा) – ½ tsp | Salt (नमक) – to taste | Ginger, chopped (अदरक) – 2 tsp | Green chilli, chopped (हरी मिर्च) – 2 nos | Onion, chopped (प्याज़) – ¼ cup | Turmeric (हल्दी) – ½ tsp | Chilli powder (मिर्ची पाउडर) – 1 tsp | Chaat masala (चाट मसाला) – 1 tsp | Fresh coriander, chopped (ताज़ा धनिया) – 1½ cups | Ghee (घी) – 1 tbsp | Water (पानी) – as required | Oil (तेल) – as required","In a large bowl, combine whole wheat flour, gram flour, cumin, salt, turmeric, chilli powder, and chaat masala. | Add chopped ginger, green chillies, onion, fresh coriander, and mint leaves. | Mix everything well so the herbs are evenly distributed. | Add ghee and start kneading the mixture, gradually adding water to form a soft, smooth dough. | Cover and let the dough rest for at least 15–20 minutes. | Divide the dough into 4 equal portions (about 110 g each) and shape into pedas. | Roll each peda into a paratha using a rolling pin. | Heat a tawa and cook the paratha on medium flame, applying ghee or oil on both sides, until golden brown spots appear. | Serve hot with curd, pickle, or butter. | (kunal kapur parantha recipes, dhaniya paratha recipe, coriander paratha, green paratha recipe, healthy paratha recipe, easy indian breakfast recipes, quick paratha recipe, besan paratha, atta paratha recipe, how to make dhaniya paratha, dhaniya roti recipe, crispy paratha recipe, soft paratha tips, indian flatbread recipes, breakfast ideas indian veg, tiffin recipes indian, lunch box recipes veg, north indian recipes, homemade paratha, मसालेदार पराठा, धनिया पराठा रेसिपी, हरा पराठा, आसान नाश्ता रेसिपी, healthy breakfast india, weight loss paratha recipe, high fiber recipes indian, street style paratha, dhaba style paratha, spicy paratha recipe, vegetarian recipes indian, quick dinner ideas veg, meal prep indian recipes, coriander recipes indian, pudina dhaniya paratha, flavorful paratha, best paratha recipe, beginners cooking indian, simple veg recipes, indian kitchen recipes, everyday cooking india, comfort food indian, homemade indian bread, easy tawa recipes, paratha with curd, indian breakfast ideas 2026, trending food reels recipe, viral paratha recipe, chef style paratha recipe) | Shop from VB Dace: https://vbdace.com/ | Hi, I am Chef Kunal Kapur and this is my space, my channel. | Subscribe & Together let's cook. | 👉🏻 Click here to Subscribe: https://www.youtube.com/c/KunalKapur | 👉🏻 Website: http://www.chefkunalkapur.com/​​​​​​​ | -------------------------------------------------------------------------------------","Dhaniya Paratha is a vibrant, flavor-packed Indian flatbread that brings together the freshness of coriander with the warmth of everyday मसाले. Soft on the inside and lightly crisp on the outside, this paratha is perfect for breakfast, lunch, or even a quick dinner. The combination of atta and besan gives it a hearty texture, while ginger, green chilli, and herbs add a refreshing kick. Served hot with dahi, pickle, or a dollop of butter, it’s simple comfort food that feels both wholesome and indulgent. Ingredients Whole Wheat Flour (आटा) – 1 cup Gram Flour (बेसन) – ¼ cup Cumin (जीरा) – ½ tsp Salt (नमक) – to taste Ginger, chopped (अदरक) – 2 tsp Green chilli, chopped (हरी मिर्च) – 2 nos Onion, chopped (प्याज़) – ¼ cup Turmeric (हल्दी) – ½ tsp Chilli powder (मिर्ची पाउडर) – 1 tsp Chaat masala (चाट मसाला) – 1 tsp Fresh coriander, chopped (ताज़ा धनिया) – 1½ cups Mint (पुदीना) – few sprigs Ghee (घी) – 1 tbsp Water (पानी) – as required Ghee (घी) – for smearing Oil (तेल) – as required Method In a large bowl, combine whole wheat flour, gram flour, cumin, salt, turmeric, chilli powder, and chaat masala. Add chopped ginger, green chillies, onion, fresh coriander, and mint leaves. Mix everything well so the herbs are evenly distributed. Add ghee and start kneading the mixture, gradually adding water to form a soft, smooth dough. Cover and let the dough rest for at least 15–20 minutes. Divide the dough into 4 equal portions (about 110 g each) and shape into pedas. Roll each peda into a paratha using a rolling pin. Heat a tawa and cook the paratha on medium flame, applying ghee or oil on both sides, until golden brown spots appear. Serve hot with curd, pickle, or butter. (kunal kapur parantha recipes, dhaniya paratha recipe, coriander paratha, green paratha recipe, healthy paratha recipe, easy indian breakfast recipes, quick paratha recipe, besan paratha, atta paratha recipe, how to make dhaniya paratha, dhaniya roti recipe, crispy paratha recipe, soft paratha tips, indian flatbread recipes, breakfast ideas indian veg, tiffin recipes indian, lunch box recipes veg, north indian recipes, homemade paratha, मसालेदार पराठा, धनिया पराठा रेसिपी, हरा पराठा, आसान नाश्ता रेसिपी, healthy breakfast india, weight loss paratha recipe, high fiber recipes indian, street style paratha, dhaba style paratha, spicy paratha recipe, vegetarian recipes indian, quick dinner ideas veg, meal prep indian recipes, coriander recipes indian, pudina dhaniya paratha, flavorful paratha, best paratha recipe, beginners cooking indian, simple veg recipes, indian kitchen recipes, everyday cooking india, comfort food indian, homemade indian bread, easy tawa recipes, paratha with curd, indian breakfast ideas 2026, trending food reels recipe, viral paratha recipe, chef style paratha recipe) Shop from VB Dace: https://vbdace.com/ Hi, I am Chef Kunal Kapur and this is my space, my channel. Subscribe & Together let's cook. 👉🏻 Click here to Subscribe: https://www.youtube.com/c/KunalKapur 👉🏻 Website: http://www.chefkunalkapur.com/​​​​​​​ ------------------------------------------------------------------------------------- Follow Chef Kunal Kapur on your favorite Social Media Channels: 👥 Facebook: https://www.facebook.com/thekunalkapur​ 📸 Instagram: https://www.instagram.com/chefkunal​​​ 🐦 Twitter: https://twitter.com/ChefKunalKapur​​​​ 📌 Pinterest: https://in.pinterest.com/chefkunal",JmJwQ1Q-sps,Kunal Kapur,https://www.youtube.com/@KunalKapur/videos,685,20260416,128100
Ye Chhota Sa Snack Itna Crispy Kaise Hai? Laccha Aloo Se Bana Sabse Crispy Snack | Kunal Kapur,"Crispy Lachha Aloo is hands down one of the yummiest snacks you’ll ever try - thinly shredded potatoes fried to golden perfection, light, crunchy, and absolutely addictive. Whether you’re craving a quick evening snack, something to pair with chai, or just want to indulge in a crispy treat, this recipe never disappoints. The texture is what makes it special - perfectly crisp on the outside with that delicate, melt-in-the-mouth bite inside. Made with simple ingredients and minimal effort, this easy crispy potato snack is perfect for both everyday cravings and when you want to impress guests. If you love street-style flavors and quick homemade recipes, this one’s a must-try. Crispy Potato Ingredients Potato (आलू) - ½ kg",https://www.youtube.com/watch?v=qhSWsoliQHM,Potato (आलू) - ½ kg | Salt (नमक) - to taste | Corn starch (कॉर्नस्टार्च) - 2 tbsp (approx),"To make crispy laccha aloo, start by cutting potatoes into evenly sized juliennes. | Dip them in cold water for 2-3 minutes. | Then, drain the potatoes, add salt, and leave for 10 minutes. | Next, squeeze out the excess water, add corn starch, and mix well. | Shape the potatoes by swirling them with a fork and drop them into hot oil. | Your crispy laccha aloo is ready to serve. | (Kunal kapur, crispy lachha aloo, lachha aloo recipe, crispy potato snack, easy potato snacks, snack recipes India, Indian snack recipes, evening snacks recipes, tea time snacks, quick snacks at home, easy snacks to make at home, potato snacks recipes, aloo snacks easy, crispy fried potatoes, street style snacks, veg snacks recipes, quick veg snacks, homemade snacks India) | 00:00 - 00:42 - Intro | 00:42 - 01:17 - How to cut potato with a knife | 01:17 - 02:01 - How to cut potato with a mandolin | 02:01 - 03:01 - How to make aloo ke lachhe | 03:03 - 03:56 - Hack to make the crispiest lachha aloo | 04:00 - 04:52 - Final prep before frying | 05:44 - 08-21 - Technique to fry lachhe aloo | Hi, I am Chef Kunal Kapur and this is my space, my channel. | Subscribe & Together let's cook. | 👉🏻 Click here to Subscribe: https://www.youtube.com/c/KunalKapur | 👉🏻 Website: http://www.chefkunalkapur.com/​​​​​​​ | Get the knife here: https://vbdace.com/product/chefs-knife","Crispy Lachha Aloo is hands down one of the yummiest snacks you’ll ever try - thinly shredded potatoes fried to golden perfection, light, crunchy, and absolutely addictive. Whether you’re craving a quick evening snack, something to pair with chai, or just want to indulge in a crispy treat, this recipe never disappoints. The texture is what makes it special - perfectly crisp on the outside with that delicate, melt-in-the-mouth bite inside. Made with simple ingredients and minimal effort, this easy crispy potato snack is perfect for both everyday cravings and when you want to impress guests. If you love street-style flavors and quick homemade recipes, this one’s a must-try. Crispy Potato Ingredients Potato (आलू) - ½ kg Salt (नमक) - to taste Corn starch (कॉर्नस्टार्च) - 2 tbsp (approx) Oil (तेल) - for frying Method To make crispy laccha aloo, start by cutting potatoes into evenly sized juliennes. Dip them in cold water for 2-3 minutes. Then, drain the potatoes, add salt, and leave for 10 minutes. Next, squeeze out the excess water, add corn starch, and mix well. Shape the potatoes by swirling them with a fork and drop them into hot oil. Your crispy laccha aloo is ready to serve. (Kunal kapur, crispy lachha aloo, lachha aloo recipe, crispy potato snack, easy potato snacks, snack recipes India, Indian snack recipes, evening snacks recipes, tea time snacks, quick snacks at home, easy snacks to make at home, potato snacks recipes, aloo snacks easy, crispy fried potatoes, street style snacks, veg snacks recipes, quick veg snacks, homemade snacks India) 00:00 - 00:42 - Intro 00:42 - 01:17 - How to cut potato with a knife 01:17 - 02:01 - How to cut potato with a mandolin 02:01 - 03:01 - How to make aloo ke lachhe 03:03 - 03:56 - Hack to make the crispiest lachha aloo 04:00 - 04:52 - Final prep before frying 05:44 - 08-21 - Technique to fry lachhe aloo Hi, I am Chef Kunal Kapur and this is my space, my channel. Subscribe & Together let's cook. 👉🏻 Click here to Subscribe: https://www.youtube.com/c/KunalKapur 👉🏻 Website: http://www.chefkunalkapur.com/​​​​​​​ Get the knife here: https://vbdace.com/product/chefs-knife Follow Chef Kunal Kapur on your favorite Social Media Channels: 👥 Facebook: https://www.facebook.com/thekunalkapur​ 📸 Instagram: https://www.instagram.com/chefkunal​​​ 🐦 Twitter: https://twitter.com/ChefKunalKapur​​​​ 📌 Pinterest: https://in.pinterest.com/chefkunal",qhSWsoliQHM,Kunal Kapur,https://www.youtube.com/@KunalKapur/videos,600,20260401,38695
