title,description,source_url,ingredients,instructions,raw_text,youtube_video_id,youtube_channel,youtube_channel_url,duration_seconds,upload_date,view_count
Kadhai Paneer bhool jaoge jab banoge yeh Tasty Paneer Capsicum Masala! Lunch/Dinner | Kunal Kapur,"👉🏻 Buy my favourite kitchen equipment here: https://vbdace.com/ Kadhai, Shimla Mirch, soft Paneer, aur masalon ki khushboo—aapko is Paneer-Capsicum se pyaar ho jayega! Aaj hum wahi purana childhood wala swad recreate karenge jo humari maa ghar pe banaya karti thi. Is recipe mein humne crunch aur softness ka ek perfect balance rakha hai, jo ise Kadhai Paneer se ekdum alag aur khaas banata hai. Soft paneer ko spices mein roast karke aur crunchy capsicum ke saath mix karke jo swad aata hai, uska koi muqabla nahi. Iss video mein maine kuch special tips share kiye hain jisse paneer ekdum soft rahega aur masale bilkul restaurant style lagenge. Is tasty dish ko garma-garam roti ya paratha ke saath enjoy karein!",https://www.youtube.com/watch?v=5dmpL2Z0r-w,"Paneer (पनीर) - 400 gms | Salt (नमक) - 1 tsp | Turmeric (हल्दी) - ½ tsp | Chilli powder (मिर्ची पाउडर) - 1 tsp | Cumin (जीरा) - 2 tsp | Coriander seeds (धनिया बीज) - 1½ tbsp | Peppercorns (काली मिर्च) - 1 tbsp | Mustard oil (सरसों तेल) - 5 tbsp | Dry red chilli (सूखी लाल मिर्च) - 3 nos | Garlic, chopped (लहसुन) - 1 tbsp | Ginger, chopped (अदरक) - 1 tbsp | Green chilli, chopped (हरि मिर्च) - 1-2 nos | Onion, chopped (प्याज़) - 1 cup | Turmeric powder (हल्दी) - ¾ tsp | Kashmiri chilli powder (कश्मीरी मिर्च पाउडर) - 2 tsp | Coriander powder (धनिया पाउडर) - 1½ tbsp | Kitchen King Masala (किचन किंग मसाला) - 1 tbsp | Tomato (टमाटर) - 5 nos | Salt (नमक) - to taste | Tomato, chopped (टमाटर) - 1 cup | Capsicum, medium (शिमला मिर्च) - 1 no | Onion, large (प्याज़) - 1 nos | Tomato, medium (टमाटर) - 1 no | Water (पानी) - ½ cup | Mustard oil (सरसों तेल) - 3 tbsp | Salt (नमक) - to taste | Kasoori methi (कसूरी मेथी) - large pinch | Coriander, chopped (ताज़ा धनिया) - handful | 📸 Instagram: https://www.instagram.com/chefkunal​​​ | 00:00 – Intro: The Secret to Perfect Paneer Shimla Mirch | 00:34 – Marinating Paneer & Preparing the Kadhai Masala | 02:13 – Sautéing the Aromatics & Gravy Base | 04:58 – Prepping the Capsicum & Onion Bulbs | 06:36 – Flash-cooking the Veggies with Paneer | 09:30 – Final Results & Serving Suggestions | Item URL: https://elements.envato.com/bouncy-cheerful-track-4T2KYAS | Item ID: 4T2KYAS | Author Username: BackgroundAudios | License Name: PANEER SHIMLA MIRCH | License Date: January 22nd, 2026 | Item License Code: F3V4BGNQKP","Don't forget to Like, Share, and Subscribe! | ------------------------------------------------------------------------------------- | Paneer Shimla Mirch | Ingredients: | For marinating paneer | Paneer (पनीर) - 400 gms | Salt (नमक) - 1 tsp | Turmeric (हल्दी) - ½ tsp | Chilli powder (मिर्ची पाउडर) - 1 tsp | Cumin (जीरा) - 2 tsp | Coriander seeds (धनिया बीज) - 1½ tbsp | Peppercorns (काली मिर्च) - 1 tbsp | Mustard oil (सरसों तेल) - 5 tbsp | Dry red chilli (सूखी लाल मिर्च) - 3 nos | Garlic, chopped (लहसुन) - 1 tbsp | Ginger, chopped (अदरक) - 1 tbsp | Green chilli, chopped (हरि मिर्च) - 1-2 nos | Onion, chopped (प्याज़) - 1 cup | Turmeric powder (हल्दी) - ¾ tsp | Kashmiri chilli powder (कश्मीरी मिर्च पाउडर) - 2 tsp | Coriander powder (धनिया पाउडर) - 1½ tbsp | Kitchen King Masala (किचन किंग मसाला) - 1 tbsp | Tomato (टमाटर) - 5 nos | Salt (नमक) - to taste | Tomato, chopped (टमाटर) - 1 cup | Capsicum, medium (शिमला मिर्च) - 1 no | Onion, large (प्याज़) - 1 nos | Tomato, medium (टमाटर) - 1 no | Water (पानी) - ½ cup | Mustard oil (सरसों तेल) - 3 tbsp | Salt (नमक) - to taste | Kasoori methi (कसूरी मेथी) - large pinch | Coriander, chopped (ताज़ा धनिया) - handful | Water (पानी) - a dash | ------------------------------------------------------------------------------------- | Hi, I am Chef Kunal Kapur and this is my space, my channel. | Subscribe & Together let's cook. | 👉🏻 Click here to Subscribe: https://www.youtube.com/c/KunalKapur | 👉🏻 Website: http://www.chefkunalkapur.com/​​​​​​​ | -------------------------------------------------------------------------------------","👉🏻 Buy my favourite kitchen equipment here: https://vbdace.com/ Kadhai, Shimla Mirch, soft Paneer, aur masalon ki khushboo—aapko is Paneer-Capsicum se pyaar ho jayega! Aaj hum wahi purana childhood wala swad recreate karenge jo humari maa ghar pe banaya karti thi. Is recipe mein humne crunch aur softness ka ek perfect balance rakha hai, jo ise Kadhai Paneer se ekdum alag aur khaas banata hai. Soft paneer ko spices mein roast karke aur crunchy capsicum ke saath mix karke jo swad aata hai, uska koi muqabla nahi. Iss video mein maine kuch special tips share kiye hain jisse paneer ekdum soft rahega aur masale bilkul restaurant style lagenge. Is tasty dish ko garma-garam roti ya paratha ke saath enjoy karein! Recipe try karein aur comment section mein batayein ki aapko yeh kaisi lagi! ❤️ Don't forget to Like, Share, and Subscribe! ------------------------------------------------------------------------------------- Paneer Shimla Mirch Ingredients: For marinating paneer Paneer (पनीर) - 400 gms Salt (नमक) - 1 tsp Turmeric (हल्दी) - ½ tsp Chilli powder (मिर्ची पाउडर) - 1 tsp For Masala: Cumin (जीरा) - 2 tsp Coriander seeds (धनिया बीज) - 1½ tbsp Peppercorns (काली मिर्च) - 1 tbsp Mustard oil (सरसों तेल) - 5 tbsp Dry red chilli (सूखी लाल मिर्च) - 3 nos Garlic, chopped (लहसुन) - 1 tbsp Ginger, chopped (अदरक) - 1 tbsp Green chilli, chopped (हरि मिर्च) - 1-2 nos Onion, chopped (प्याज़) - 1 cup Turmeric powder (हल्दी) - ¾ tsp Kashmiri chilli powder (कश्मीरी मिर्च पाउडर) - 2 tsp Coriander powder (धनिया पाउडर) - 1½ tbsp Kitchen King Masala (किचन किंग मसाला) - 1 tbsp Tomato (टमाटर) - 5 nos Salt (नमक) - to taste Tomato, chopped (टमाटर) - 1 cup Capsicum, medium (शिमला मिर्च) - 1 no Onion, large (प्याज़) - 1 nos Tomato, medium (टमाटर) - 1 no Water (पानी) - ½ cup Mustard oil (सरसों तेल) - 3 tbsp Salt (नमक) - to taste Kasoori methi (कसूरी मेथी) - large pinch Coriander, chopped (ताज़ा धनिया) - handful Water (पानी) - a dash ------------------------------------------------------------------------------------- Hi, I am Chef Kunal Kapur and this is my space, my channel. Subscribe & Together let's cook. 👉🏻 Click here to Subscribe: https://www.youtube.com/c/KunalKapur 👉🏻 Website: http://www.chefkunalkapur.com/​​​​​​​ ------------------------------------------------------------------------------------- Follow Chef Kunal Kapur on your favorite Social Media Channels: 👥 Facebook: https://www.facebook.com/thekunalkapur​ 📸 Instagram: https://www.instagram.com/chefkunal​​​ 🐦 Twitter: https://twitter.com/ChefKunalKapur​​​​ 📌 Pinterest: https://in.pinterest.com/chefkunal ------------------------------------------------------------------------------------- Chapters: 00:00 – Intro: The Secret to Perfect Paneer Shimla Mirch 00:34 – Marinating Paneer & Preparing the Kadhai Masala 02:13 – Sautéing the Aromatics & Gravy Base 04:58 – Prepping the Capsicum & Onion Bulbs 06:36 – Flash-cooking the Veggies with Paneer 09:30 – Final Results & Serving Suggestions ------------------------------------------------------------------------------------- Item Title: Bouncy Cheerful track Item URL: https://elements.envato.com/bouncy-cheerful-track-4T2KYAS Item ID: 4T2KYAS Author Username: BackgroundAudios Licensee: Kunal Kapur License Name: PANEER SHIMLA MIRCH License Date: January 22nd, 2026 Item License Code: F3V4BGNQKP",5dmpL2Z0r-w,Kunal Kapur,https://www.youtube.com/@KunalKapur/videos,649,20260204,174604
Mirch Ajwain Ke Parothe | Ghar Ka Khaana | मम्मी के हाथ की गरम-गरम परोठी | Winter Spl | Kunal Kapur,"This Mirchi Ajwain Paratha recipe will teleport you to the good old days of childhood where winters brought such amazing aromas. Made by my mom, this used to be my favourite breakfast growing up and now it can be yours too. Try this and it'll become a staple at your home. #ajwainkeparothe #mirchajwainparantha #paratha #parantharecipe #chefkunal #kunalkapur #gharkakhaana",https://www.youtube.com/watch?v=T9HHzeC3VAg,Atta - 2 cup | Water - ¾ cup,"Begin by kneading a medium-soft dough using salt, water, and whole wheat flour. | Let the dough rest for 5 minutes. | After resting, cut the dough into small portions (pedas), roll them in dry flour, and let them rest for an additional 2 minutes. | Then, roll each portion out into discs with light pressure to ensure they spread evenly. | Next, spread ghee on top of each disc and sprinkle it with salt, carom seeds, coriander powder, and chili flakes. | Shape the discs as demonstrated in the video. | Heat some ghee in a tawa (flat pan), and cook the parathas on both sides until they puff up and turn golden brown. | Your mirch ajwain ka parantha is ready to be enjoyed! | ------------------------------------------------------------------------------------- | Check out other recipes in #gharkakhaana series: | 📌 Punjabi Homestyle Baingan Ka Bharta: https://youtu.be/m0xkT2aBNgQ | 📌 Ghar Ka Khaana - Shaljam ki Sabji : https://youtu.be/qeFRPyP-Mr4 | 📌 Kaddu Ki Sabji | भंडारे वाली कद्दू की सब्ज़ी: https://youtu.be/cSDwggrgXD4 | 📌 आलू मेथी की सब्ज़ी | Aloo Methi Recipe: https://youtu.be/klFfEDKAzj0 | 📌 Winter Special Gajar Matar ki Sabji: https://youtu.be/Vd0lnyHwY_w | ------------------------------------------------------------------------------------- | Hi, I am Chef Kunal Kapur and this is my space, my channel. | Subscribe & Together let's cook. | 👉🏻 Click here to Subscribe: https://www.youtube.com/c/KunalKapur | 👉🏻 Website: http://www.chefkunalkapur.com/​​​​​​​ | -------------------------------------------------------------------------------------","This Mirchi Ajwain Paratha recipe will teleport you to the good old days of childhood where winters brought such amazing aromas. Made by my mom, this used to be my favourite breakfast growing up and now it can be yours too. Try this and it'll become a staple at your home. #ajwainkeparothe #mirchajwainparantha #paratha #parantharecipe #chefkunal #kunalkapur #gharkakhaana ------------------------------------------------------------------------------------- Mirch Ajwain Paratha Prep time - 10 mins Cooking time - 15 mins Serves - 2 Ingredients For dough Atta - 2 cup Salt Water - ¾ cup For filling Salt Chilli flakes Coriander powder Ajwain Ghee Method: Begin by kneading a medium-soft dough using salt, water, and whole wheat flour. Let the dough rest for 5 minutes. After resting, cut the dough into small portions (pedas), roll them in dry flour, and let them rest for an additional 2 minutes. Then, roll each portion out into discs with light pressure to ensure they spread evenly. Next, spread ghee on top of each disc and sprinkle it with salt, carom seeds, coriander powder, and chili flakes. Shape the discs as demonstrated in the video. Heat some ghee in a tawa (flat pan), and cook the parathas on both sides until they puff up and turn golden brown. Your mirch ajwain ka parantha is ready to be enjoyed! ------------------------------------------------------------------------------------- Check out other recipes in #gharkakhaana series: 📌 Punjabi Homestyle Baingan Ka Bharta: https://youtu.be/m0xkT2aBNgQ 📌 Ghar Ka Khaana - Shaljam ki Sabji : https://youtu.be/qeFRPyP-Mr4 📌 Kaddu Ki Sabji | भंडारे वाली कद्दू की सब्ज़ी: https://youtu.be/cSDwggrgXD4 📌 आलू मेथी की सब्ज़ी | Aloo Methi Recipe: https://youtu.be/klFfEDKAzj0 📌 Winter Special Gajar Matar ki Sabji: https://youtu.be/Vd0lnyHwY_w ------------------------------------------------------------------------------------- Hi, I am Chef Kunal Kapur and this is my space, my channel. Subscribe & Together let's cook. 👉🏻 Click here to Subscribe: https://www.youtube.com/c/KunalKapur 👉🏻 Website: http://www.chefkunalkapur.com/​​​​​​​ ------------------------------------------------------------------------------------- Follow Chef Kunal Kapur on your favorite Social Media Channels: 👥 Facebook: https://www.facebook.com/thekunalkapur​ 📸 Instagram: https://www.instagram.com/chefkunal​​​ 🐦 Twitter: https://twitter.com/ChefKunalKapur​​​​ 📌 Pinterest: https://in.pinterest.com/chefkunal ------------------------------------------------------------------------------------- Mirchi Ajwain Paratha 00:00 Introduction 01:18 Making Dough 03:04 Making Dough balls 03:50 shaping Parathas 07:00 Making Parathas 11:01 Plating ------------------------------------------------------------------------------------- Item Title: Kids Upbeat Acoustic Happy Item URL: https://elements.envato.com/kids-upbeat-acoustic-happy-ESD33KF Item ID: ESD33KF Author Username: musicstuffs Licensee: Kunal Kapur Registered Project: MIRCH AJWAIN PARATHA License Date: May 1st, 2025 Item License Code: RY3JMTD8NP",T9HHzeC3VAg,Kunal Kapur,https://www.youtube.com/@KunalKapur/videos,838,20251209,274030
The BEST Crispy Fried Potato Recipe | Chilli Garlic Dip | Quick Snacks Recipe | Kunal Kapur Recipes,"आलू को यूंही सब्जियों का राजा नहीं बोलते। जैसी रेसिपी वैसा इसका स्वाद। Aaj ki recipe is for all my aloo lovers, which is gooey from inside and super crispy from outside, accompanied with spicy and delicious Chilli Dip. This recipe is a perfect evening snack, no matter the age; everyone will love it equally kyuki iske taste ki guarantee hai meri! #crispyfriedpotato #friedpotato #potatoballs #chefkunalkapur #kunalkapur #friedpotatoballs #snacks #quicksnacks #potatorecipe",https://www.youtube.com/watch?v=2N8cTpwgjh4,"Potato, medium (आलू) - ½ kg (4 nos) | Butter (मखन) - 2½ tbsp | Italian seasoning (इटालियन मसाला) - 1 tbsp | All Purpose Flour (मैदा) - 4 tbsp | Salt (नमक) - to taste | Pepper powder (काली मिर्च पाउडर) - ¾ tsp | Spring onion, chopped (हरा प्याज़) - ½ cup | Cornstarch (कोर्न्स्टार्च) - 4 tbsp | Mustard Oil (सरसों तेल) - ¼ cup | Dry Kashmiri Chilli, large (सूखी कश्मीरी मिर्च) - 15-17 nos | Heeng (हींग) - ½ tsp | Coriander seeds (ताज़ा धनिया) - 1 tbsp | Cumin seeds (जीरा) - 2 tsp | Garlic cloves, large (लहसुन) – 12 nos | Lemon, large (नींबू) - 1 nos | Hung curd (गाढ़ी दही) - ½ cup | Salt (नमक) - to taste","Firstly, roughly cut the peeled potatoes into smaller pieces. | Next, boil the diced potatoes until they can be easily mashed. | Once done, strain them and transfer them to a dry vessel, then mash them thoroughly. | In a separate pan, melt some butter and add Italian seasonings along with refined flour. | Cook this mixture for about 30 seconds, then add & cook the mashed potatoes until the mixture is completely dry. | Spread it out on a deep plate and season with salt, black pepper powder, chili flakes, chopped spring onions, and cornstarch. | Knead the mixture well and then form it into small, evenly sized balls. | Deep fry the balls until they are golden brown. | For the chili dip, heat some mustard oil in a pan and add dried Kashmiri red chilies. | Once you remove the chilies, temper the same oil with asafoetida, coriander seeds, cumin seeds, garlic cloves, and roughly chopped ginger. | After tempering, grind all these ingredients together with lemon juice and a dash of water, then transfer the mixture to a bowl. | In the same bowl, whisk in hung curd and salt, and your chili dip is ready to serve. | ------------------------------------------------------------------------------------- | Check out other #potatorecipes here: | Aloo Ka Soup Kaise Banate Hain: https://youtu.be/a-XNcfEwc0A | Shakarkandi/Sweet Potato Chaat: https://youtu.be/wONhHjL_1m8 | Korean Fried Potato: https://youtu.be/d4gSynT9Tko | Aloo Pyaaz Paratha | Mix Veg Raita: https://youtu.be/r4JUGrrELrw | Aloo Methi Paratha: https://youtu.be/17O9LkGfGQA | ------------------------------------------------------------------------------------- | For Complete Recipe - https://www.chefkunalkapur.com/recipe/crispy-fried-potato/ | ------------------------------------------------------------------------------------- | Hi, I am Chef Kunal Kapur and this is my space, my channel. | Subscribe & Together let's cook. | 👉🏻 Click here to Subscribe: https://www.youtube.com/c/KunalKapur | 👉🏻 Website: http://www.chefkunalkapur.com/​​​​​​​ | -------------------------------------------------------------------------------------","आलू को यूंही सब्जियों का राजा नहीं बोलते। जैसी रेसिपी वैसा इसका स्वाद। Aaj ki recipe is for all my aloo lovers, which is gooey from inside and super crispy from outside, accompanied with spicy and delicious Chilli Dip. This recipe is a perfect evening snack, no matter the age; everyone will love it equally kyuki iske taste ki guarantee hai meri! #crispyfriedpotato #friedpotato #potatoballs #chefkunalkapur #kunalkapur #friedpotatoballs #snacks #quicksnacks #potatorecipe ------------------------------------------------------------------------------------- Crispy Fried Potato Balls, Chilli Sauce Prep time - 20 mins Cooking time - 25 mins Serves - 4 Ingredients Potato, medium (आलू) - ½ kg (4 nos) Butter (मखन) - 2½ tbsp Italian seasoning (इटालियन मसाला) - 1 tbsp All Purpose Flour (मैदा) - 4 tbsp Salt (नमक) - to taste Pepper powder (काली मिर्च पाउडर) - ¾ tsp Spring onion, chopped (हरा प्याज़) - ½ cup Cornstarch (कोर्न्स्टार्च) - 4 tbsp Oil (तेल) - for frying Chilli Sauce Mustard Oil (सरसों तेल) - ¼ cup Dry Kashmiri Chilli, large (सूखी कश्मीरी मिर्च) - 15-17 nos Heeng (हींग) - ½ tsp Coriander seeds (ताज़ा धनिया) - 1 tbsp Cumin seeds (जीरा) - 2 tsp Garlic cloves, large (लहसुन) – 12 nos Water (पानी) - a dash Lemon, large (नींबू) - 1 nos Hung curd (गाढ़ी दही) - ½ cup Salt (नमक) - to taste Method Firstly, roughly cut the peeled potatoes into smaller pieces. Next, boil the diced potatoes until they can be easily mashed. Once done, strain them and transfer them to a dry vessel, then mash them thoroughly. In a separate pan, melt some butter and add Italian seasonings along with refined flour. Cook this mixture for about 30 seconds, then add & cook the mashed potatoes until the mixture is completely dry. Spread it out on a deep plate and season with salt, black pepper powder, chili flakes, chopped spring onions, and cornstarch. Knead the mixture well and then form it into small, evenly sized balls. Deep fry the balls until they are golden brown. For the chili dip, heat some mustard oil in a pan and add dried Kashmiri red chilies. Once you remove the chilies, temper the same oil with asafoetida, coriander seeds, cumin seeds, garlic cloves, and roughly chopped ginger. After tempering, grind all these ingredients together with lemon juice and a dash of water, then transfer the mixture to a bowl. In the same bowl, whisk in hung curd and salt, and your chili dip is ready to serve. ------------------------------------------------------------------------------------- Check out other #potatorecipes here: Aloo Ka Soup Kaise Banate Hain: https://youtu.be/a-XNcfEwc0A Shakarkandi/Sweet Potato Chaat: https://youtu.be/wONhHjL_1m8 Korean Fried Potato: https://youtu.be/d4gSynT9Tko Aloo Pyaaz Paratha | Mix Veg Raita: https://youtu.be/r4JUGrrELrw Aloo Methi Paratha: https://youtu.be/17O9LkGfGQA ------------------------------------------------------------------------------------- For Complete Recipe - https://www.chefkunalkapur.com/recipe/crispy-fried-potato/ ------------------------------------------------------------------------------------- Hi, I am Chef Kunal Kapur and this is my space, my channel. Subscribe & Together let's cook. 👉🏻 Click here to Subscribe: https://www.youtube.com/c/KunalKapur 👉🏻 Website: http://www.chefkunalkapur.com/​​​​​​​ ------------------------------------------------------------------------------------- Follow Chef Kunal Kapur on your favorite Social Media Channels: 👥 Facebook: https://www.facebook.com/thekunalkapur​ 📸 Instagram: https://www.instagram.com/chefkunal​​​ 🐦 Twitter: https://twitter.com/ChefKunalKapur​​​​ 📌 Pinterest: https://in.pinterest.com/chefkunal ------------------------------------------------------------------------------------- Item Title: Cheerful Ukulele Item URL: https://elements.envato.com/cheerful-ukulele-K2LNWCJ Item ID: K2LNWCJ Author Username: EliansProductions Licensee: Kunal Kapur Registered Project Name: Crispy Fried Potato, Chili Dip License Date: January 27th, 2025 Item License Code: X3VNBZGKT6 ------------------------------------------------------------------------------------- Chapters: 00:00 Introduction 00:25 Chopping & boiling potatoes 01:56 Mashing Potatoes 02:28 Cooking Potatoes 05:36 Chilli Dip 08:57 Frying Potato Balls 11:00 Plating",2N8cTpwgjh4,Kunal Kapur,https://www.youtube.com/@KunalKapur/videos,709,20250213,254157
