title,description,source_url,ingredients,instructions,raw_text,youtube_video_id,youtube_channel,youtube_channel_url,duration_seconds,upload_date,view_count
Ashtami Special | Halwa Puri Chana | Kunal Kapur Recipes,"Ashtami prasad, made with love ✨ Fluffy sooji halwa, perfectly spiced kala chana, and golden puris - each bite full of warmth, tradition, and devotion. Aaj bana mere kitchen main and I’m sharing the most foolproof recipe with you guys - recreate it at home tomorrow, share it with your loved ones, and celebrate the joy of giving, gratitude, and festive flavours. 🌼 Ingredients",https://www.youtube.com/watch?v=1cB61cXKVxU,Kala Chana (boiled) – 2cups | Oil – 3 tbsp | Cumin seeds – 1 tsp | Green chilli – 1no | Ginger chopped – 2tsp | Turmeric powder – ½ tsp | Chilli powder – 1 tsp | Coriander powder – 1 tbsp | Ghee – 1 tbsp | Wheat flour – 2 cups | Salt – ½ tsp | Water – as required | Oil – 1 tbsp | Water – 3cups | Sugar – ¾ cup | Cardamom powder – ½ tsp | Ghee – ⅔ cup | Suji (semolina) – 1cup | Dry fruits chopped – handful,"* Heat oil, add cumin seeds and let them splutter. | * Add green chilli and ginger, sauté briefly. | * Add turmeric, chilli powder, coriander powder and salt. | * Add boiled kala chana, mix well and cook for 5–7 minutes (add a little water if needed). | * Finish with ghee and set aside. | * Mix wheat flour, salt and oil. | * Add water and knead into a stiff dough. | Rest for 10–15 minutes. | * Divide into small balls, roll into discs. | * Deep fry in hot oil till puffed and golden. | * Boil water, sugar and cardamom powder till sugar dissolves (keep warm). | * Heat ghee, add suji and roast till golden and aromatic. | * Add dry fruits, sauté briefly. | * Carefully add warm syrup, stirring continuously. | * Cook till thick and it leaves the sides of the pan. | * Serve hot poori with kala chana and suji halwa ✨ | {kunal kapur, ashtami prasad, navratri recipes, kanjak bhog, sooji halwa, kala chana recipe, puri recipe, navratri food, indian festive food, prasad recipe, ashtami bhog, traditional indian sweets, poori chana halwa, navratri special, sattvik food, indian kitchen, festive cooking, bhog ideas, navratri thali, home cooking, prasad thali, kanjak pooja food, indian desserts} | Hi, I am Chef Kunal Kapur and this is my space, my channel. | Subscribe & Together let's cook. | 👉🏻 Click here to Subscribe: https://www.youtube.com/c/KunalKapur | 👉🏻 Website: http://www.chefkunalkapur.com/​​​​​​​ | -------------------------------------------------------------------------------------","Ashtami prasad, made with love ✨ Fluffy sooji halwa, perfectly spiced kala chana, and golden puris - each bite full of warmth, tradition, and devotion. Aaj bana mere kitchen main and I’m sharing the most foolproof recipe with you guys - recreate it at home tomorrow, share it with your loved ones, and celebrate the joy of giving, gratitude, and festive flavours. 🌼 Ingredients For Chana: Kala Chana (boiled) – 2cups Oil – 3 tbsp Cumin seeds – 1 tsp Green chilli – 1no Ginger chopped – 2tsp Turmeric powder – ½ tsp Chilli powder – 1 tsp Coriander powder – 1 tbsp Salt Ghee – 1 tbsp For poori: Wheat flour – 2 cups Salt – ½ tsp Water – as required Oil – 1 tbsp Suji Halwa For Syrup: Water – 3cups Sugar – ¾ cup Cardamom powder – ½ tsp For Halwa: Ghee – ⅔ cup Suji (semolina) – 1cup Dry fruits chopped – handful Method Chana * Heat oil, add cumin seeds and let them splutter. * Add green chilli and ginger, sauté briefly. * Add turmeric, chilli powder, coriander powder and salt. * Add boiled kala chana, mix well and cook for 5–7 minutes (add a little water if needed). * Finish with ghee and set aside. Poori * Mix wheat flour, salt and oil. * Add water and knead into a stiff dough. Rest for 10–15 minutes. * Divide into small balls, roll into discs. * Deep fry in hot oil till puffed and golden. Halwa * Boil water, sugar and cardamom powder till sugar dissolves (keep warm). * Heat ghee, add suji and roast till golden and aromatic. * Add dry fruits, sauté briefly. * Carefully add warm syrup, stirring continuously. * Cook till thick and it leaves the sides of the pan. Serve * Serve hot poori with kala chana and suji halwa ✨ {kunal kapur, ashtami prasad, navratri recipes, kanjak bhog, sooji halwa, kala chana recipe, puri recipe, navratri food, indian festive food, prasad recipe, ashtami bhog, traditional indian sweets, poori chana halwa, navratri special, sattvik food, indian kitchen, festive cooking, bhog ideas, navratri thali, home cooking, prasad thali, kanjak pooja food, indian desserts} Hi, I am Chef Kunal Kapur and this is my space, my channel. Subscribe & Together let's cook. 👉🏻 Click here to Subscribe: https://www.youtube.com/c/KunalKapur 👉🏻 Website: http://www.chefkunalkapur.com/​​​​​​​ ------------------------------------------------------------------------------------- Follow Chef Kunal Kapur on your favorite Social Media Channels: 👥 Facebook: https://www.facebook.com/thekunalkapur​ 📸 Instagram: https://www.instagram.com/chefkunal​​​ 🐦 Twitter: https://twitter.com/ChefKunalKapur​​​​ 📌 Pinterest: https://in.pinterest.com/chefkunal",1cB61cXKVxU,Kunal Kapur,https://www.youtube.com/@KunalKapur/videos,224,20260325,26637
Vrat ka Halwa | 2-ingredient Easy Halwa | Navratri Dessert Recipe | Kunal Kapur Recipes,"If you’re craving something rich, comforting, and quick to make, this khoya (mawa) halwa is exactly what you need. It comes together in minutes but tastes like something truly festive and indulgent. Made with just a handful of ingredients, this is one of those classic Indian desserts that never fails - perfect for celebrations, last-minute guests, or simply when you want something sweet without too much effort. Khoya Halwa Ingredients",https://www.youtube.com/watch?v=qp6EOqWzxdg,"Khoya (खोया) - 500 gm | Water (पानी) - 1 cup | Sugar (चीनी) - 2 tbsp | Sugar (चीनी) - 2 tbsp | Ghee (घी) - 1 tbsp | Cardamom powder (इलाइची पाउडर) - ¾ tsp | Nutmeg powder (जायफल पाउडर) - ½ tsp | Dry fruits, chopped (ड्राई फ्रूट्स) - handful","Prepare the sugar syrup: | In a pan, add water and sugar. | Let it simmer until the sugar dissolves completely. | Cook the khoya: | Heat ghee in a heavy-bottom pan. | Crumble the khoya and add it to the pan. | Cook on low flame, stirring continuously, until it softens and releases a rich aroma. | Add sugar & syrup: | Add the sugar and prepared sugar syrup to the khoya. | Mix well and continue cooking on low flame. | Cook till thick: | Keep stirring until the mixture thickens and starts leaving the sides of the pan, turning glossy and halwa-like. | Finish with flavour: | Add cardamom powder and nutmeg powder. | Garnish & serve: | Top with chopped dry fruits and serve warm. | If you try this recipe, I’d love to see it - share your pictures or tag me. | Don’t forget to like, share, and subscribe for more simple, delicious recipes. | (kunal kapur, khoya halwa, mawa halwa recipe, indian dessert recipes, quick indian sweets, easy halwa recipe, festive dessert ideas, homemade mithai, khoya recipes, 10 minute dessert, vrat, navratri, falhari, falari, vrat ka khana, fasting, navratri vrat recipes, navratri special recipes, vrat recipes, fasting recipes indian, navratri food ideas, vrat ka khana, navratri sweets recipes, vrat dessert recipes, navratri bhog recipes, vrat ka halwa, halwa recipe indian, navratri halwa recipe, easy halwa recipe, instant halwa recipe, dessert for fasting, satvik sweets recipe, mawa halwa recipe, khoya dessert recipe, milk sweets recipe indian, mawa sweet recipe, quick mithai recipe, easy, 10 minute, instant, vrat friendly, satvik, no onion no garlic) | Hi, I am Chef Kunal Kapur and this is my space, my channel. | Subscribe & Together let's cook. | 👉🏻 Click here to Subscribe: https://www.youtube.com/c/KunalKapur | 👉🏻 Website: http://www.chefkunalkapur.com/​​​​​​​ | -------------------------------------------------------------------------------------","If you’re craving something rich, comforting, and quick to make, this khoya (mawa) halwa is exactly what you need. It comes together in minutes but tastes like something truly festive and indulgent. Made with just a handful of ingredients, this is one of those classic Indian desserts that never fails - perfect for celebrations, last-minute guests, or simply when you want something sweet without too much effort. Khoya Halwa Ingredients Khoya (खोया) - 500 gm For Sugar Syrup Water (पानी) - 1 cup Sugar (चीनी) - 2 tbsp Sugar (चीनी) - 2 tbsp Ghee (घी) - 1 tbsp Cardamom powder (इलाइची पाउडर) - ¾ tsp Nutmeg powder (जायफल पाउडर) - ½ tsp Dry fruits, chopped (ड्राई फ्रूट्स) - handful Method Prepare the sugar syrup: In a pan, add water and sugar. Let it simmer until the sugar dissolves completely. Keep aside. Cook the khoya: Heat ghee in a heavy-bottom pan. Crumble the khoya and add it to the pan. Cook on low flame, stirring continuously, until it softens and releases a rich aroma. Add sugar & syrup: Add the sugar and prepared sugar syrup to the khoya. Mix well and continue cooking on low flame. Cook till thick: Keep stirring until the mixture thickens and starts leaving the sides of the pan, turning glossy and halwa-like. Finish with flavour: Add cardamom powder and nutmeg powder. Mix well. Garnish & serve: Top with chopped dry fruits and serve warm. If you try this recipe, I’d love to see it - share your pictures or tag me. Don’t forget to like, share, and subscribe for more simple, delicious recipes. (kunal kapur, khoya halwa, mawa halwa recipe, indian dessert recipes, quick indian sweets, easy halwa recipe, festive dessert ideas, homemade mithai, khoya recipes, 10 minute dessert, vrat, navratri, falhari, falari, vrat ka khana, fasting, navratri vrat recipes, navratri special recipes, vrat recipes, fasting recipes indian, navratri food ideas, vrat ka khana, navratri sweets recipes, vrat dessert recipes, navratri bhog recipes, vrat ka halwa, halwa recipe indian, navratri halwa recipe, easy halwa recipe, instant halwa recipe, dessert for fasting, satvik sweets recipe, mawa halwa recipe, khoya dessert recipe, milk sweets recipe indian, mawa sweet recipe, quick mithai recipe, easy, 10 minute, instant, vrat friendly, satvik, no onion no garlic) Hi, I am Chef Kunal Kapur and this is my space, my channel. Subscribe & Together let's cook. 👉🏻 Click here to Subscribe: https://www.youtube.com/c/KunalKapur 👉🏻 Website: http://www.chefkunalkapur.com/​​​​​​​ ------------------------------------------------------------------------------------- Follow Chef Kunal Kapur on your favorite Social Media Channels: 👥 Facebook: https://www.facebook.com/thekunalkapur​ 📸 Instagram: https://www.instagram.com/chefkunal​​​ 🐦 Twitter: https://twitter.com/ChefKunalKapur​​​​ 📌 Pinterest: https://in.pinterest.com/chefkunal",qp6EOqWzxdg,Kunal Kapur,https://www.youtube.com/@KunalKapur/videos,351,20260320,20619
Appe Recipe | South Indian Appe | Kunal Kapur Recipes,"Crispy on the outside, soft and cheesy inside - these masala cheese appe are my kind of perfect breakfast / chai-time snack. Light, flavourful, and packed with little bursts of spice, they’re the kind of bite-sized treats that disappear the moment they hit the table. Masala cheese Appe (makes 36 appe) Ingredients Semolina - 1 cup",https://www.youtube.com/watch?v=t6d3yn7xvz8,"Semolina - 1 cup | Curd - ¾ cup | Salt - 1 tsp (to taste) | Water - 1 cup | Peppercorn - 15 nos | Oil - 2 tbsp | Drty red chillies - 2 nos | Asafoetida - ½ tsp | Mustard seeds - 1 tsp | Cumin - 1 tsp | Channa dal - 2 tsp | Urad dal - 1 tsp | Ginger, chopped - 2 tsp | Green chilli, chopped - 2 nos | Carrot, grated - ½ cup | Onion, chopped - ½ cup | Coriander, chopped - handful | Baking powder/Eno - 1 tsp","In a bowl, combine semolina, curd, salt and water to make a smooth batter. | Let it rest for 10–15 minutes so the semolina softens. | Heat 2 tbsp oil in a pan. | Add peppercorns and dry red chillies and sauté briefly. | Add asafoetida, mustard seeds, cumin, chana dal and urad dal. | Let them crackle and turn lightly golden. | Add chopped ginger, green chilli and curry leaves. | Sauté until fragrant. | Add grated carrot and chopped onion and cook for 2–3 minutes until slightly softened. | Turn off the heat and mix in chopped coriander. | Add this tempering to the rested batter and mix well. | Just before cooking, add baking powder/eno and gently mix. | Heat an appe pan and lightly spray oil in each cavity. | Pour some batter, place a small cube of cheese in the centre (optional), and cover with a little more batter. | Cook on medium heat, turning occasionally, until the appe are golden and crisp on all sides. | Serve hot with green chutney or ketchup. | (Kunal kapur, appe recipe, rava appe recipe, masala appe, cheese appe recipe, South Indian snacks, easy breakfast recipe, tea time snacks, vegetarian snack recipes, appe pan recipes, quick Indian snacks, kuzhi paniyaram, south indian appe, paddu, how to make appe, easy breakfast recipes, how to make breakfast in 10 mins) | ------------------------------------------------------------------------------------- | Hi, I am Chef Kunal Kapur and this is my space, my channel. | Subscribe & Together let's cook. | 👉🏻 Click here to Subscribe: https://www.youtube.com/c/KunalKapur | 👉🏻 Website: http://www.chefkunalkapur.com/​​​​​​​ | -------------------------------------------------------------------------------------","Crispy on the outside, soft and cheesy inside - these masala cheese appe are my kind of perfect breakfast / chai-time snack. Light, flavourful, and packed with little bursts of spice, they’re the kind of bite-sized treats that disappear the moment they hit the table. Masala cheese Appe (makes 36 appe) Ingredients Semolina - 1 cup Curd - ¾ cup Salt - 1 tsp (to taste) Water - 1 cup Peppercorn - 15 nos Oil - 2 tbsp Drty red chillies - 2 nos Asafoetida - ½ tsp Mustard seeds - 1 tsp Cumin - 1 tsp Channa dal - 2 tsp Urad dal - 1 tsp Ginger, chopped - 2 tsp Green chilli, chopped - 2 nos Curry leaves - a sprig Carrot, grated - ½ cup Onion, chopped - ½ cup Coriander, chopped - handful Baking powder/Eno - 1 tsp Oil - gentle spray Cheese cubes - few (optional) Oil - gentle spray Method 1. In a bowl, combine semolina, curd, salt and water to make a smooth batter. Let it rest for 10–15 minutes so the semolina softens. 2. Heat 2 tbsp oil in a pan. Add peppercorns and dry red chillies and sauté briefly. 3. Add asafoetida, mustard seeds, cumin, chana dal and urad dal. Let them crackle and turn lightly golden. 4. Add chopped ginger, green chilli and curry leaves. Sauté until fragrant. 5. Add grated carrot and chopped onion and cook for 2–3 minutes until slightly softened. Turn off the heat and mix in chopped coriander. 6. Add this tempering to the rested batter and mix well. 7. Just before cooking, add baking powder/eno and gently mix. 8. Heat an appe pan and lightly spray oil in each cavity. Pour some batter, place a small cube of cheese in the centre (optional), and cover with a little more batter. 9. Cook on medium heat, turning occasionally, until the appe are golden and crisp on all sides. 10. Serve hot with green chutney or ketchup. (Kunal kapur, appe recipe, rava appe recipe, masala appe, cheese appe recipe, South Indian snacks, easy breakfast recipe, tea time snacks, vegetarian snack recipes, appe pan recipes, quick Indian snacks, kuzhi paniyaram, south indian appe, paddu, how to make appe, easy breakfast recipes, how to make breakfast in 10 mins) ------------------------------------------------------------------------------------- Hi, I am Chef Kunal Kapur and this is my space, my channel. Subscribe & Together let's cook. 👉🏻 Click here to Subscribe: https://www.youtube.com/c/KunalKapur 👉🏻 Website: http://www.chefkunalkapur.com/​​​​​​​ ------------------------------------------------------------------------------------- Follow Chef Kunal Kapur on your favorite Social Media Channels: 👥 Facebook: https://www.facebook.com/thekunalkapur​ 📸 Instagram: https://www.instagram.com/chefkunal​​​ 🐦 Twitter: https://twitter.com/ChefKunalKapur​​​​ 📌 Pinterest: https://in.pinterest.com/chefkunal Item Title: Bouncy Cheerful track Item URL: https://elements.envato.com/bouncy-cheerful-track-4T2KYAS Item ID: 4T2KYAS Author Username: BackgroundAudios Licensee: Kunal Kapur License Name: Masala Appe Instant Nasta License Date: January 22nd, 2026 Item License Code: 3XY8FGLQ95",t6d3yn7xvz8,Kunal Kapur,https://www.youtube.com/@KunalKapur/videos,525,20260310,226357
Chana Dal Halwa Recipe: Sirf 3 cheezon se banayein yeh shaandaar mithai! | Kunal Kapur Recipes,"Festivities hon ya koi khushi ka mauka, bina Meethe ke sab adhoora hai! 🎇 Aaj hum banayenge sabka favorite aur bohot hi swadisht — Chana Dal Halwa. Is recipe ki sabse achi baat yeh hai ki yeh sirf kitchen mein milne wali basic cheezon jaise Chana Dal, Ghee, aur Sugar se ban jata hai. Maine is video mein kuch khaas tips share kiye hain jisse aapka halwa ekdum perfect, soft, aur daanedaar banega. Agar aapko Moong Dal Halwa pasand hai lekin uski mehnat se dar lagta hai, toh yeh quick version aapke liye perfect hai! Recipe try karein aur batayein aapko kaisi lagi! ❤️",https://www.youtube.com/watch?v=D4T5byF7X9U,"Chana dal (चना दाल) - 1 cup | Ghee (घी) - ½ cup | Green cardamom (इलाइची) - 10 nos | Black cardamom (काली इलाइची) - 1 no | Water (पानी) - 1 cup | Sugar (चीनी) - 6 tbsp | Saffron - (केसर) a pinch | Milk (दूध) - 1½ cups | Ghee (घी) - 2 tbsp | Cashew Nut | Almonds | Pista chopped - handful | https://youtu.be/WG0vekPi-4I | https://youtu.be/MT9UpM7aJkI | https://youtu.be/hejJcjK__X0 | 📸 Instagram: https://www.instagram.com/chefkunal​​​ | 00:00 Intro: The Secret to Perfect Chana Dal Halwa | 00:45 Preparing & Soaking the Chana Dal | 01:30 Grinding the Dal to the Right Texture | 02:15 The Roasting Process (Bhunai) with Desi Ghee | 04:10 Adding Milk and Sugar for Richness | 05:30 Getting the Perfect Daanedaar Consistency | 06:45 Final Garnish: Nuts and Cardamom | 07:20 Serving Suggestions & Storage Tips | Item URL: https://elements.envato.com/acoustic-day-EBSF4X5 | Item ID: EBSF4X5 | License Date: August 2nd, 2025 | Item License Code: C9S4JGY2X7","Don't forget to Like, Share, and Subscribe! | ------------------------------------------------------------------------------------- | Chana Dal Halwa | Ingredients: | Chana dal (चना दाल) - 1 cup | Ghee (घी) - ½ cup | Green cardamom (इलाइची) - 10 nos | Black cardamom (काली इलाइची) - 1 no | Water (पानी) - 1 cup | Sugar (चीनी) - 6 tbsp | Saffron - (केसर) a pinch | Milk (दूध) - 1½ cups | Ghee (घी) - 2 tbsp | Cashew Nut | Almonds | Pista chopped - handful | (काजू बादाम पिस्ता) | ------------------------------------------------------------------------------------- | Check out other #halwarecipe on my channel below: | https://youtu.be/iIcmjEkqDRA | https://youtu.be/WG0vekPi-4I | https://youtu.be/MT9UpM7aJkI | https://youtu.be/Djeweo_PcEo | https://youtu.be/hejJcjK__X0 | ------------------------------------------------------------------------------------- | Hi, I am Chef Kunal Kapur and this is my space, my channel. | Subscribe & Together let's cook. | 👉🏻 Click here to Subscribe: https://www.youtube.com/c/KunalKapur | 👉🏻 Website: http://www.chefkunalkapur.com/​​​​​​​ | -------------------------------------------------------------------------------------","Festivities hon ya koi khushi ka mauka, bina Meethe ke sab adhoora hai! 🎇 Aaj hum banayenge sabka favorite aur bohot hi swadisht — Chana Dal Halwa. Is recipe ki sabse achi baat yeh hai ki yeh sirf kitchen mein milne wali basic cheezon jaise Chana Dal, Ghee, aur Sugar se ban jata hai. Maine is video mein kuch khaas tips share kiye hain jisse aapka halwa ekdum perfect, soft, aur daanedaar banega. Agar aapko Moong Dal Halwa pasand hai lekin uski mehnat se dar lagta hai, toh yeh quick version aapke liye perfect hai! Recipe try karein aur batayein aapko kaisi lagi! ❤️ Don't forget to Like, Share, and Subscribe! ------------------------------------------------------------------------------------- Chana Dal Halwa Ingredients: Chana dal (चना दाल) - 1 cup Ghee (घी) - ½ cup Green cardamom (इलाइची) - 10 nos Black cardamom (काली इलाइची) - 1 no Water (पानी) - 1 cup Sugar (चीनी) - 6 tbsp Saffron - (केसर) a pinch Milk (दूध) - 1½ cups Ghee (घी) - 2 tbsp Cashew Nut | Almonds | Pista chopped - handful (काजू बादाम पिस्ता) ------------------------------------------------------------------------------------- Check out other #halwarecipe on my channel below: https://youtu.be/iIcmjEkqDRA https://youtu.be/WG0vekPi-4I https://youtu.be/MT9UpM7aJkI https://youtu.be/Djeweo_PcEo https://youtu.be/hejJcjK__X0 ------------------------------------------------------------------------------------- Hi, I am Chef Kunal Kapur and this is my space, my channel. Subscribe & Together let's cook. 👉🏻 Click here to Subscribe: https://www.youtube.com/c/KunalKapur 👉🏻 Website: http://www.chefkunalkapur.com/​​​​​​​ ------------------------------------------------------------------------------------- Follow Chef Kunal Kapur on your favorite Social Media Channels: 👥 Facebook: https://www.facebook.com/thekunalkapur​ 📸 Instagram: https://www.instagram.com/chefkunal​​​ 🐦 Twitter: https://twitter.com/ChefKunalKapur​​​​ 📌 Pinterest: https://in.pinterest.com/chefkunal ------------------------------------------------------------------------------------- Chapters: 00:00 Intro: The Secret to Perfect Chana Dal Halwa 00:45 Preparing & Soaking the Chana Dal 01:30 Grinding the Dal to the Right Texture 02:15 The Roasting Process (Bhunai) with Desi Ghee 04:10 Adding Milk and Sugar for Richness 05:30 Getting the Perfect Daanedaar Consistency 06:45 Final Garnish: Nuts and Cardamom 07:20 Serving Suggestions & Storage Tips ------------------------------------------------------------------------------------- Item Title: Acoustic Day Item URL: https://elements.envato.com/acoustic-day-EBSF4X5 Item ID: EBSF4X5 Author Username: Russell_Frederick Licensee: Kunal Kapur Registered Project Name: Chana Dal Halwa License Date: August 2nd, 2025 Item License Code: C9S4JGY2X7",D4T5byF7X9U,Kunal Kapur,https://www.youtube.com/@KunalKapur/videos,669,20260210,46199
