title,description,source_url,ingredients,instructions,raw_text,youtube_video_id,youtube_channel,youtube_channel_url,duration_seconds,upload_date,view_count,youtube_transcript_used
Crispy Medu Vada | Vada Recipes | South Indian Vada | Breakfast Recipes | Indian Breakfast,📌 Crispy & tasty vadas 😋 👉https://www.youtube.com/playlist?list=PLFhw-Rie62rSKrCS3IhNb-MgDBqHLrJQN 📌 Easy South Indian Breakfast Ideas: https://www.youtube.com/playlist?list=PLFhw-Rie62rTOl4dyFx68JSvuKawx-tH_ ▶ Next Recipe: https://youtu.be/bM_8f9flSbE Crispy Medu Vada is a classic South Indian breakfast recipe that is crispy on the outside and soft on the inside. This traditional vada recipe is perfect for breakfast or tiffin and pairs well with coconut chutney and sambar.,https://www.youtube.com/watch?v=Zjm9fQBBHiM,Urad Dal - 1 cup (soaked) | Water - about 1/4 cup | Salt - 1/2 tsp | Onion - 1 no. (finely chopped) | Green Chili - 2 nos. (finely chopped),"Soak the urad dal for 4 hrs | Strain the water and transfer the urad dal to a mixer jar. | Add the water gradually and grind it to a smooth and thick batter | Refrigerate the batter for 2 hrs | After 2 hrs, add salt, onions, green chilies, curry leaves to the batter and mix well | Take a banana leaf and wipe it with some water | Take a small amount of the batter and place it over the banana leaf and shape it (you can use water to help shape the vada) | Heat some oil for deep frying, slowly drop the vadas into the hot oil and deep fry them till they are golden brown in color (Maintain medium flame while frying the vadas) | Serve the Medu vada hot | You can buy our book and classes on http://www.21frames.in/shop | HAPPY COOKING WITH HOMECOOKING! | ENJOY OUR RECIPES","📌 Crispy & tasty vadas 😋 👉https://www.youtube.com/playlist?list=PLFhw-Rie62rSKrCS3IhNb-MgDBqHLrJQN 📌 Easy South Indian Breakfast Ideas: https://www.youtube.com/playlist?list=PLFhw-Rie62rTOl4dyFx68JSvuKawx-tH_ ▶ Next Recipe: https://youtu.be/bM_8f9flSbE Crispy Medu Vada is a classic South Indian breakfast recipe that is crispy on the outside and soft on the inside. This traditional vada recipe is perfect for breakfast or tiffin and pairs well with coconut chutney and sambar. If you are looking for a medu vada recipe, South Indian breakfast or other easy Indian tiffin ideas, you are at the right place....https://www.youtube.com/watch?v=BahH5aZqllg&list=PLFhw-Rie62rSUexCVEh96_HZv5CQkSs4l&pp=sAgC #MeduVada #CrispyMeduVada #VadaRecipes #SouthIndianVada #vada #homecooking #Garelu #uraddalvada #southindianbreakfast Here is the link to Amazon HomeCooking Store where I have curated products that I use and are similar to what I use for your reference and purchase https://www.amazon.in/shop/homecookingshow Prep time: 6 hrs Cook time: 30 mins Number of servings: 6-7 persons Ingredients Urad Dal - 1 cup (soaked) Water - about 1/4 cup Salt - 1/2 tsp Onion - 1 no. (finely chopped) Green Chili - 2 nos. (finely chopped) Curry Leaves Oil For Deep Frying Method Soak the urad dal for 4 hrs Strain the water and transfer the urad dal to a mixer jar. Add the water gradually and grind it to a smooth and thick batter Refrigerate the batter for 2 hrs After 2 hrs, add salt, onions, green chilies, curry leaves to the batter and mix well Take a banana leaf and wipe it with some water Take a small amount of the batter and place it over the banana leaf and shape it (you can use water to help shape the vada) Heat some oil for deep frying, slowly drop the vadas into the hot oil and deep fry them till they are golden brown in color (Maintain medium flame while frying the vadas) Serve the Medu vada hot You can buy our book and classes on http://www.21frames.in/shop HAPPY COOKING WITH HOMECOOKING! ENJOY OUR RECIPES WEBSITE: http://www.21frames.in/homecooking FACEBOOK - https://www.facebook.com/HomeCookingShow YOUTUBE: https://www.youtube.com/user/VentunoHomeCooking INSTAGRAM - https://www.instagram.com/homecookingshow A Ventuno Production : http://www.ventunotech.com",Zjm9fQBBHiM,YouTube Search Indian Recipes,ytsearch100:indian breakfast recipe ingredients method,259,20191022,3347720,False
6 Easy 15-Minute Japanese Breakfast Recipes | 1-Minute Miso Soup Recipe | Easy Rice Ball Recipes,"Easy Japanese breakfast recipes for beginners! Breakfast recipes including 6 different types of delicious, easy rice balls (onigiri). Also, you can see how to make miso soup (soup made with soybean paste) in ONLY 1 MINUTE! It's perfect for busy mornings, don't miss it! #japanesebreakfast #healthybreakfastrecipe #japanesefood #japanesecooking Recipe: https://misosoup.site/easy-6-rice-ball-breakfast-ideas/",https://www.youtube.com/watch?v=p3GBYdLO28I,・4.5 oz (130g) Cooked rice | ・1 tsp Butter | ・1 tsp Soy sauce | ・3 Egg | ・1 oz (30g) Crab stick (Imitation crab) | ・2 tbsp Minced green onion | ・A pinch of Salt | ・1/2 tsp Oil | ・1 tbsp Miso paste | ・1 tsp Dried bonito shavings | ・1-2 tsp Minced green onion | ・0.7 cup (170ml) Boiled water | 2. Spicy Cod Roe & Pickled Plum Rice Ball Breakfast | Ingredients [for 1 serving] | ・6 oz (170g) Cooked rice | ・1/2 tsp Salt | ・1 Pickled plum | ・1 tbsp Spicy cod roe | ・2 Egg | ・A pinch of Salt | ・A pinch of Sugar (optional) | ・1/2 tsp Oil | ・1.7 oz (50g) Carrot | ・1/2 tsp Sesame oil | ・1/2 tsp Soy sauce | ・1/3 tsp Grated garlic | ・A pinch of Salt | ・1/2 tsp White sesame seeds | ・1 oz (30g) Broccoli | ・1/2 tbsp Miso paste | ・1 tsp Dried bonito shavings | ・1-2 tsp Minced green onion | ・1 tsp Pickled plum | ・1 tsp Black sesame | ・0.7 cup (170ml) Boiled water | 3. Kombu & Cheese Rice Ball Breakfast | Ingredients [for 1 serving] | ・4.5 oz (130g) Cooked rice | ・1 tbsp Seasoned Kelp Strips* | ・1 tbsp Cubed cheese | ・1 tsp White sesame seeds | ・1/2 tsp Sesame oil | ・1/2 tsp Soy sauce | ・1 Egg | ・1 oz (30g) Spinach | ・A pinch of Salt | ・1/2 tsp Oil | ・1 tbsp Miso paste | ・1 tsp Dried bonito shavings | ・1-2 tsp Minced green onion | ・1 tsp Dried wakame seaweed | ・0.7 cup (170ml) Boiled water | 4. Wakame Rice Ball Breakfast | Ingredients [for 1 serving] | ・3.5 oz (100g) Cooked rice | ・2 tsp Dried wakame seaweed | ・1/2 tsp White sesame seeds | ・1/2-1 tsp Sesame oil | ・1/2 tsp Mirin | ・1/2 tsp Soy sauce | ・A pinch of Salt | ・1.7 oz (50g) Cabbage | ・1 oz (30g) Sausage | ・1/2 tsp Mirin | ・1/2 tsp Soy sauce | ・1 Egg | ・1/2 tsp Oil | ・1/2 tsp Ketchup | ・1 tbsp Miso paste | ・1 tsp Dried bonito shavings | ・1-2 tsp Minced green onion | ・0.7 cup (170ml) Boiled water | 5. Pickled Plum Rice Ball Breakfast | Ingredients [for 1 serving] | ・3.5 oz (100g) Cooked rice | ・1 Pickled plum (Salted plum) | ・0.7 cup (170ml) Water | ・1 tbsp Miso paste (Add 1/2 tsp dashi powder as needed) | ・1 oz (30g) Nanohana | ・1.4 oz (40g) Shishamo smelt | ・1/2 tsp Oil | 6. Egg & Crab Stick Rice Ball Breakfast | Ingredients [for 1 serving] | ・6 oz (170g) Cooked rice | ・1 oz (30g) Crab stick (Imitation crab) | ・1 Egg | ・2 tbsp Minced green onion | ・1/2 tsp Soy sauce | ・A pinch of Salt | ・0.7 oz (20g) Snap peas | ・A pinch of Salt | ・1/2 tsp Olive oil | ・6 oz (170g) Potato | ・2 tsp Miso paste | ・1 tsp Honey | ・1/2 tsp Butter,My tools & seasonings: https://misosoup.site/toolslist/ | 00:00 Grilled Rice Ball Breakfast | 02:24 Spicy Cod Roe & Pickled Plum Rice Ball Breakfast | 04:49 Kombu & Cheese Rice Ball Breakfast | 06:44 Wakame Rice Ball Breakfast | 08:45 Pickled Plum Rice Ball Breakfast | 10:38 Egg & Crab Stick Rice Ball Breakfast | 13:23 How to Make Miso Balls | Grilled Rice Ball Breakfast | Ingredients [for 1 serving] | Grilled rice ball | ・4.5 oz (130g) Cooked rice | ・1 tsp Butter | ・1 tsp Soy sauce | Rolled omelette | ・1 oz (30g) Crab stick (Imitation crab) | ・2 tbsp Minced green onion | ・A pinch of Salt | ・1/2 tsp Oil | Miso soup (made with miso ball) | ・1 tbsp Miso paste | ・1 tsp Dried bonito shavings | ・1-2 tsp Minced green onion | ・Fu (wheat gluten) | ・0.7 cup (170ml) Boiled water | ====================== | Spicy Cod Roe & Pickled Plum Rice Ball Breakfast | Ingredients [for 1 serving] | ・6 oz (170g) Cooked rice | ・1/2 tsp Salt | ・Nori seaweed | ・1 Pickled plum | ・1 tbsp Spicy cod roe | Rolled omelette | ・A pinch of Salt | ・A pinch of Sugar (optional) | ・1/2 tsp Oil | Carrot warm salad | ・1.7 oz (50g) Carrot | ・1/2 tsp Sesame oil | ・1/2 tsp Soy sauce | ・1/3 tsp Grated garlic | ・A pinch of Salt | ・1/2 tsp White sesame seeds | ・1 oz (30g) Broccoli | ・Salt and pepper | Miso soup (made with miso ball) | ・1/2 tbsp Miso paste | ・1 tsp Dried bonito shavings | ・1-2 tsp Minced green onion | ・1 tsp Pickled plum | ・1 tsp Black sesame | ・0.7 cup (170ml) Boiled water | ====================== | Kombu & Cheese Rice Ball Breakfast | Ingredients [for 1 serving] | ・4.5 oz (130g) Cooked rice | ・1 tbsp Seasoned Kelp Strips* | ・1 tbsp Cubed cheese | ・1 tsp White sesame seeds | ・1/2 tsp Sesame oil | ・1/2 tsp Soy sauce | *Please use regular kombu and salt when you don't have seasoned kelp strips. | ・1 oz (30g) Spinach | ・A pinch of Salt | ・1/2 tsp Oil | Miso soup (made with miso ball) | ・1 tbsp Miso paste | ・1 tsp Dried bonito shavings | ・1-2 tsp Minced green onion | ・1 tsp Dried wakame seaweed | ・0.7 cup (170ml) Boiled water | ====================== | Wakame Rice Ball Breakfast | Ingredients [for 1 serving] | ・3.5 oz (100g) Cooked rice | ・2 tsp Dried wakame seaweed | ・1/2 tsp White sesame seeds | ・1/2-1 tsp Sesame oil | ・1/2 tsp Mirin | ・1/2 tsp Soy sauce | ・A pinch of Salt | Cabbage stir-fry | ・1.7 oz (50g) Cabbage | ・1 oz (30g) Sausage | ・1/2 tsp Mirin | ・1/2 tsp Soy sauce | Scrambled egg | ・1/2 tsp Oil | ・1/2 tsp Ketchup | Miso soup (made with miso ball) | ・1 tbsp Miso paste | ・1 tsp Dried bonito shavings | ・1-2 tsp Minced green onion | ・0.7 cup (170ml) Boiled water | ====================== | Pickled Plum Rice Ball Breakfast | Ingredients [for 1 serving] | ・3.5 oz (100g) Cooked rice | ・1 Pickled plum (Salted plum) | ・Nori seaweed | ・0.7 cup (170ml) Water | ・1 tbsp Miso paste (Add 1/2 tsp dashi powder as needed) | ・1 oz (30g) Nanohana | ・Half of thin deep-fried tofu | Grilled shishamo smelt | ・1.4 oz (40g) Shishamo smelt | ・1/2 tsp Oil | ====================== | Egg & Crab Stick Rice Ball Breakfast | Ingredients [for 1 serving] | ・6 oz (170g) Cooked rice | ・1 oz (30g) Crab stick (Imitation crab) | ・Salt and pepper | ・2 tbsp Minced green onion | ・1/2 tsp Soy sauce | ・A pinch of Salt | ・0.7 oz (20g) Snap peas | ・A pinch of Salt | ・1/2 tsp Olive oil | Miso butter potato | ・6 oz (170g) Potato | ・2 tsp Miso paste | ・1 tsp Honey | ・1/2 tsp Butter,"Easy Japanese breakfast recipes for beginners! Breakfast recipes including 6 different types of delicious, easy rice balls (onigiri). Also, you can see how to make miso soup (soup made with soybean paste) in ONLY 1 MINUTE! It's perfect for busy mornings, don't miss it! #japanesebreakfast #healthybreakfastrecipe #japanesefood #japanesecooking Recipe: https://misosoup.site/easy-6-rice-ball-breakfast-ideas/ My tools & seasonings: https://misosoup.site/toolslist/ 【CHAPTER】 00:00 Grilled Rice Ball Breakfast 02:24 Spicy Cod Roe & Pickled Plum Rice Ball Breakfast 04:49 Kombu & Cheese Rice Ball Breakfast 06:44 Wakame Rice Ball Breakfast 08:45 Pickled Plum Rice Ball Breakfast 10:38 Egg & Crab Stick Rice Ball Breakfast 13:23 How to Make Miso Balls 1. Grilled Rice Ball Breakfast Ingredients [for 1 serving] Grilled rice ball ・4.5 oz (130g) Cooked rice ・1 tsp Butter ・1 tsp Soy sauce Rolled omelette ・3 Egg ・1 oz (30g) Crab stick (Imitation crab) ・2 tbsp Minced green onion ・A pinch of Salt ・1/2 tsp Oil Miso soup (made with miso ball) ・1 tbsp Miso paste ・1 tsp Dried bonito shavings ・1-2 tsp Minced green onion ・Fu (wheat gluten) ・0.7 cup (170ml) Boiled water ====================== 2. Spicy Cod Roe & Pickled Plum Rice Ball Breakfast Ingredients [for 1 serving] Rice ball ・6 oz (170g) Cooked rice ・1/2 tsp Salt ・Nori seaweed ・1 Pickled plum ・1 tbsp Spicy cod roe Rolled omelette ・2 Egg ・A pinch of Salt ・A pinch of Sugar (optional) ・1/2 tsp Oil Carrot warm salad ・1.7 oz (50g) Carrot ・1/2 tsp Sesame oil ・1/2 tsp Soy sauce ・1/3 tsp Grated garlic ・A pinch of Salt ・1/2 tsp White sesame seeds Broccoli ・1 oz (30g) Broccoli ・Salt and pepper Miso soup (made with miso ball) ・1/2 tbsp Miso paste ・1 tsp Dried bonito shavings ・1-2 tsp Minced green onion ・1 tsp Pickled plum ・1 tsp Black sesame ・0.7 cup (170ml) Boiled water ====================== 3. Kombu & Cheese Rice Ball Breakfast Ingredients [for 1 serving] Rice ball ・4.5 oz (130g) Cooked rice ・1 tbsp Seasoned Kelp Strips* ・1 tbsp Cubed cheese ・1 tsp White sesame seeds ・1/2 tsp Sesame oil ・1/2 tsp Soy sauce *Please use regular kombu and salt when you don't have seasoned kelp strips. Spinach egg ・1 Egg ・1 oz (30g) Spinach ・A pinch of Salt ・1/2 tsp Oil Miso soup (made with miso ball) ・1 tbsp Miso paste ・1 tsp Dried bonito shavings ・1-2 tsp Minced green onion ・1 tsp Dried wakame seaweed ・0.7 cup (170ml) Boiled water ====================== 4. Wakame Rice Ball Breakfast Ingredients [for 1 serving] Rice ball ・3.5 oz (100g) Cooked rice ・2 tsp Dried wakame seaweed ・1/2 tsp White sesame seeds ・1/2-1 tsp Sesame oil ・1/2 tsp Mirin ・1/2 tsp Soy sauce ・A pinch of Salt Cabbage stir-fry ・1.7 oz (50g) Cabbage ・1 oz (30g) Sausage ・1/2 tsp Mirin ・1/2 tsp Soy sauce Scrambled egg ・1 Egg ・1/2 tsp Oil ・1/2 tsp Ketchup Miso soup (made with miso ball) ・1 tbsp Miso paste ・1 tsp Dried bonito shavings ・1-2 tsp Minced green onion ・0.7 cup (170ml) Boiled water ====================== 5. Pickled Plum Rice Ball Breakfast Ingredients [for 1 serving] Rice ball ・3.5 oz (100g) Cooked rice ・1 Pickled plum (Salted plum) ・Nori seaweed Miso soup ・0.7 cup (170ml) Water ・1 tbsp Miso paste (Add 1/2 tsp dashi powder as needed) ・1 oz (30g) Nanohana ・Half of thin deep-fried tofu Grilled shishamo smelt ・1.4 oz (40g) Shishamo smelt ・1/2 tsp Oil ====================== 6. Egg & Crab Stick Rice Ball Breakfast Ingredients [for 1 serving] Rice ball ・6 oz (170g) Cooked rice ・1 oz (30g) Crab stick (Imitation crab) ・1 Egg ・Salt and pepper ・2 tbsp Minced green onion ・1/2 tsp Soy sauce ・A pinch of Salt Snap peas ・0.7 oz (20g) Snap peas ・A pinch of Salt ・1/2 tsp Olive oil Miso butter potato ・6 oz (170g) Potato ・2 tsp Miso paste ・1 tsp Honey ・1/2 tsp Butter",p3GBYdLO28I,YouTube Search Indian Recipes,ytsearch100:indian breakfast recipe ingredients method,1006,20220404,2829953,False
4 तरह से बनाएं झटपट रवा नाश्ता | 4 Tiffin recipes in 10 Mins | Rava/Sooji recipes | Chef RanveerBrar,"4 TYPES QUICK TIFFIN IDEAS - If you are someone who's always on the lookout for more tiffin/ breakfast/ naashta recipes, then this video is for you.. *********************** 𝗔𝗠𝗔𝗭🥘𝗡 𝗦𝗛🍳𝗣 🔪Knives I use - https://amzn.to/4ar57BI",https://www.youtube.com/watch?v=eChVFovGZ0o,"1 ½ cups Semolina, सूजी | 1 ½ cups Water, पानी | 4-5 no. Green chillies (less spicy & finely chopped) हरी मिर्च | 2 sprig Curry leaves, chopped, करी पत्ते | 3-4 tbsp fresh Coriander leaves, finely chopped, धनिया पत्ता | 2 no. medium Carrots (peeled & grated) गाजर | 1 ¼ cup Soaked semolina, भीगी हुई सूजी | 1 tbsp Green chillies (less spicy & finely chopped) हरी मिर्च | 1 tbsp Curry leaves, chopped, करी पत्ते | 1 tbsp fresh Coriander leaves, finely chopped, धनिया पत्ता | ¼ cup Carrot (peeled & grated) गाजर | 2 heaped tbsp Yellow moong dal, soaked, भीगी हुई मूंग दाल | Salt to taste, नमक स्वादअनुसार | ½ cup Curd, beaten, दही | 3-4 tbsp Semolina, सूजी | 1 tsp Oil, तेल | ¼ tsp Baking soda, बेकिंग सोडा | 1 tsp Ghee (for greasing) घी | Prepared Thick Batter, तयार किया हुआ मिश्रण | ⅓ cup Semolina, सूजी | ½ cup Prepared Thick Batter, तयार किया हुआ मिश्रण | 1 tbsp Oil (for greasing) तेल | Water as required, पानी | Salt to taste, नमक स्वादअनुसार | 1 tbsp Oil, तेल | 1 tbsp Oil, तेल | 1 tsp Ghee, घी | ¼ tsp small Mustard seeds, बारीक राई | ½ tsp Cumin seeds, जीरा | 2-3 tbsp Peanuts, मूंगफली | 1 tsp Chana dal, चना दाल | 1 tsp Urad dal, उड़द की दाल | 1 sprig Curry leaves, करी पत्ते | A pinch of Asafoetida, हींग | A pinch of Turmeric powder, हल्दी पाउडर | ½ tsp Black peppercorns, crushed, कुटी हुई काली मिर्च | 1 tsp Lemon juice, नींबू का रस | 1 ¼ cup Soaked semolina, भीगी हुई सूजी | 2 tbsp Green chillies (less spicy & finely chopped) हरी मिर्च | 1 tbsp Curry leaves, chopped, करी पत्ते | 2 tbsp fresh Coriander leaves, finely chopped, धनिया पत्ता | ¼ cup Carrots, grated, गाजर | 3 tbsp Semolina, सूजी | 1 cup Curd, beaten, दही | 1 no. large Potato (peeled & grated) आलू | 1 cup Water, पानी | Salt to taste, नमक स्वादअनुसार | 1 tsp Ghee, घी | Prepared Thin batter, तयार किया हुआ मिश्रण | ¼ cup Processed cheese, grated, चीज़ | 1 tbsp Green chutney, हरी चटनी | A pinch of Degi red chili powder, देगी लाल मिर्च पाउडर | 1 tsp Ghee, घी | Prepared Thin Batter, तयार किया हुआ मिश्रण | 2 no. Bread slice, ब्रेड","Check out the full recipe here - https://ranveerbrar.com/recipes/4-type-sooji-nashta/ | *********************** | For more fantastic recipes, check out the Ranveer Brar App: | 📲𝐀𝐧𝐝𝐫𝐨𝐢𝐝 - http://bit.ly/RBAppAndroid | 📲𝗶𝗢𝗦 - http://bit.ly/RBAppiOS | *********************** | 🌎 Follow Ranveer Brar here too: | ➡️ https://www.ranveerbrar.com | ➡️ https://www.facebook.com/RanveerBrar/ | ➡️ https://www.instagram.com/ranveer.brar/ | ➡️ https://twitter.com/ranveerbrar","4 TYPES QUICK TIFFIN IDEAS - If you are someone who's always on the lookout for more tiffin/ breakfast/ naashta recipes, then this video is for you.. *********************** 𝗔𝗠𝗔𝗭🥘𝗡 𝗦𝗛🍳𝗣 🔪Knives I use - https://amzn.to/4ar57BI 🛒RB Store - https://www.amazon.in/shop/chefranveer 📟Kitchen Appliances - https://bit.ly/KitchenAppliancesIUse *********************** ⏩𝓒𝓵𝓲𝓬𝓴 𝓽𝓸 𝓢𝓾𝓫𝓼𝓬𝓻𝓲𝓫𝓮 : https://goo.gl/UE2pmL *********************** 𝗖𝗵𝗲𝗰𝗸 𝗼𝘂𝘁 𝘁𝗵𝗲𝘀𝗲 𝗿𝗲𝗰𝗶𝗽𝗲𝘀 𝘁𝗼𝗼: 5 in 1 Breakfast recipes - https://youtu.be/jIurvPodGB8 Instant Masala Dosa - https://youtu.be/rJSICjc5s84 *********************** SOOJI NAASHTA RECIPES Preparation time 10-15 minutes Cooking time 20-25 minutes Serve 4-5 Ingredients For Soaking Semolina 1 ½ cups Semolina, सूजी 1 ½ cups Water, पानी For Topping 4-5 no. Green chillies (less spicy & finely chopped) हरी मिर्च 2 sprig Curry leaves, chopped, करी पत्ते 3-4 tbsp fresh Coriander leaves, finely chopped, धनिया पत्ता 2 no. medium Carrots (peeled & grated) गाजर For Thick Batter 1 ¼ cup Soaked semolina, भीगी हुई सूजी 1 tbsp Green chillies (less spicy & finely chopped) हरी मिर्च 1 tbsp Curry leaves, chopped, करी पत्ते 1 tbsp fresh Coriander leaves, finely chopped, धनिया पत्ता ¼ cup Carrot (peeled & grated) गाजर 2 heaped tbsp Yellow moong dal, soaked, भीगी हुई मूंग दाल Salt to taste, नमक स्वादअनुसार ½ inch Ginger (peeled & grated) अदरक ½ cup Curd, beaten, दही 3-4 tbsp Semolina, सूजी 1 tsp Oil, तेल ¼ tsp Baking soda, बेकिंग सोडा For Sooji Ka Dhokla 1 tsp Ghee (for greasing) घी Prepared Thick Batter, तयार किया हुआ मिश्रण For Gul Gule Mixture ⅓ cup Semolina, सूजी ½ cup Prepared Thick Batter, तयार किया हुआ मिश्रण 1 tbsp Oil (for greasing) तेल For Sooji Ke Gul Gule Water as required, पानी Salt to taste, नमक स्वादअनुसार 1 tbsp Oil, तेल For Gul Gule Tadka 1 tbsp Oil, तेल 1 tsp Ghee, घी ¼ tsp small Mustard seeds, बारीक राई ½ tsp Cumin seeds, जीरा 2-3 tbsp Peanuts, मूंगफली 1 tsp Chana dal, चना दाल 1 tsp Urad dal, उड़द की दाल 1 sprig Curry leaves, करी पत्ते A pinch of Asafoetida, हींग A pinch of Turmeric powder, हल्दी पाउडर Cooked Gul gule, cut into half, पके हुए गुल गुले ½ tsp Black peppercorns, crushed, कुटी हुई काली मिर्च 1 tsp Lemon juice, नींबू का रस For Garnish Coriander sprig, धनिया पत्ता For Thin Batter 1 ¼ cup Soaked semolina, भीगी हुई सूजी 2 tbsp Green chillies (less spicy & finely chopped) हरी मिर्च 1 tbsp Curry leaves, chopped, करी पत्ते 2 tbsp fresh Coriander leaves, finely chopped, धनिया पत्ता ¼ cup Carrots, grated, गाजर 3 tbsp Semolina, सूजी 1 cup Curd, beaten, दही 1 no. large Potato (peeled & grated) आलू 1 cup Water, पानी Salt to taste, नमक स्वादअनुसार For Sooji Ka Cheela 1 tsp Ghee, घी Prepared Thin batter, तयार किया हुआ मिश्रण ¼ cup Processed cheese, grated, चीज़ 1 tbsp Green chutney, हरी चटनी For Garnish Mayonnaise, मेयोनेज़ A pinch of Degi red chili powder, देगी लाल मिर्च पाउडर Coriander sprig, धनिया पत्ता For Sooji Ke French Toast 1 tsp Ghee, घी Prepared Thin Batter, तयार किया हुआ मिश्रण 2 no. Bread slice, ब्रेड For Garnish Tomato ketchup, टमाटर केचप Coriander sprig, धनिया पत्ता Process Check out the full recipe here - https://ranveerbrar.com/recipes/4-type-sooji-nashta/ *********************** For more fantastic recipes, check out the Ranveer Brar App: 📲𝐀𝐧𝐝𝐫𝐨𝐢𝐝 - http://bit.ly/RBAppAndroid 📲𝗶𝗢𝗦 - http://bit.ly/RBAppiOS *********************** 🌎 Follow Ranveer Brar here too: ➡️ https://www.ranveerbrar.com ➡️ https://www.facebook.com/RanveerBrar/ ➡️ https://www.instagram.com/ranveer.brar/ ➡️ https://twitter.com/ranveerbrar #tiffinrecipesforkids #lunchboxideas #ranveerbrar #soojinashta #ravarecipes #soojirecipes #dhokla #uthappam #gulgulerecipe",eChVFovGZ0o,YouTube Search Indian Recipes,ytsearch100:indian breakfast recipe ingredients method,1080,20240326,3070020,False
